titulo,subtitulo,texto,data,url,portal
Ypê: Deputado Fahur lava o bigode com o detergente,"Diante da cena dantesca, um seguidor ainda comentou: “É para isso que eu pago o meu deputado”","Diante da cena dantesca, um seguidor ainda comentou: “É para isso que eu pago o meu deputado”

00:00 A+ A-

Ler o resumo da notícia Deputado federal Sargento Fahur (PL) lavou o bigode com detergente Ypê, divulgando o ato em vídeo no X.

O gesto ocorreu enquanto a Ypê tem produtos suspensos pela Anvisa desde 7 de maio, por lotes terminados em “1”.

A suspensão segue denúncias que surgiram após declarações do deputado Nikolas Ferreira (PL) sobre suposto conluio entre Anvisa e os irmãos Batista.

Seguidores do discurso de Ferreira chegaram a beber o detergente, intensificando a polêmica em torno da marca.

Dentre os inúmeros bolsonaristas defensores do detergente Ypê, o mais folclórico, sem sombra de dúvidas, foi o deputado Sargento Fahur (PL), que resolveu lavar seu bigode com o produto.

Diante da cena dantesca, um seguidor do político de extrema direita ainda comentou: “É para isso que eu pago o meu deputado.”

Como militar disciplinado que é, ele resolveu seguir a tropa.

Veja o vídeo abaixo:

A origem da história

O deputado federal Nikolas Ferreira (PL) foi às redes nesta semana em mais uma tese mentirosa e estapafúrdia. Desta vez, ele inventa uma teoria da conspiração sem precedentes que envolve a Agência Nacional de Vigilância Sanitária (Anvisa), a Ypê e a Minuano dos irmãos Joesley e Wesley Batista. Suas mentiras bateram forte no bolsonarismo e alguns de seus seguidores chegaram até mesmo a beber detergente.

A declaração do deputado sobre uma suposta ação da Anvisa para favorecer os irmãos Batista, donos da concorrente Flora, em meio à suspensão de produtos da Ypê, mistura fatos confirmados com acusações sem fundamento.

A Anvisa determinou, no último dia 7 de maio, a suspensão da fabricação e o recolhimento de diversos produtos da marca Ypê, incluindo detergentes, lava-roupas e desinfetantes pertencentes a lotes terminados com o número “1”. A decisão ocorreu após a identificação de falhas graves no controle microbiológico em uma unidade da empresa localizada",2026-05-12 13:40:22-03:00,https://revistaforum.com.br/politica/ype-deputado-fahur-lava-bigode-detergente/,revistaforum
"Flávio Bolsonaro escala Nikolas, Zanatta e Gayer para novo “gabinete do ódio” de 2026","Flávio Bolsonaro escalou Nikolas Ferreira, Julia Zanatta e Gustavo Gayer para tropa digital da pré-campanha ao Planalto.","Sob o pretexto de combater fake news, senador articula tropa de choque digital; Fórum já havia revelado elo com exército de clipadores de Nikolas comandado por aliados de Pablo Marçal.

00:00 A+ A-

Ler o resumo da notícia Senador Flávio Bolsonaro (PL‑RJ) criou uma tropa digital de choque com parlamentares aliados para enfrentar acusações nas redes durante sua pré‑campanha ao Planalto.

A articulação foi definida em reunião no gabinete do senador, em Brasília, com Julia Zanatta (PL‑SC), Gustavo Gayer (PL‑GO), Maurício Marcon (PL‑RS) e Nikolas Ferreira (PL‑MG) por videoconferência.

Em vídeo obtido pela Revista Fórum, Flávio pediu “milagre” para “libertar o Brasil das garras do governo” e o grupo entoou o bordão “Acorda Brasil”.

O exército de clipadores de Nikolas Ferreira está conectado a generais da campanha de Pablo Marçal, ampliando a rede de apoio digital.

Flávio Bolsonaro (PL-RJ) escalou deputados bolsonaristas com forte atuação nas redes para integrar uma frente digital de sua pré-campanha à Presidência em 2026. A reunião ocorreu no gabinete do senador, em Brasília, e teve a presença de Julia Zanatta (PL-SC), Gustavo Gayer (PL-GO) e Maurício Marcon (PL-RS). Nikolas Ferreira (PL-MG) participou por videoconferência.

A informação foi publicada pela coluna Painel. O grupo foi chamado para atuar na reação a acusações que a campanha de Flávio classificar como “fake news”.

Nikolas Ferreira é o nome central na articulação de Flávio Bolsonaro

A entrada de Nikolas Ferreira é o dado político mais relevante da movimentação. O deputado mineiro tem uma das maiores estruturas digitais do bolsonarismo e já vinha orbitando a pré-campanha de Flávio Bolsonaro antes da reunião no gabinete.

A Fórum revelou em março que Flávio Bolsonaro participou de uma videochamada com clipadores ligados ao entorno digital de Nikolas Ferreira. Gustavo Gayer também aparece na reunião virtual.

Na gravação obtida pela Fórum, Flávio fala a integrantes do grupo “Acorda Brasil”, faz uma oração e",2026-05-08 10:29:28-03:00,https://revistaforum.com.br/politica/flavio-bolsonaro-tropa-digital/,revistaforum
Master: Irmão de Ciro Nogueira contrata advogado indicado por Bolsonaro à Corte de Direitos Humanos,"Alvo da Operação Compliance Zero por ser administrador da CNLF Empreendimentos Imobiliários Ltda, empresa que tem as iniciais do nome do irmão, Ciro Nogueira","Contratado por Raimundo Nogueira, irmão de Ciro, para defesa no caso Master, Rodrigo Mudrovitsch foi indicado e pode julgar, como presidente da Corte Interamericana de Direitos Humanos, caso envolvendo ex-presidente.

00:00 A+ A-

Ler o resumo da notícia Raimundo Neto e Silva Nogueira Lima, irmão do deputado Ciro Nogueira (PP‑PI), contratou o criminalista Rodrigo Mudrovitsch para defendê‑lo na Operação Compliance Zero, que investiga a CNLF Empreendimentos Imobiliários Ltda por supostos recebimentos de propina do Banco Master.

Mudrovitsch, indicado por Jair Bolsonaro em 2020 para a Corte Interamericana de Direitos Humanos, pode presidir julgamento de ação de bolsonaristas que buscam revisar a condenação de Bolsonaro no STF.

A nomeação foi criticada por sua falta de experiência em direitos humanos, já que o advogado é conhecido por defender ruralistas no Marco Temporal e por atuar em acordos de delação na Operação Lava Jato.

A Polícia Federal aponta que o ex‑ministro da Casa Civil teria recebido R$ 300 mil mensais – cerca de R$ 18 milhões – como parte de um suposto “Mensalão do Master” ligado ao lobby de Daniel Vorcaro no Congresso.

Alvo da Operação Compliance Zero por ser administrador da CNLF Empreendimentos Imobiliários Ltda, empresa que tem as iniciais do nome do irmão, Ciro Nogueira (PP-PI), e teria sido usada para receber propinas do Banco Master, segundo a Polícia Federal, Raimundo Neto e Silva Nogueira Lima contratou para fazer sua defesa o criminalista Rodrigo Mudrovitsch, indicado em 2020 por Jair Bolsonaro (PL) para a Corte Interamericana de Direitos Humanos.

ENTENDA: Ciro Nogueira coloca bomba Master no colo de Flávio Bolsonaro e causa uma hecatombe na pré-campanha

Na Presidência da Corte até 2027, Mudrovitsch pode julgar uma ação de bolsonaristas que pedem a revisão da condenação de Bolsonaro pelo Supremo Tribunal Federal (STF) e a permanência do ex-presidente em prisão domiciliar.

O juiz brasileiro foi indicado por Bolsonaro à corte em um momento ",2026-05-12 07:47:43-03:00,https://revistaforum.com.br/politica/master-irmao-de-ciro-nogueira-advogado-indicado-por-bolsonaro/,revistaforum
Posse de Kássio no TSE e “nova” anistia: As apostas do bolsonarismo para virar a mesa outra vez,"Para compreender a gravidade do momento, é preciso revisitar o que ocorreu em 2022. Naquele pleito, a Justiça Eleitoral brasileira, sob a liderança firme,","Extrema direita está apostando todas as fichas numa mudança geral de ares para retomar agenda golpista. Tudo isso a menos de seis meses da eleição presidencial. Entenda

00:00 A+ A-

Ler o resumo da notícia Kássio Nunes Marques assumiu a presidência do Tribunal Superior Eleitoral (TSE) nesta terça‑feira (12) em Brasília.

O bolsonarismo vê a posse como “janela de oportunidades” para retomar influência política e enfraquecer as barreiras democráticas dos últimos quatro anos.

Jair Bolsonaro indicou Kássio ao cargo, esperando que o ministro represente seus interesses no Judiciário.

A mudança ocorre após a atuação rigorosa de Alexandre de Moraes, que o movimento busca reverter para favorecer a estratégia de caos informacional.

O Brasil assiste, nesta terça-feira (12), a uma movimentação de peças no tabuleiro institucional que evoca os fantasmas mais sombrios de um passado muito recente. A troca de comando no Tribunal Superior Eleitoral, com a ascensão do ministro Kássio Nunes Marques à presidência da Corte, não é apenas um rito de passagem burocrático ou uma alternância de poder protocolar. Para o ecossistema bolsonarista, o evento é lido como a abertura de uma “janela de oportunidades” estratégica para restaurar a tática do caos informacional e pavimentar o caminho de volta ao Palácio do Planalto, sabotando as travas democráticas estabelecidas a duras penas nos últimos quatro anos.

Para compreender a gravidade do momento, é preciso revisitar o que ocorreu em 2022. Naquele pleito, a Justiça Eleitoral brasileira, sob a liderança firme, técnica e muitas vezes solitária do ministro Alexandre de Moraes, operou como um autêntico para-choque institucional contra a barbárie. O TSE de então não apenas organizou o pleito; ele combateu, em tempo real, a principal e mais letal arma da extrema direita: a mentira industrializada e a desinformação algorítmica.

Decisões céleres de retirada de conteúdos, multas pesadas contra redes de desinformação e o desmantelamento de ecossiste",2026-05-12 14:19:23-03:00,https://revistaforum.com.br/politica/posse-kassio-tse-anistia-apostas-bolsonarismo/,revistaforum
Lula na Casa Branca: presidente sai mais forte de encontro com Trump,"“Presidente muito dinâmico, um homem inteligente”, assim Donald Trump descreveu Luiz Inácio Lula da Silva após o encontro entre os dois na Casa Branca, na","Presidente brasileiro foi recebido com tapete vermelho por Donald Trump. Na pauta: relações comerciais, combate ao crime organizado, entre outros temas, revelados em coletiva de imprensa na embaixada do Brasil após o encontro

00:00 A+ A-

Ler o resumo da notícia Lula e Donald Trump se encontraram na Casa Branca, em Washington, na quinta‑feira (7).

Em reunião cordial, Lula abordou o déficit comercial de US$ 14 bi do Brasil com os EUA e a diferença de tarifas.

O presidente brasileiro propôs criar um grupo de trabalho para retomar negociações comerciais em até 30 dias.

Trump elogiou Lula, chamando‑o de “presidente muito dinâmico e inteligente”, reforçando a postura de Lula após crises internas.

“Presidente muito dinâmico, um homem inteligente”, assim Donald Trump descreveu Luiz Inácio Lula da Silva após o encontro entre os dois na Casa Branca, na última quinta-feira (7) em Washington. A descrição feita pelo presidente dos EUA não poderia ser mais acertada: enquanto setores da imprensa alardeavam o fim do governo Lula, após amargar traições no Congresso na última semana, o presidente brasileiro voltou a mostrar vigor, reposicionando a agenda política dentro e fora do Brasil.

Com o foco no fortalecimento das relações bilaterais, os dois presidentes trataram de temas econômicos e estratégicos. Em ambiente cordial, Lula revelou ter abordado a questão comercial, um dos temas centrais atualmente na relação entre os dois países. “Tem uma divergência entre eles e nós que ficou explicitada na reunião. O ministro dele falou uma coisa, os nossos ministros falaram outra”, disse.

A equipe brasileira argumenta que o Brasil atualmente tem déficit de US$ 14 bilhões com os EUA. Por outro lado, a administração Trump acusa a alta taxação dos impostos brasileiros. Contudo, observou Lula, a média do imposto cobrado pelo Brasil é de 2,7%, contrastando com as altas tarifas impostas pelos norte-americanos.

Como forma de superação do impasse, Lula anunciou, na entrevista, uma nova roda",2026-05-08 20:07:54-03:00,https://revistaforum.com.br/politica/lula-na-casa-branca-presidente-sai-mais-forte-de-encontro-com-trump/,revistaforum
Revista Fórum,,"BLOG DO ROVAI

Renato Rovai

Lula foi traído no Senado por essa gente que derrubou a indicação do Messias porque eles queriam que o presidente segurasse as investigações na PF. Vejam só como é tudo boa gente.",,https://revistaforum.com.br/editoria/blogs/,revistaforum
Governo Lula vai lançar financiamento para motoristas de app e taxistas; entenda,"Anúncio foi feito por Guilherme Boulos, ministro da Secretaria-Geral da Presidência da República","00:00 A+ A-

Ler o resumo da notícia Governo federal, sob a presidência de Lula, lançará financiamento para motoristas de apps e taxistas.

O crédito terá juros em torno de 12% ao ano, abaixo da Selic (14,5%) e das taxas de mercado (acima de 20%).

O programa visa reduzir a dependência de veículos alugados, oferecendo carência de seis meses e prazo de pagamento de até seis anos.

Inspirado no “Move Brasil”, atenderá cerca de 2,2 milhões de trabalhadores de plataformas como Uber, 99 Táxi, iFood e InDrive.

O governo do presidente Lula (PT) está fechando os detalhes e deve lançar, até o fim de maio, programa de financiamento de veículos para motoristas de aplicativo e taxistas. O anúncio foi feito, nesta terça-feira (12), pelo ministro da Secretaria-Geral da Presidência, Guilherme Boulos (PSOL).

O titular da pasta ressaltou que a iniciativa busca reduzir a dependência de veículos alugados, principalmente por trabalhadores de plataformas, o que compromete parte da renda com o pagamento de diárias.

“Um dos grandes problemas do motorista de aplicativo, de Uber, é que, às vezes, o carro não é dele. Muitos alugam carro em locadora, e passam metade do dia de trabalho só para pagar a diária do carro”, relatou Boulos, durante entrevista ao programa “Bom Dia, Ministro”.

O programa deve ser semelhante ao “Move Brasil”, lançado no final de abril, voltado à renovação da frota de caminhões e ônibus. O objetivo central é oferecer financiamento em condições mais favoráveis, com juros menores e maior prazo para pagamento.

O governo brasileiro estima que existem, aproximadamente, 2,2 milhões de trabalhadores de plataformas digitais como Uber, 99 Táxi, iFood e InDrive.

Juros abaixo do mercado e inferiores à Selic

A equipe econômica está em fase final de estudos sobre a linha de crédito subsidiado, com juros abaixo dos praticados no mercado e inferiores à Selic, atualmente em 14,50% ao ano.

Integrantes do governo afirmam que o programa deve ter juros ao redor de 12% ao ano, bem a",2026-05-12 13:20:51-03:00,https://revistaforum.com.br/politica/governo-lula-financiamento-app-taxistas/,revistaforum
"Crise no Rio: Ricardo Couto exonera 1,6 mil apadrinhados e deputados ameaçam expor “amantes” de desembargadores","Ricardo Couto chega a 1,6 mil exonerações no RJ e provoca reação de deputados da Alerj, que ameaçam expor supostas amantes de desembargadores.","Governador interino avança contra a máquina política de Cláudio Castro com filtro de integridade do GSI; em retaliação, aliados do ex-mandatário na Alerj prometem vazar lista de supostas funcionárias fantasmas ligadas ao Judiciário.

00:00 A+ A-

Ler o resumo da notícia O secretário de Justiça do Rio, Ricardo Couto, exonerou 1 600 servidores apadrinhados.

A exoneração ocorre no contexto de crise institucional que envolve o judiciário estadual.

Deputados estaduais anunciaram que vão divulgar supostos relacionamentos amorosos de desembargadores.

As iniciativas visam pressionar a magistratura e restaurar a confiança na gestão pública.

O governador em exercício do Rio de Janeiro, Ricardo Couto de Castro, elevou a crise institucional fluminense a um ponto de ruptura nesta semana. O Executivo estadual atingiu a marca de aproximadamente 1,6 mil exonerações de cargos comissionados, desidratando de forma drástica a base de sustentação política do ex-governador Cláudio Castro (PL). Em retaliação à perda de controle da máquina, deputados da Assembleia Legislativa do Rio de Janeiro (Alerj) ameaçam divulgar uma suposta lista de mulheres ligadas a desembargadores que receberiam salários da Casa sem trabalhar.

A ofensiva de bastidor expõe uma guerra aberta entre os poderes Legislativo e Judiciário no estado. A informação sobre a ameaça foi revelada pelo jornalista Octavio Guedes, no blog do G1. Até o momento, a suposta lista não foi apresentada e não há documentos públicos que comprovem a identidade das funcionárias. O movimento é tratado estritamente como chantagem política para tentar frear o avanço do Palácio Guanabara sobre os indicados políticos.

O pente-fino e o filtro do GSI nas nomeações

Ricardo Couto, que é desembargador e presidente licenciado do Tribunal de Justiça do Rio de Janeiro (TJRJ), assumiu o governo de forma interina após o colapso da linha sucessória estadual. Seu alvo principal tem sido as estruturas controladas pelo antigo governo. O número de cortes ",2026-05-08 10:29:48-03:00,https://revistaforum.com.br/politica/ricardo-couto-exoneracoes-alerj/,revistaforum
Alexandre de Moraes é sorteado relator de ações contra o PL da Dosimetria,Ministro Alexandre de Moraes dá prazo para governo e Congresso se manifestarem sobre norma que diminui penas de condenados por tentativa de golpe de Estado,"Ministro dá prazo para governo e Congresso se manifestarem sobre norma que diminui penas de condenados por tentativa de golpe de Estado

ALEXANDRE DE MORAES é SORTEADO RELATOR DE AçõES CONTRA O PL DA DOSIMETRIA

ALEXANDRE DE MORAES é SORTEADO RELATOR DE AçõES CONTRA O PL DA DOSIMETRIA

00:00 A+ A-

Ler o resumo da notícia Alexandre de Moraes foi sorteado relator das ações que contestam o Projeto de Lei da Dosimetria.

O ministro do Supremo Tribunal Federal (STF) Alexandre de Moraes foi sorteado como relator das duas primeiras ações que chegaram à Corte questionando a constitucionalidade da chamada Lei da Dosimetria (Lei 15.402/2026), que reduz as penas e flexibiliza a progressão do regime de pessoas condenadas por tentativa de golpe de Estado e pelo 8 de Janeiro.

O Congresso Nacional derrubou o veto integral do presidente Luiz Inácio Lula da Silva (PT) no dia 30 de abril e, nesta sexta-feira (8), o presidente do Senado, Davi Alcolumbre (União Brasil-AP), promulgou a lei após o prazo concedido ao chefe do Executivo para a promulgação expirar.

As ações foram ajuizadas pela Associação Brasileira de Imprensa (ABI) e pela federação partidária PSOL-Rede nesta sexta. Nas Ações Diretas de Inconstitucionalidade (ADIs) 7966 e 7967 é questionada a promulgação da norma que alterou dispositivos da Lei de Execução Penal e do Código Penal.

O que dizem as ações relatadas por Alexandre de Moraes

A federação PSOL-Rede e a ABI apontam que a nova lei cria tratamento executório mais favorável para crimes voltados à ruptura institucional. Segundo as ADIs, os condenados por atentados à ordem democrática passariam a receber regime mais brando do que o aplicado a autores de crimes violentos comuns.

Outro argumento diz respeito à alegada violação ao princípio constitucional da individualização da pena, já que a Constituição exige que a sanção penal considere a gravidade concreta da conduta e as circunstâncias pessoais do réu, vedando que o legislador estabeleça mecanismos automáticos de",2026-05-08 22:09:18-03:00,https://revistaforum.com.br/politica/alexandre-de-moraes-relator-golpistas/,revistaforum
Diretor da Anvisa responsável por gerência que suspendeu produtos da Ypê foi indicado por Bolsonaro,"Após a Agência Nacional de Vigilância Sanitária (Anvisa) ter anunciado, na quinta-feira (7), medidas relacionadas a produtos da Ypê, depois de identificar","Decisão da agência de suspender produtos por risco de contaminação gerou teorias da conspiração nas redes, mas indicação de diretor pelo ex-presidente desmonta a narrativa

00:00 A+ A-

Ler o resumo da notícia A matéria menciona apenas as organizações Anvisa e Ypê.

Não há informações adicionais sobre fatos, datas ou locais.

Não foram identificados envolvidos ou eventos específicos.

O conteúdo carece de detalhes para contextualização.

Após a Agência Nacional de Vigilância Sanitária (Anvisa) ter anunciado, na quinta-feira (7), medidas relacionadas a produtos da Ypê, depois de identificar risco de contaminação microbiológica em itens fabricados pela empresa, bolsonaristas têm divulgado nas redes sociais uma narrativa de que a empresa dona da marca estaria sofrendo “perseguição”.

Postagens também indicam um suposto uso da “máquina do Estado” contra a empresa por conta de integrantes da família Beira, controladora da Química Amparo, detentora da marca, terem feito doações que somaram R$ 1 milhão à campanha de reeleição de Jair Bolsonaro, em 2022.

O problema da narrativa esbarra no fato de que o diretor que comanda atualmente a quarta diretoria da Anvisa, Daniel Meirelles Fernandes Pereira, que abriga a Gerência-Geral de Inspeção e Fiscalização Sanitária (GGFIS), responsável pela Resolução-RE nº 1.834/2026 que determina as medidas relativas aos produtos Ypê, foi indicado em 2022 pelo então presidente Jair Bolsonaro.

O Regimento Interno da Anvisa (RDC nº 255, de 10 de dezembro de 2018) estabelece que a Gerência-Geral de Inspeção e Fiscalização Sanitária atua sob a supervisão direta da Quarta Diretoria, responsável por guiar as ações fiscais e representar a área técnica nas decisões colegiadas da Agência.

Ou seja, a gerência que determinou as medidas no caso dos produtos Ypê é supervisionada e tem uma relação de subordinação hierárquica e vinculação administrativa e estratégica ao diretor indicado por Bolsonaro.

Quem é o diretor da Anvisa indicado por Bolsonaro

Da",2026-05-09 17:03:35-03:00,https://revistaforum.com.br/politica/diretor-da-anvisa-responsavel-por-gerencia-que-suspendeu-produtos-da-ype-foi-indicado-por-bolsonaro/,revistaforum
China em foco,,"CHINA EM FOCO

Yuri Ferreira

Oitenta anos após a abertura do tribunal, universidades chinesas lançam tradução completa dos registros do processo — 40 volumes, mais de 20 mil páginas e 22 milhões de caracteres — até então disponíveis apenas em inglês e japonês",,https://revistaforum.com.br/editoria/global/china-em-foco/,revistaforum
"Gleisi, Deltan, Curi e Filipe Barros travam disputa voto a voto pelo Senado no PR, diz pesquisa","Ex-senador Álvaro Dias lidera pesquisa, com quatro nomes empatados na segunda colocação; confira os números","Ex-senador Álvaro Dias lidera levantamento, com quatro nomes empatados na segunda colocação; confira os números

GLEISI, DELTAN, CURI E FILIPE BARROS TRAVAM DISPUTA VOTO A VOTO PELO SENADO NO PR, DIZ PESQUISA

GLEISI, DELTAN, CURI E FILIPE BARROS TRAVAM DISPUTA VOTO A VOTO PELO SENADO NO PR, DIZ PESQUISA

00:00 A+ A-

Ler o resumo da notícia Pesquisa divulgada na segunda‑feira (11) indica indefinição na corrida pelo Senado no Paraná.

No cenário completo, ex‑senador Álvaro Dias (MDB) lidera com 39,3% das intenções de voto.

A segunda vaga apresenta empate técnico entre Deltan Dallagnol (Novo) 26,1%, Gleisi Hoffmann (PT) 25,2%, Filipe Barros (PL) 23,6% e Alexandre Curi (Republicanos) 22,4%, dentro da margem de erro de 2,6 pontos.

Ao retirar Álvaro Dias da simulação, o empate persiste: Filipe Barros 30,0%, Dallagnol 29,3%, Hoffmann 27,4% e Curi 27,3%.

Uma pesquisa divulgada nesta segunda-feira (11) revela um cenário de indefinição na corrida pelo Senado no estado do Paraná.

No primeiro cenário estimulado, o ex-senador Alvaro Dias (MDB) assume a liderança isolada com 39,3% das intenções de voto. A briga pela segunda vaga, no entanto, apresenta um empate técnico quádruplo dentro da margem de erro de 2,6 pontos percentuais.

O ex-procurador da Lava Jato Deltan Dallagnol (Novo) aparece com 26,1%, seguido pela deputada federal Gleisi Hoffmann (PT), com 25,2%, pelo deputado federal Filipe Barros (PL), com 23,6%, e pelo deputado estadual Alexandre Curi (Republicanos), com 22,4%.

Mais atrás, pontuam a jornalista Cristina Graeml (PSD) com 14,5%, a deputada estadual Rosane Ferreira (PV) com 5,4%, e o deputado federal Luiz Carlos Hauly (Podemos) com 3,1%. Os que disseram não votar em nenhum, em branco ou nulo somam 7,3%, enquanto 5,1% não souberam ou não opinaram.

Outros cenários da pesquisa no Paraná

Quando o nome de Alvaro Dias é retirado da cartela, no segundo cenário, a disputa pela liderança fica embolada, configurando um novo empate técnico quádruplo nas primeiras po",2026-05-11 18:40:55-03:00,https://revistaforum.com.br/politica/senado-empate-parana-pesquisa/,revistaforum
Revista Fórum,,"Opinião

Washington Araújo

Entre a visão política de Juscelino Kubitschek, o gesto urbanístico de Lúcio Costa, a poesia arquitetônica de Oscar Niemeyer e a obstinação construtiva de Israel Pinheiro, a nova capital brasileira encontrou na literatura de Clarice Lispector uma das primeiras e mais penetrantes interpretações culturais de sua existência.",,https://revistaforum.com.br/editoria/opiniao/,revistaforum
