titulo,subtitulo,texto,data,url,portal
"TV Fórum: Lula deveria cancelar reunião com Trump por ação ‘lamentável’ dos EUA no Brasil, diz Sérgio Amadeu","No Fórum Onze e Meia desta terça-feira (5), o sociólogo Sérgio Amadeu comentou sobre a reunião do presidente Lula (PT) com o presidente dos Estados Unidos,","00:00 A+ A-

Ler o resumo da notícia Sérgio Amadeu, no Fórum Onze e Meia (5 de maio), afirmou que Lula deve cancelar a reunião com o presidente dos EUA, Donald Trump.

O sociólogo qualificou a ação dos Estados Unidos no Brasil como “lamentável”, apontando a atuação descontrolada das Big Techs.

Segundo Amadeu, a pauta americana seria o avanço sobre terras raras, dados brasileiros e a garantia de plena liberdade das Big Techs no país.

Ele ressaltou que a agenda brasileira não está clara, apesar do papel internacional do Brasil em críticas a Israel, alianças com China/BRICS e preocupação com a influência da direita nas plataformas digitais.

No Fórum Onze e Meia desta terça-feira (5), o sociólogo Sérgio Amadeu comentou sobre a reunião do presidente Lula (PT) com o presidente dos Estados Unidos, Donald Trump, e defendeu que o representante brasileiro deveria cancelar o encontro devido à ação “lamentável” do país norte-americano no Brasil através das Big Techs.

Amadeu destacou que a pauta dos Estados Unidos é uma muito “evidente”: avanço sobre as terras raras brasileiras, sobre os dados brasileiros e a garantia de uma “completa liberdade de atuação das big techs em território brasileiro”. Por outro lado, o sociólogo afirma que não consegue ver claramente qual a pauta brasileira diante dos EUA.

“Eu nunca tive isso muito claro, porque o Brasil tem tido um papel internacional muito relevante nas questões tensas que o mundo vive hoje. O Brasil tem trabalhado a política de crítica às ações genocidas do Estado de Israel, tem trabalhado junto com a África do Sul para a condenação no Tribunal Penal Internacional, tem trabalhado uma aproximação importante com outros países que querem manter o sistema ONU, e o Brasil tem, obviamente, uma clara aliança com a China, com o BRICS”, analisou Amadeu.

“Agora, eu não tenho muito claro qual é a pauta do Brasil que leva Lula até lá, porque, por outro lado, eu vejo os Estados Unidos fazendo uma ação lamentável aqui no Brasil a partir da",2026-05-05 16:33:20-03:00,https://revistaforum.com.br/politica/lula-cancelar-reuniao-trump-acao-lamentavel-eua-brasil-sergio-amadeu/,revistaforum
"Globo e Estadão aderem à narrativa de Flávio Bolsonaro para atacar Desenrola, de Lula","Porta-vozes do neoliberalismo no Brasil, Globo e o Estadão estão cada dia mais alinhados à narrativa de Flávio Bolsonaro (PL-RJ) para atacar Lula. Desta vez,","Conluio entre mídia liberal e Flávio Bolsonaro, no entanto, esconde defesa do sistema financeiro, que quer cortes na saúde, educação e o fim do aumento real de aposentadorias e salário-mínimo.

00:00 A+ A-

Ler o resumo da notícia Em 6 de junho, O Globo e o Estadão publicaram editorial que reproduziu a crítica de Flávio Bolsonaro ao programa Desenrola, criado pelo governo Lula para renegociar dívidas bancárias.

Flávio Bolsonaro afirmou que o brasileiro precisa de “menos juros, menos impostos e mais dinheiro no bolso”, sem detalhar medidas e omitindo a autonomia do Banco Central.

O editorial dos jornais qualificou o “Novo Desenrola” como programa eleitoreiro e nocivo, alegando ausência de controle de gastos públicos e desequilíbrio fiscal.

Segundo a argumentação veiculada, o desequilíbrio fiscal eleva a taxa de juros, aumenta a inadimplência e agrava a dívida dos consumidores.

Porta-vozes do neoliberalismo no Brasil, Globo e o Estadão estão cada dia mais alinhados à narrativa de Flávio Bolsonaro (PL-RJ) para atacar Lula. Desta vez, os dois jornalões ecoaram os ataques do filho “01” de Jair Bolsonaro (PL) ao programa Desenrola, criado pelo governo para renegociar dívidas de pessoas junto aos bancos.

Em vídeo divulgado nesta terça-feira (5) nas redes sociais, o senador chama o programa de “ficção” e diz que “o problema é gigante e a solução é minúscula”, culpando o “crédito caro”, em razão da elevada taxa de juros, pelo endividamento dos brasileiros.

“O brasileiro não precisa de maquiagem, precisa de solução de verdade, menos juros, menos impostos e mais dinheiro no seu bolso”, diz Flávio Bolsonaro, sem explicar como fará isso e escondendo que o Banco Central, que define a taxa básica de juros, foi tornado autônomo no governo do pai.

Em linha, O Globo divulgou editorial nesta quarta-feira (6) afirmando que o “Novo Desenrola é programa eleitoreiro com efeito nocivo”.

O texto remete à velhos chavões neoliberais afirmando que “não houve medida alguma para conter o",2026-05-06 11:25:31-03:00,https://revistaforum.com.br/politica/globo-e-estadao-aderem-a-narrativa-de-flavio-bolsonaro-para-atacar-desenrola-de-lula/,revistaforum
“Jogo do Tigrinho”: influenciadores são alvos de nova operação policial sobre fraudes de R$ 11 milhões em plataformas de apostas,"Uma nova operação policial, desencadeada na manhã desta quarta-feira (6) pela Polícia Civil do Distrito Federal (PCDF) mira uma estrutura montada a partir de","A investigação começou em 2024 a partir da rede criada pelo influenciador Roberth Lucas, de 24 anos, que ainda mantém perfil no Instagram, com mais de 29 mil seguidores.

“JOGO DO TIGRINHO”: INFLUENCIADORES SãO ALVOS DE NOVA OPERAçãO POLICIAL SOBRE FRAUDES DE R$ 11 MILHõES EM PLATAFORMAS DE APOSTAS

“JOGO DO TIGRINHO”: INFLUENCIADORES SãO ALVOS DE NOVA OPERAçãO POLICIAL SOBRE FRAUDES DE R$ 11 MILHõES EM PLATAFORMAS DE APOSTAS

00:00 A+ A-

Ler o resumo da notícia A Polícia Civil do DF deflagrou, nesta quarta (6), operação contra fraudes de R$ 11 mi em apostas online, como o “Jogo do Tigrinho”.

A ação, coordenada em DF, Goiás, São Paulo, Maranhão, Paraíba, Rio de Janeiro e Bahia, tem como alvo nove pessoas ligadas a um esquema de influenciadores digitais.

A investigação, iniciada em 2024, partiu da rede criada pelo influenciador Roberth Lucas, 24 anos, que se promove como “Rei dos Métodos” nas redes sociais.

Entre os investigados está também a influenciadora Eduarda Cavalcante, 21 anos, parceira de Lucas, acusada de participar das fraudes.

Uma nova operação policial, desencadeada na manhã desta quarta-feira (6) pela Polícia Civil do Distrito Federal (PCDF) mira uma estrutura montada a partir de um grupo de influenciadores digitais que teriam cometido fraudes que chegam a R$ 11 milhões em plataformas de jogos online, como o “Jogo do Tigrinho”.

A operação é realizada no DF e nos estados de Goiás, São Paulo, Maranhão, Paraíba, Rio de Janeiro e Bahia, e tem como alvo 9 pessoas que integrariam a organização criminosa com ações coordenadas em diferentes regiões do Brasil, segundo informações de Carlos Carone, no site Metrópoles.

A investigação começou em 2024 a partir da rede criada pelo influenciador Roberth Lucas, de 24 anos, que ainda mantém perfil no Instagram, com mais de 29 mil seguidores, onde ostenta uma vida de luxo, com visitas a resorts e centros de compras. No Instagram ele se classifica como “Rei dos Métodos”, ludibriando os seguidores a fazerem “dinheir",2026-05-06 07:23:06-03:00,https://revistaforum.com.br/politica/jogo-do-tigrinho-influenciadores-sao-alvos-de-nova-operacao-policial-sobre-fraudes-de-r-11-milhoes-em-plataformas-de-apostas/,revistaforum
Michelle usa vídeo em que Ciro Gomes chama Bolsonaro de “jumento” e retoma briga com Flávio,"Após Silas Malafaia e Tarcísio Gomes de Freitas (Republicanos) cederem aos desejos de Flávio Bolsonaro (PL-RJ), com manifestações públicas ao lado do senador,","No vídeo divulgado por Michelle, Ciro Gomes, pivô da briga dela com o enteado, destila homofobia dizendo que Bolsonaro não tira ""essa coisa de gay"" da cabeça por ser um ""problema de armário""

00:00 A+ A-

Ler o resumo da notícia Michelle Bolsonaro (PL) divulgou, na noite de 4 de maio, story no Instagram com trecho de entrevista de Ciro Gomes (PSDB) que chama Jair Bolsonaro de “jumento”.

O vídeo foi usado para criticar Flávio Bolsonaro (PL‑RJ) e aliados do PL no Ceará, como André Fernandes.

Ciro Gomes descreve Bolsonaro como “quase doente”, com “ódio ao estamento militar” e “capacidade de raciocínio abstrata”.

A ação surge após manifestações públicas de Silas Malafaia e Tarcísio Gomes de Freitas ao lado de Flávio, indicando intensificação da disputa interna no clã Bolsonaro.

Após Silas Malafaia e Tarcísio Gomes de Freitas (Republicanos) cederem aos desejos de Flávio Bolsonaro (PL-RJ), com manifestações públicas ao lado do senador, a madrasta Michelle Bolsonaro (PL) deu mais um sinal de que não deve arrefecer com o enteado, ungido pelo pai, Jair Bolsonaro (PL), como pré-candidato à Presidência do clã.

Na noite desta segunda-feira (4), Michelle publicou um vídeo nos stories de seu perfil no Instagram em que Ciro Gomes (PSDB) elenca uma série de adjetivos para se referir a Bolsonaro.

“E ainda há pessoas da ‘direita” apoiando esse indivíduo”, disparou Michelle, mirando Flávio Bolsonaro e quadros do PL do Ceará, como André Fernandes (PL-CE), que articula a aliança com o ex-ministro de Lula.

No vídeo, Ciro traça um perfil de Bolsonaro, dizendo que ele é um homem “quase doente” e tem “ódio ao estamento militar”, antes de classificar o ex-presidente como “jumento”.

“Por que o Bolsonaro tem essa esse ódio anti-intelectual? É porque ele é curto, capacidade de raciocínio dele é abstrata, ele é quase um burro. É quase um jumento, assim, um cara imbecil mesmo. E aí o que que ele tem? Ele tem ódio aos letrados, ele tem horror a isso”, disse Ciro ao comentar sobre o projeto",2026-05-05 11:32:59-03:00,https://revistaforum.com.br/politica/michelle-video-ciro-gomes-chama-bolsonaro-jumento-briga-com-flavio/,revistaforum
Revista Fórum,,"Energia limpa

Anne Silva

O dispositivo tem um mecanismo revolucionário porque, ao invés de tratar os gases de efeito estufa como resíduos, gera energia a partir de sua captura e armazenamento e os converte de forma direta em energia elétrica para ser utilizada em processos de abastecimento",,https://revistaforum.com.br/editoria/tecnologia/,revistaforum
Novo Desenrola: Lula lança hoje programa para renegociar dívidas com juros baixos e até 90% de desconto,"O governo federal realiza nesta segunda-feira (4), no Palácio do Planalto, a cerimônia oficial de lançamento do Novo Desenrola Brasil, programa que amplia a","Programa do governo federal mira brasileiros endividados com renda de até cinco salários mínimos, prevê uso do FGTS, juros reduzidos e inclui bloqueio de apostas online para evitar novos prejuízos financeiros

NOVO DESENROLA: LULA LANçA HOJE PROGRAMA PARA RENEGOCIAR DíVIDAS COM JUROS BAIXOS E ATé 90% DE DESCONTO

NOVO DESENROLA: LULA LANçA HOJE PROGRAMA PARA RENEGOCIAR DíVIDAS COM JUROS BAIXOS E ATé 90% DE DESCONTO

00:00 A+ A-

Ler o resumo da notícia Presidente Luiz Inácio Lula da Silva lançou hoje (4 de maio) o programa Novo Desenrola Brasil no Palácio do Planalto.

O programa permite renegociar dívidas de até cinco salários mínimos com juros de até 1,99 % ao mês e descontos de até 90 %.

São incluídos débitos como cartão de crédito, cheque especial, crédito pessoal e contratos do Fundo de Financiamento Estudantil.

Quem aderir terá acesso a plataformas de apostas online bloqueado por um ano, para evitar comprometimento do alívio financeiro.

O governo federal realiza nesta segunda-feira (4), no Palácio do Planalto, a cerimônia oficial de lançamento do Novo Desenrola Brasil, programa que amplia a política de renegociação de dívidas voltada à população de baixa e média renda. A iniciativa é uma das apostas da gestão do presidente Luiz Inácio Lula da Silva para enfrentar o alto nível de endividamento no país.

O evento marca o início de uma nova etapa do programa, que já havia sido antecipado por Lula em pronunciamento em cadeia nacional de rádio e televisão na última semana, no Dia do Trabalhador, quando detalhou as principais medidas e condições.

Juros mais baixos e descontos amplos

O Novo Desenrola permitirá a renegociação de dívidas com bancos e instituições financeiras em condições mais favoráveis. Entre os principais pontos estão:

Juros limitados a até 1,99% ao mês

Descontos que podem chegar a 90% do valor da dívida

Inclusão de débitos como cartão de crédito, cheque especial e crédito pessoal

Possibilidade de renegociação de contratos do Fundo de Financ",2026-05-04 05:45:17-03:00,https://revistaforum.com.br/politica/novo-desenrola-dividas/,revistaforum
"“Alcolumbre fascista, ladrão e entreguista” dá o tom em ato no Dia do Trabalho em SP; veja vídeo",Davi Alcolumbre é alvo de coro duro em ato do Dia do Trabalho em São Paulo durante mobilização pelo fim da escala 6x1.,"Presidente do Senado foi alvo de coro na Praça Franklin Roosevelt durante manifestação do 1º de Maio pelo fim da escala 6x1

“ALCOLUMBRE FASCISTA, LADRãO E ENTREGUISTA” Dá O TOM EM ATO NO DIA DO TRABALHO EM SP; VEJA VíDEO

“ALCOLUMBRE FASCISTA, LADRãO E ENTREGUISTA” Dá O TOM EM ATO NO DIA DO TRABALHO EM SP; VEJA VíDEO

00:00 A+ A-

Ler o resumo da notícia Na sexta‑feira, 1º de maio, manifestantes protestaram contra o senador Davi Alcolumbre na Praça Franklin Roosevelt, em São Paulo.

O coro acusou Alcolumbre de “fascista, ladrão e entreguista” durante ato convocado por centrais sindicais e movimentos sociais.

O protesto integrou a campanha nacional pelo fim da escala 6x1 e pela redução da jornada sem corte salarial.

A pressão ocorre após Alcolumbre liderar a sessão que derrubou o veto de Lula ao projeto da Dosimetria, que flexibiliza penas de atos golpistas de 8 de janeiro.

Davi Alcolumbre (União-AP), presidente do Senado e do Congresso Nacional, foi alvo de um coro duro nesta sexta-feira (1º) durante o ato do Dia do Trabalho na Praça Franklin Roosevelt, no centro de São Paulo. Em vídeo enviado à Fórum, manifestantes chamam o senador de “fascista, ladrão e entreguista” em meio à mobilização pelo fim da escala 6×1.

A palavra de ordem contra Alcolumbre apareceu no ato convocado por centrais sindicais e movimentos sociais, que levaram às ruas a defesa da redução da jornada sem corte de salários. A mobilização em São Paulo integra a agenda nacional do 1º de Maio, que teve o fim da escala 6×1 como principal bandeira e foi antecipada pela Fórum em reportagem sobre os atos do Dia do Trabalhador em todo o país.

“Alcolumbre fascista, ladrão e entreguista”, gritaram manifestantes no ato do 1º de Maio em São Paulo.

Davi Alcolumbre vira alvo de protesto em São Paulo

O coro contra Alcolumbre ocorre em uma semana de forte desgaste político para o presidente do Senado. O parlamentar esteve no centro da condução de pautas sensíveis no Congresso e passou a ser alvo direto de ",2026-05-01 12:07:17-03:00,https://revistaforum.com.br/politica/davi-alcolumbre-ato-1-maio/,revistaforum
Revista Fórum,,"APOSTAS ONLINE

Plínio Teodoro

A investigação começou em 2024 a partir da rede criada pelo influenciador Roberth Lucas, de 24 anos, que ainda mantém perfil no Instagram, com mais de 29 mil seguidores.",,https://revistaforum.com.br/editoria/politica/,revistaforum
Terras raras e minerais críticos: Câmara vota projeto antes de encontro entre Lula e Trump,O tema das terras raras e dos minerais críticos se transformou em uma das disputas centrais da economia global por causa da corrida tecnológica e energética.,"Com o Brasil no centro da disputa global por terras raras, Câmara acelera votação de projeto estratégico defendido pelo governo Lula às vésperas do encontro entre o presidente brasileiro e Donald Trump nos EUA

TERRAS RARAS E MINERAIS CRíTICOS: CâMARA VOTA PROJETO ANTES DE ENCONTRO ENTRE LULA E TRUMP

TERRAS RARAS E MINERAIS CRíTICOS: CâMARA VOTA PROJETO ANTES DE ENCONTRO ENTRE LULA E TRUMP

00:00 A+ A-

Ler o resumo da notícia Câmara dos Deputados vota nesta quarta‑feira (6) o projeto da Política Nacional de Minerais Críticos e Estratégicos (PNMCE).

Relator Arnaldo Jardim propõe conselho, fundo garantidor de até R$ 5 bi, incentivos fiscais e controle de exportação para agregar valor às reservas de terras raras.

Projeto ganha destaque antes da reunião entre presidentes Lula e Trump em Washington, agendada para quinta‑feira (7).

Objetivo: diminuir a dependência da exportação de matéria‑prima bruta e estimular pesquisa, inovação e produção industrial no Brasil.

A Câmara dos Deputados deve votar nesta quarta-feira (6) o projeto de lei que cria a Política Nacional de Minerais Críticos e Estratégicos (PNMCE), proposta que ganhou dimensão geopolítica às vésperas da reunião entre o presidente Luiz Inácio Lula da Silva e Donald Trump, marcada para quinta-feira (7), em Washington.

O tema das terras raras e dos minerais críticos se transformou em uma das disputas centrais da economia global por causa da corrida tecnológica e energética. Esses materiais são fundamentais para a fabricação de carros elétricos, baterias, chips, turbinas eólicas, painéis solares e equipamentos militares.

O Brasil possui a segunda maior reserva de terras raras do planeta, atrás apenas da China, mas ainda tem participação reduzida na cadeia industrial global. A votação do projeto ocorre justamente em meio à pressão internacional para garantir acesso a esses recursos estratégicos.

O texto relatado pelo deputado Arnaldo Jardim (Cidadania-SP) busca consolidar uma política nacional para o setor, ",2026-05-06 11:36:23-03:00,https://revistaforum.com.br/politica/terras-raras-camara-vota/,revistaforum
Como Flávio Bolsonaro se uniu a Alexandre de Moraes no acordão de Alcolumbre por “anistia” e barrar CPI do Master,"O abjeto acordo costurado pelo presidente do Senado, Davi Alcolumbre (União-AP), que enterrou a CPI do Master e derrubou o veto de Lula ao PL da Dosimetria,","Grande acordo costurado por Davi Alcolumbre, que colocou Alexandre de Moraes e Flávio Bolsonaro lado a lado, reaglutina as mesmas forças políticas que atuaram em 2016.

COMO FLáVIO BOLSONARO SE UNIU A ALEXANDRE DE MORAES NO ACORDãO DE ALCOLUMBRE POR “ANISTIA” E BARRAR CPI DO MASTER

COMO FLáVIO BOLSONARO SE UNIU A ALEXANDRE DE MORAES NO ACORDãO DE ALCOLUMBRE POR “ANISTIA” E BARRAR CPI DO MASTER

00:00 A+ A-

Ler o resumo da notícia O presidente do Senado, Davi Alcolumbre, aprovou acordo que encerrou a CPI do Master e revogou o veto de Lula ao PL da Dosimetria.

O pacto aproximou Flávio Bolsonaro, pré‑candidato à Presidência, ao ministro do STF Alexandre de Moraes, relator da condenação de Jair Bolsonaro.

A aliança busca apresentar Flávio como candidato “moderado” para atrair o apoio da chamada terceira via – centro‑direita, mídia liberal e investidores de Faria Lima.

Alcolumbre e Moraes mantêm relação estreita desde 2016, quando foram indicados por Michel Temer, influenciando decisões sobre indicações ao STF e acordos políticos.

O abjeto acordo costurado pelo presidente do Senado, Davi Alcolumbre (União-AP), que enterrou a CPI do Master e derrubou o veto de Lula ao PL da Dosimetria, provocou uma união imprevista entre o ministro Alexandre de Moraes, do Supremo Tribunal Federal (STF), relator do processo que condenou Jair Bolsonaro (PL) a 27 anos e 3 meses de prisão por tentativa de golpe de Estado, e Flávio Bolsonaro (PL), ungido pelo pai como pré-candidato à Presidência, que busca se adequar ao manto de “moderado”, requisito para conquistar o apoio da chamada terceira via, que une centro-direita, mídia liberal e Faria Lima em torno de interesses próprios.

Alcolumbre e Moraes nutrem uma relação próxima desde 2016, quando Michel Temer (MDB) assumiu o poder após o golpe contra Dilma Rousseff (PL). Atuando ainda hoje nas sombras da política, Temer levou Moraes ao comando do Ministério da Justiça, antes de indicar o jovem jurista paulistano, forjado nas hostes das b",2026-05-01 10:30:21-03:00,https://revistaforum.com.br/politica/como-flavio-bolsonaro-se-uniu-a-alexandre-de-moraes-no-acordao-de-alcolumbre-por-anistia-e-barrar-cpi-do-master/,revistaforum
"Tarcísio ataca Haddad, que rebate: “Situação de SP só não é pior por causa da ajuda de Lula”","Fernando Haddad reagiu após ser atacado pelo governador paulista e criticou venda de patrimônio público em ""certames duvidosos""","Ex-ministro reagiu após ser atacado pelo governador paulista, lembrou rombo de R$ 200 bilhões deixado por Bolsonaro e criticou venda de patrimônio público em ""certames duvidosos""

TARCíSIO ATACA HADDAD, QUE REBATE: “SITUAçãO DE SP Só NãO é PIOR POR CAUSA DA AJUDA DE LULA”

TARCíSIO ATACA HADDAD, QUE REBATE: “SITUAçãO DE SP Só NãO é PIOR POR CAUSA DA AJUDA DE LULA”

00:00 A+ A-

Ler o resumo da notícia O governador de São Paulo, Tarcísio, atacou publicamente o ex‑ministro Fernando Haddad.

Haddad rebateu, dizendo que a situação do estado só não é pior graças ao apoio do presidente Lula.

A troca de acusações ocorreu no contexto de debate político sobre a gestão de São Paulo.

Depois de o governador paulista Tarcísio de Freitas (Republicanos) ter afirmado, em coletiva no Palácio dos Bandeirantes nesta terça-feira (5), que o ex-ministro da Fazenda Fernando Haddad “quebrou o país” e “não trabalhou durante três anos”, o pré-candidato do PT ao governo de São Paulo rebateu os ataques.

Em nota, Haddad disse que Tarcísio está “destruindo as finanças” de São Paulo e que a situação fiscal só não é pior por causa da ajuda do governo Lula e da venda de patrimônio público por parte da gestão paulista em “certames duvidosos”.

“O governador insiste que o estado tem R$ 23 bilhões de caixa bruto em 2025, mas não conta o detalhe de que esse caixa bruto, após descontadas as obrigações já contratadas e os restos a pagar, deixa um saldo líquido de caixa de apenas R$ 5,4 bilhões”, apontou Haddad.

O ex-ministro da Fazenda argumentou ainda que o governo Lula recebeu da gestão do ex-presidente Jair Bolsonaro (PL) uma peça orçamentária “fictícia”. “Somando isso aos calotes nos precatórios, nos governadores e no Bolsa Família, o déficit entregue por Bolsonaro a Lula foi de mais de R$ 200 bilhões”, explicou Haddad. “O que o governador Tarcísio de Freitas está fazendo em São Paulo é o que seu padrinho fez no plano federal.”

Chapa de Haddad em São Paulo

Enquanto Tarcísio de Freitas fechou su",2026-05-05 23:06:14-03:00,https://revistaforum.com.br/politica/tarcisio-ataca-haddad-que-rebate/,revistaforum
A nova pesquisa nacional que confronta Lula e Flávio Bolsonaro pelo Planalto,Pesquisa Real Time Big Data mede cenário nacional entre Lula e Flávio Bolsonaro para 2026 após sondagens estaduais indicarem disputa apertada.,"Levantamento tira a disputa da zona de conforto dos redutos conservadores para medir o teto real do candidato da extrema direita e o tamanho da resiliência governista

00:00 A+ A-

Ler o resumo da notícia Instituto Real Time Big Data realizou pesquisa nacional com 2 mil eleitores para medir a disputa presidencial de 2026 entre Lula (PT) e Flávio Bolsonaro (PL‑RJ).

A coleta presencial ocorreu em todo o país desde sábado (2) e os resultados serão divulgados nesta terça‑feira (5).

O estudo compara a intenção de voto nacional com recortes regionais, avaliando se Flávio mantém competitividade contra Lula.

Flávio foi apontado pela extrema direita como sucessor de Jair Bolsonaro, que está inelegível por decisão do TSE.

Um novo levantamento nacional do instituto Real Time Big Data vai medir o tamanho real da disputa presidencial de 2026 entre o presidente Luiz Inácio Lula da Silva (PT) e Flávio Bolsonaro (PL-RJ), nome já consolidado pelo bolsonarismo para a corrida ao Planalto.

A pesquisa eleitoral, que ouviu 2 mil eleitores presencialmente em todo o país desde o último sábado (2), será divulgada nesta terça-feira (5). O foco político da sondagem está menos no peso isolado dos números e mais no contraste entre os recortes regionais recentes e a nova fotografia nacional sobre a intenção de voto dos brasileiros.

Flávio foi alçado pela extrema direita à condição de sucessor eleitoral de Jair Bolsonaro, que se encontra inelegível por decisão do Tribunal Superior Eleitoral (TSE). A nova rodada deve indicar se o senador mantém, no plano nacional, a competitividade que apareceu em praças estratégicas e que vem pautando as articulações da oposição.

O real tamanho de Flávio Bolsonaro contra Lula

A pesquisa testa o petista e o senador em um cenário ampliado. O levantamento serve como um termômetro da fase inicial da sucessão presidencial, ainda marcada por sondagens exploratórias, movimentações partidárias e guerra de narrativas, a exemplo de outros recortes recentes que medi",2026-05-04 08:39:43-03:00,https://revistaforum.com.br/politica/pesquisa-lula-flavio-2026/,revistaforum
Revista Fórum,,"Constrangimento

Tati Fávaro

Em entrevista a podcast do jornal O Globo, atriz relata episódios constrangedores, diz que foi pressionada a afirmar que “estava tudo bem” e afirma que só conseguiu reagir após o caso vir à tona",,https://revistaforum.com.br/editoria/blogs/pop-noticias/,revistaforum
