titulo,subtitulo,texto,data,url,portal
Cris Monteiro: MP-SP entra com ação por racismo contra a vereadora,"Ela ficou conhecida por ter afirmado que “mulher branca, bonita e rica incomoda” e ainda fez comentários associados a “sapatos baratos”","Ela ficou conhecida por ter afirmado que “mulher branca, bonita e rica incomoda” e ainda fez comentários associados a “sapatos baratos”

00:00 A+ A-

Ler o resumo da notícia O Ministério Público de São Paulo abriu inquérito civil para apurar denúncia de racismo e classismo contra a vereadora Cris Monteiro (Novo), apresentada por Keit Lima (PSOL).

A acusação se baseia em declarações de Monteiro sobre a Favela do Moinho, chamada de “quartel‑general do crime organizado”, e em comentários pejorativos sobre a origem e aparência de Lima.

O Conselho Estadual de Desenvolvimento da Comunidade Negra classificou as falas como manifestação de racismo e discriminação racial, destacando a gravidade de declarações de autoridade eleita.

Monteiro nega prática de racismo; o caso também segue análise na Corregedoria da Câmara de São Paulo por declarações anteriores sobre “mulher branca, bonita e rica”.

O Ministério Público de São Paulo (MP-SP) abriu um inquérito civil para investigar acusações de racismo e classismo envolvendo a vereadora Cris Monteiro (Novo), após representação apresentada pela vereadora Keit Lima (PSOL).

A denúncia aponta declarações feitas por Cris Monteiro sobre a Favela do Moinho, na região central da capital paulista, descrita por ela como um suposto “quartel-general do crime organizado”. Segundo Keit Lima, as falas também incluíram comentários considerados pejorativos sobre sua origem e aparência.

O pedido de investigação foi aceito pelo Ministério Público, que instaurou o procedimento para apurar se houve prática de racismo por parte da parlamentar do partido Novo. O caso segue em andamento.

Conselho Estadual de Desenvolvimento da Comunidade Negra

O episódio também provocou reação do Conselho Estadual de Desenvolvimento da Comunidade Negra, que classificou as declarações como uma “manifestação de racismo e discriminação racial”, ressaltando a gravidade do fato de as falas terem partido de uma autoridade pública eleita.

Além da investigação conduzida p",2026-05-12 09:14:43-03:00,https://revistaforum.com.br/politica/cris-monteiro-mp-sp-acao-racismo-vereadora/,revistaforum
Revista Fórum,Fazer jornalismo de qualidade e com compromisso social tem custos. Fórum conta com jornalistas e profissionais especializados entre os seus colaboradores.,"Fazer jornalismo de qualidade e com compromisso social tem custos. Fórum conta com jornalistas e profissionais especializados entre os seus colaboradores. Fórum não tem qualquer apoio de ONGs ou fundações internacionais e sobrevive da assinatura de leitores e publicidades programáticas. Por isso, a colaboração de entidades é fundamental para que o veículo continue fazendo seu trabalho de fortalecer as pautas progressistas. Nossos parceiros dispõem de espaço publieditorial e publicitário para divulgar suas pautas e campanhas em nosso site, alcançando milhões de leitores por mês. Saiba como a sua entidade pode se tornar parceira, entre em contato conosco pelo e-mail: [email protected]

Veja abaixo entidades parceiras da Fórum.",2025-12-05 14:02:16-03:00,https://revistaforum.com.br/parceiros/,revistaforum
Milhões de brasileiros não precisam mais pagar aluguel: o programa do governo Lula que mudou a vida da classe média,"A jovem Ananda Procópio tem uma carreira em construção como assistente jurídica em Fortaleza (CE), um noivo e um sonho que ela descreve com a clareza de quem","Programa de moradia passou a alcançar um novo público em 2025 e ampliou sonho da casa própria

MILHõES DE BRASILEIROS NãO PRECISAM MAIS PAGAR ALUGUEL: O PROGRAMA DO GOVERNO LULA QUE MUDOU A VIDA DA CLASSE MéDIA

MILHõES DE BRASILEIROS NãO PRECISAM MAIS PAGAR ALUGUEL: O PROGRAMA DO GOVERNO LULA QUE MUDOU A VIDA DA CLASSE MéDIA

00:00 A+ A-

Ler o resumo da notícia O governo Lula lançou a Faixa 4 do Minha Casa Minha Vida em abril 2025, ampliada em abril 2026, para famílias com renda entre R$ 9.600 e R$ 13 mil.

O programa permite financiar imóveis de até R$ 600 mil, facilitando a compra do primeiro lar para a classe média.

Em Fortaleza (CE), a assistente jurídica Ananda Procópio, com renda dentro da faixa, passou a ter acesso ao financiamento e deixou de depender de aluguel.

A iniciativa visa reduzir o número de brasileiros que pagam aluguel, ampliando o acesso à moradia própria.

A jovem Ananda Procópio tem uma carreira em construção como assistente jurídica em Fortaleza (CE), um noivo e um sonho que ela descreve com a clareza de quem já fez as contas mais de uma vez: o primeiro apartamento. Não precisa ser grande. Precisa ser deles.

A questão é que, em Fortaleza, como em outras capitais brasileiras, cobra-se caro até pelo metro quadrado. E Ananda vivia num paradoxo cruel: a renda do casal era alta o suficiente para tirá-los das faixas com mais subsídio do Minha Casa, Minha Vida, mas insuficiente para tornar o financiamento de mercado confortável.

“Tentamos algumas análises antes, mas como nossa renda ficava naquele limite onde o subsídio era baixo, o valor da entrada acabava ficando muito pesado, fora da nossa realidade de planejamento para o início do casamento. Parecia que, por ganharmos um pouco a mais, éramos penalizados com menos ajuda”, conta ela.

A FAIXA QUE FALTAVA – A Faixa 4 do Minha Casa Minha Vida foi criada em abril de 2025 e ampliada em abril de 2026 exatamente para esse público: famílias com renda entre R$ 9.600 e R$ 13 mil mensais que queriam fi",2026-05-12 12:01:55-03:00,https://revistaforum.com.br/politica/milhoes-de-brasileiros-nao-precisam-mais-pagar-aluguel-o-programa-do-governo-lula-que-mudou-a-vida-da-classe-media/,revistaforum
Sâmia Bomfim aciona Corregedoria e MP por ação truculenta de PMs contra estudantes na USP,A deputada federal Sâmia Bomfim (PSOL) anunciou que adotará medidas legais contra a operação da Polícia Militar na Universidade de São Paulo (USP). A,"00:00 A+ A-

Ler o resumo da notícia Deputada Sâmia Bomfim solicitou à Corregedoria da PM e ao Ministério Público a apuração de suposta ação truculenta de policiais contra estudantes que ocupavam a reitoria da USP.

A ocupação da reitoria começou na quinta‑feira (7 de maio) como protesto por moradia e alimentação estudantil, com estudantes em greve há três semanas.

Por volta das 4h15 da madrugada, a Polícia Militar interveio sem ordem judicial, após a universidade cortar serviços básicos ao prédio.

Os manifestantes cobram ampliação da assistência socioeconômica e melhorias na infraestrutura, alegando que os aumentos nos auxílios estudantis foram insuficientes.

A deputada federal Sâmia Bomfim (PSOL) anunciou que adotará medidas legais contra a operação da Polícia Militar na Universidade de São Paulo (USP). A parlamentar informou pelas redes sociais que acionará a Corregedoria da Polícia Militar e o Ministério Público diante da operação e relatou que a tropa de choque empregou bombas de efeito moral, gás lacrimogêneo e cassetetes, deixando os estudantes feridos.

“Estou acionando a Corregedoria da Polícia Militar e o Ministério Público para apurar a conduta ilegal e truculenta na última madrugada”, escreveu Sâmia. A ocupação da reitoria daa USP começou na última quinta-feira, por meio da defesa de pautas relativas à moradia e alimentação estudantil. Segundo o Diretório Central dos Estudantes, a intervenção policial ocorreu por volta das 4h15, sem reintegração de posse autorizada pela Justiça, e após o corte de serviços básicos pela universidade.

Em greve, estudantes da USP ocupam reitoria e cobram novas negociações

Nesta quinta-feira (7), estudantes em greve da USP ocuparam o prédio da reitoria com um cordão humano para cobrar novas negociações. A paralisação, que já dura três semanas, cobra melhoria das condições de permanência e infraestrutura da universidade e ampliação da assistência socioeconômica.

De acordo com os estudantes, a reitoria não tem atendido de",2026-05-11 09:38:16-03:00,https://revistaforum.com.br/politica/samia-bomfim-aciona-corregedoria-e-mp-por-acao-truculenta-de-pms-contra-estudantes-na-usp/,revistaforum
"Desinformação sobre PL da Misoginia cresce nas redes, diz estudo","O parlamentar associou ao PL da Misoginia trechos de outro projeto de lei, o PL 4224/2024, da senadora Ana Paula Lobato, que tratava da Política Nacional de","00:00 A+ A-

Ler o resumo da notícia Entre 24 março e 30 abril 2026, foram coletadas mais de 289 mil publicações no X e milhares de posts no Facebook, Instagram e Threads sobre o PL 896/2023, que define misoginia.

O projeto, se aprovado, incluirá a “condição de mulher” na Lei do Racismo (Lei 7.716/1989) e prevê pena de 2 a 5 anos de prisão e multa.

O maior pico de desinformação ocorreu em 25 março, um dia após a aprovação do PL no Senado, impulsionado por vídeo do deputado Nikolas Ferreira (PL‑MG).

O vídeo, que confundiu o PL 896/2023 com o PL 4224/2024 da senadora Ana Paula Lobato, alcançou ao menos 751 mil visualizações em 24 horas.

O chamado Projeto de Lei da Misoginia se transformou em alvo de uma ofensiva de desinformação nas redes sociais, coordenada por políticos de direita, segundo levantamento do Observatório Lupa. O estudo identificou narrativas falsas, teorias conspiratórias e conteúdos produzidos com inteligência artificial para atacar o PL aprovado pelo Senado em março deste ano.

Entre os dias 24 de março e 30 de abril de 2026, os pesquisadores coletaram mais de 289 mil publicações no X sobre o tema. Também foram analisados 6,3 mil posts no Facebook, 2,9 mil no Instagram e mil no Threads.

A partir desse conjunto de dados, o observatório identificou “picos de desinformação, tendências narrativas e padrões de comportamento” nas plataformas digitais. O projeto em discussão no Congresso é o PL 896/2023, que define misoginia como “a conduta que exterioriza ódio ou aversão às mulheres”.

Caso seja aprovado pela Câmara sem alterações, o texto passará a incluir a “condição de mulher” na Lei do Racismo (Lei 7.716/1989), prevendo pena de dois a cinco anos de prisão, além de multa, para práticas enquadradas como misóginas.

Segundo a Lupa, o principal pico de engajamento da campanha de desinformação ocorreu em 25 de março, um dia após a aprovação da proposta no Senado, impulsionado por um vídeo publicado pelo deputado federal Nikolas Ferreira (PL-MG).

O par",2026-05-10 10:23:44-03:00,https://revistaforum.com.br/politica/pl-da-misoginia-desinformacao/,revistaforum
Influenciador bolsonarista é preso no RJ após forjar assalto,"O influenciador bolsonarista Luan Lennon foi preso nesta sexta-feira (8) após forjar um assalto no Centro do Rio na quinta-feira (7). O objetivo de Luan,","O militante de extrema direita teria combinado a farsa com outras pessoas para postar nas redes sociais e viralizar

00:00 A+ A-

Ler o resumo da notícia Influenciador bolsonarista Luan Lennon foi preso no Rio de Janeiro por organizar um assalto falso.

Deixou o vidro de um carro aberto, pagou R$ 30 a pedestre para furtar o celular e gravou a ação de outro veículo.

Tentou prender o pedestre, que negou participação, e a PM o conduziu à 4ª Delegacia da Praça da República.

Polícia Civil confirmou crime forjado; duas pessoas da equipe foram detidas e outro suspeito está foragido.

O influenciador bolsonarista Luan Lennon foi preso nesta sexta-feira (8) após forjar um assalto no Centro do Rio na quinta-feira (7). O objetivo de Luan, segundo a Polícia, era gravar o suposto assalto e postar nas redes sociais.

Luan Lennon viralizou nas redes sociais justamente por, supostamente, denunciar abusos de flanelinhas. Hoje, ele tem mais de 1 milhão de seguidores no Instagram.

Além dele, duas pessoas de sua equipe também foram detidas. Um terceiro participante da farsa é procurado.

Roteiro do assalto fake

De acordo com informações da Polícia do Rio de Janeiro, Luan Lennon deixou o vidro de um carro aberto e combinou com um guardador de carros oferecer R$ 30 a um pedestre para furtar o celular no veículo.

Segundo a Polícia, o influencer bolsonarista gravou a ação escondido em outro carro. Logo após a ação combinada, Luan abordou o pedestre e tentou dar voz de prisão pelo falso roubo.

No entanto, o pedestre afirmou que não participava do esquema. Dessa maneira, a PM foi acionada e levou todos os envolvidos para a 4ª Delegacia de Polícia, na Praça da República.

Em nota, a Polícia Civil do Rio de Janeiro declarou que, “após um trabalho investigativo, os agentes identificaram que se tratava de um crime forjado. Com base nas apurações, os policiais realizaram diligências que resultaram na identificação de outras duas pessoas envolvidas no esquema. Os três foram ouvidos e autuado",2026-05-08 22:05:27-03:00,https://revistaforum.com.br/politica/influenciador-bolsonarista-e-preso-no-rj-apos-forjar-assalto/,revistaforum
Ciro Gomes bate martelo sobre candidatura e costura aliança com a direita no Ceará,Tucano Ciro Gomes deve oficializar pré-candidatura ao Palácio da Abolição e tenta unir siglas como União Brasil e PL contra governador petista Elmano de Freitas,"Tucano deve oficializar pré-candidatura ao Palácio da Abolição e tenta unir siglas como União Brasil e PL contra o governador petista Elmano de Freitas

CIRO GOMES BATE MARTELO SOBRE CANDIDATURA E COSTURA ALIANçA COM A DIREITA NO CEARá

CIRO GOMES BATE MARTELO SOBRE CANDIDATURA E COSTURA ALIANçA COM A DIREITA NO CEARá

00:00 A+ A-

Ler o resumo da notícia Ciro Gomes confirmou sua candidatura nas próximas eleições.

O político anunciou a formação de aliança com partidos de direita.

A aliança foi costurada no estado do Ceará.

A estratégia visa ampliar a base de apoio no cenário eleitoral.

O ex-ministro Ciro Gomes (PSDB) postou na noite desta sexta-feira (8) em seu perfil no Instagram um convite para um evento no dia 16 de maio no bairro Conjunto Ceará, em Fortaleza. Embora não diga do que se trata, afirmando apenas que é um “encontro marcado com a história”, aliados apontam que será o lançamento de sua pré-candidatura ao governo do Ceará.

Segundo o jornal Diário do Nordeste, Ciro deve anunciar o lançamento na terça-feira (12) no Café da Oposição, realizado na Assembleia Legislativa do estado.

Ouvido pelo site OpiniãoCE, o deputado estadual Cláudio Pinho (PSDB) destacou que, se o ex-ministro não fosse concorrer ao governo estadual, o evento não seria realizado no Ceará. “Será candidato a governador”, cravou.

Com a confirmação da pré-candidatura, além do tucano e do governador que vai concorrer à reeleição, Elmano de Freitas (PT), a corrida pelo Palácio da Abolição contará com o senador Eduardo Girão (Novo), Jarir Pereira (Psol), Zé Batista (PSTU) e Giovanni Sampaio (PRD).

Ciro chegou a ser cogitado como possível pré-candidato à Presidência da República pelo presidente nacional da legenda, deputado Aécio Neves (MG) e desde o ano passado vinha sendo instado por aliados locais a concorrer ao governo estadual. Chegou a defender o nome do ex-prefeito de Fortaleza, Roberto Cláudio (União), para a vaga, antes de decidir concorrer.

Michelle rejeita apoio do PL a Ciro G",2026-05-08 21:15:05-03:00,https://revistaforum.com.br/politica/ciro-gomes-bate-martelo-candidatura/,revistaforum
Revista Fórum,,"TUDO A VER...

Plínio Teodoro

""Eu fui à sala dele e disse que nós todos sabíamos que o Jair Bolsonaro estava planejando um golpe, ele queria um golpe"", relatou Bonner em entrevista ao colega Ernesto Rodrigues, ex-editor do JN e autor de trilogia sobre a Globo.",,https://revistaforum.com.br/editoria/midia/,revistaforum
O plano bilionário de Lula para combater o crime organizado,"O presidente Luiz Inácio Lula da Silva lança nesta terça-feira (12) o programa Brasil Contra o Crime Organizado, pacote de segurança pública com investimentos","O PLANO BILIONáRIO DE LULA PARA COMBATER O CRIME ORGANIZADO

O PLANO BILIONáRIO DE LULA PARA COMBATER O CRIME ORGANIZADO

00:00 A+ A-

Ler o resumo da notícia Lula lançou, em 12 de maio, o programa “Brasil Contra o Crime Organizado” com investimento total de R$ 11 bi.

O recurso inclui R$ 1 bi do Orçamento da União e R$ 10 bi emprestados pelo BNDES aos estados.

O plano estrutura‑se em quatro eixos: asfixia financeira de facções, segurança prisional, investigação de homicídios e combate ao tráfico de armas.

Cria a Força Integrada de Combate ao Crime Organizado (Ficco) e amplia o Cifra, além de modernizar presídios estaduais com bloqueadores de celular e raio‑x.

O presidente Luiz Inácio Lula da Silva lança nesta terça-feira (12) o programa Brasil Contra o Crime Organizado, pacote de segurança pública com investimentos de R$ 11 bilhões para combater facções criminosas e milícias em todo o país. Dos recursos totais, R$ 1 bilhão sai do Orçamento da União e R$ 10 bilhões serão emprestados aos estados pelo Banco Nacional de Desenvolvimento Econômico e Social (BNDES).

Quatro eixos contra o crime organizado

O programa estrutura-se em quatro eixos principais: asfixia financeira de organizações criminosas, segurança prisional, investigação de homicídios e combate ao tráfico de armas. Segundo a Presidência, a iniciativa foi construída “em diálogo com os estados, especialistas e forças de segurança pública” para “desarticular as bases econômicas, operacionais e sociais das organizações criminosas em todo o território nacional”.

Bloqueio financeiro de facções

O primeiro eixo cria a Força Integrada de Combate ao Crime Organizado (Ficco) e amplia o Comitê de Inteligência Financeira e Recuperação de Ativos (Cifra) para identificar empresas e fundos usados por facções criminosas. Em coletiva anterior, Lula afirmou ser necessário “destruir o potencial financeiro do crime organizado e das facções”, citando infiltração no futebol, empresas e Judiciário.

Segurança em presídios es",2026-05-12 09:36:43-03:00,https://revistaforum.com.br/politica/lula-plano-bilionario-seguranca/,revistaforum
"Kássio Nunes Marques convida Jair Bolsonaro, que está preso, para sua posse na presidência do TSE","O ministro do Supremo Tribunal Federal (STF) Kássio Nunes Marques, fez uma provocação e convidou Jair Bolsonaro (PL), ex-presidente que o indiciou à corte que","Indicado por Bolsonaro, Kássio Nunes Marques afirmou que seguiu praxe de convidar todos os ex-presidentes. Ministro atuou por indicado de Flávio Bolsonaro para vaga ocupada por André Mendonça, que será vice-presidente da corte eleitoral.

00:00 A+ A-

Ler o resumo da notícia Kássio Nunes Marques, ministro do STF, convidou o ex‑presidente Jair Bolsonaro, que cumpre prisão domiciliar, para a posse como presidente do TSE nesta terça‑feira (11).

André Mendonça, indicado por Bolsonaro, assumirá a vice‑presidência do TSE.

O convite segue a tradição de chamar ex‑presidentes; também foram convidados Dilma Rousseff, José Sarney, Fernando Collor e Lula, que ainda não confirmou presença.

A ministra Cármen Lúcia anunciou que deixará a presidência do TSE antes do fim do mandato, antecipando a eleição dos novos dirigentes devido ao calendário eleitoral.

O ministro do Supremo Tribunal Federal (STF) Kássio Nunes Marques, fez uma provocação e convidou Jair Bolsonaro (PL), ex-presidente que o indiciou à corte que cumpre prisão domiciliar, para sua posse como presidente do Tribunal Superior Eleitoral (TSE), que acontece nesta terça-feira (11). “Terrivelmente evangélico” e também indicação de Bolsonaro, André Mendonça ocupará a vice-presidência.

Ao justificar o convite, Nunes Marques informou que seguiu a “praxe” ao convidar todos os ex-presidentes do Brasil, como Dilma Rousseff, atual presidenta do Banco dos Brics, José Sarney e Fernando Collor de Mello, que também está em prisão domiciliar. Lula também foi convidado, mas ainda não confirmou presença.

Indicado por Bolsonaro para a corte, Nunes Marques atuou em dobradinha com Flávio Bolsonaro (PL-RJ) e Ciro Nogueira (PP-PI) em 2021 para tentar emplacar Alexandre Cordeiro, indicação do “01”, na cadeira deixada por Marco Aurélio Mello – que foi assumida por Mendonça.

Atualmente à frente da Corte, a ministra Cármen Lúcia afirmou que ia deixar o posto antes do término de seu mandato por causa das eleições.

“Como, em 3 de junho, res",2026-05-11 10:33:04-03:00,https://revistaforum.com.br/politica/kassio-nunes-marques-convida-bolsonaro-para-posse-no-tse/,revistaforum
Pesquisa Quaest revela impacto das “investigações do Caso Master envolvendo Ciro Nogueira” na campanha de Flávio Bolsonaro,"Pesquisa Quaest, encomendada pelo banco Genial, que será divulgada na próxima quarta-feira (13), vai medir pela primeira vez o impacto da ação desencadeada","Quaest inclui três perguntas sobre ação da PF contra Ciro Nogueira, ex-ministro da Casa Civil de Bolsonaro e articulador da campanha de Flávio, na nova pesquisa.

00:00 A+ A-

Ler o resumo da notícia Pesquisa Quaest, encomendada pelo banco Genial, será divulgada na próxima quarta‑feira (13) e mede o impacto da investigação da PF no Caso Master sobre a campanha de Flávio Bolsonaro.

Ciro Nogueira, ex‑ministro da Casa Civil e articulador da campanha de Flávio, é alvo da PF por suposta mensalidade de R$ 500 mil do dono do Banco Master para favorecer projetos no Senado.

O levantamento, em campo de 8 a 11 de outubro, pergunta se eleitores já sabiam da investigação, se acreditam que ela alcançará todas as autoridades e quem tem a imagem mais afetada (Congresso, STF, governo Lula, etc.).

Na última pesquisa Quaest, divulgada em 15 de abril, Lula liderava com 37 % das intenções de voto no primeiro turno, sendo este o primeiro estudo após a reunião de Lula com Donald Trump nos EUA.

Pesquisa Quaest, encomendada pelo banco Genial, que será divulgada na próxima quarta-feira (13), vai medir pela primeira vez o impacto da ação desencadeada pela Polícia Federal (PF) no caso Master que teve como alvo o ex-ministro da Casa Civil de Jair Bolsonaro (PL), Ciro Nogueira (PP-PI), um dos articuladores políticos da campanha de Flávio Bolsonaro (PL-RJ) junto ao Centrão.

Classificado por André Mendonça, relator do caso no Supremo Tribunal Federal (STF), como “destinatário central das vantagens indevidas e como agente público que, em tese, instrumentalizou o exercício do mandato parlamentar em favor dos interesses privados de Daniel Bueno Vorcaro”, Ciro Nogueira colocou a bomba Master no colo de Flávio Bolsonaro.

Na pesquisa, que está em campo desde a última sexta-feira (8) e será encerrada nesta segunda-feira (11), o instituto Quaest colocou três perguntas que tratam do tema:

Você já sabia sobre as investigações do Caso Master envolvendo Ciro Nogueira ou ficou sabendo agora? (Antes da p",2026-05-11 08:05:07-03:00,https://revistaforum.com.br/politica/quaest-impacto-do-caso-master-ciro-nogueira-na-campanha-de-flavio-bolsonaro/,revistaforum
