titulo,subtitulo,texto,data,url,portal
Terras raras e minerais críticos: Câmara vota projeto antes de encontro entre Lula e Trump,O tema das terras raras e dos minerais críticos se transformou em uma das disputas centrais da economia global por causa da corrida tecnológica e energética.,"Com o Brasil no centro da disputa global por terras raras, Câmara acelera votação de projeto estratégico defendido pelo governo Lula às vésperas do encontro entre o presidente brasileiro e Donald Trump nos EUA

TERRAS RARAS E MINERAIS CRíTICOS: CâMARA VOTA PROJETO ANTES DE ENCONTRO ENTRE LULA E TRUMP

TERRAS RARAS E MINERAIS CRíTICOS: CâMARA VOTA PROJETO ANTES DE ENCONTRO ENTRE LULA E TRUMP

00:00 A+ A-

Ler o resumo da notícia Câmara dos Deputados vota nesta quarta‑feira (6) o projeto da Política Nacional de Minerais Críticos e Estratégicos (PNMCE).

Relator Arnaldo Jardim propõe conselho, fundo garantidor de até R$ 5 bi, incentivos fiscais e controle de exportação para agregar valor às reservas de terras raras.

Projeto ganha destaque antes da reunião entre presidentes Lula e Trump em Washington, agendada para quinta‑feira (7).

Objetivo: diminuir a dependência da exportação de matéria‑prima bruta e estimular pesquisa, inovação e produção industrial no Brasil.

A Câmara dos Deputados deve votar nesta quarta-feira (6) o projeto de lei que cria a Política Nacional de Minerais Críticos e Estratégicos (PNMCE), proposta que ganhou dimensão geopolítica às vésperas da reunião entre o presidente Luiz Inácio Lula da Silva e Donald Trump, marcada para quinta-feira (7), em Washington.

O tema das terras raras e dos minerais críticos se transformou em uma das disputas centrais da economia global por causa da corrida tecnológica e energética. Esses materiais são fundamentais para a fabricação de carros elétricos, baterias, chips, turbinas eólicas, painéis solares e equipamentos militares.

O Brasil possui a segunda maior reserva de terras raras do planeta, atrás apenas da China, mas ainda tem participação reduzida na cadeia industrial global. A votação do projeto ocorre justamente em meio à pressão internacional para garantir acesso a esses recursos estratégicos.

O texto relatado pelo deputado Arnaldo Jardim (Cidadania-SP) busca consolidar uma política nacional para o setor, ",2026-05-06 11:36:23-03:00,https://revistaforum.com.br/politica/terras-raras-camara-vota/,revistaforum
"Mensalão do Master: Ciro Nogueira recebia mesada de Vorcaro e acumula R$ 18 milhões em propinas, diz PF","Classificado como ""amigo da vida"", o ex-ministro da Casa Civil de Jair Bolsonaro, Ciro Nogueira (PP-PI) recebia um mensalão de cerca de R$ 300 de Daniel","Ex-ministro da Casa Civil e aliado de Flávio Bolsonaro, Ciro ainda teria hospedagens em hotéis de luxo, como o Park Hyatt New York, e contas em restaurantes de alto padrão pagas por Vorcaro.

MENSALãO DO MASTER: CIRO NOGUEIRA RECEBIA MESADA DE VORCARO E ACUMULA R$ 18 MILHõES EM PROPINAS, DIZ PF

MENSALãO DO MASTER: CIRO NOGUEIRA RECEBIA MESADA DE VORCARO E ACUMULA R$ 18 MILHõES EM PROPINAS, DIZ PF

00:00 A+ A-

Ler o resumo da notícia Ex‑ministro da Casa Civil Ciro Nogueira (PP‑PI) recebeu mensalmente até R$ 500 mil de Daniel Vorcaro para defender a chamada “emenda Master”.

A Polícia Federal aponta que o total de propinas pagas ao senador pode superar R$ 18 milhões.

A emenda, redigida pelo Banco Master, propunha elevar a cobertura do Fundo Garantidor de Crédito de R$ 250 mil para R$ 1 milhão por CPF, beneficiando seus CDBs.

O texto da emenda foi impresso por Vorcaro e entregue ao senador em envelope rotulado “Ciro”, conforme decisão do ministro André Mendonça.

Classificado como “amigo da vida”, o ex-ministro da Casa Civil de Jair Bolsonaro, Ciro Nogueira (PP-PI) recebia um mensalão de cerca de R$ 300 de Daniel Vorcaro, que chegou a R$ 500 mil, para defender a chamada emenda Master, que beneficiaria diretamente o banqueiro. Segundo as investigações, a propina paga ao senador pode ultrapassar R$ 18 milhões.

Lobista de Vorcaro, o senador apresentou uma emenda à Proposta de Emenda à Constituição (PEC) que trata da autonomia financeira do Banco Central. O texto sugeria elevar o limite de cobertura do Fundo Garantidor de Crédito (FGC) de R$ 250 mil para R$ 1 milhão por CPF.

O modelo de negócios do Banco Master estava fortemente baseado na emissão de Certificados de Depósito Bancário (CDBs) com garantia do FGC. Com a ampliação do teto de cobertura, os títulos emitidos pela instituição passariam a contar com proteção maior para investidores.

Segundo a investigação da PF, a emenda teria sido elaborada pelo próprio Banco Master, por meio da assessoria jurídica, enviada",2026-05-07 08:17:35-03:00,https://revistaforum.com.br/politica/mensalao-do-master-ciro-nogueira-18-milhoes-em-propina/,revistaforum
TST condena empresários por assédio eleitoral pró-Bolsonaro,TST condena empresários por assédio eleitoral pró-Bolsonaro contra trabalhadores em SC; entidades terão de pagar R$ 600 mil.,"Entidades empresariais de Santa Catarina terão de pagar R$ 600 mil por estimular patrões a pressionar trabalhadores contra Lula nas eleições de 2022; caso foi revelado pela Fórum em reportagem exclusiva com áudios

00:00 A+ A-

Ler o resumo da notícia O Tribunal Superior do Trabalho (7ª Turma) condenou a ACIC, a CDL de Caçador e a AMPE do Alto Vale do Contestado, e seus presidentes, a pagar R$ 600 mil por dano moral coletivo por assédio eleitoral nas eleições de 2022.

A decisão se baseou em gravações divulgadas pela Revista Fórum em outubro de 2022, que mostraram empresários pressionando trabalhadores a votar contra Lula e a favor da reeleição de Jair Bolsonaro.

O Ministério Público do Trabalho ajuizou ação civil pública contra as entidades, alegando que organizaram reunião antes do segundo turno para incitar medo de “virar Venezuela” e perda de empregos.

O TST reconheceu que a estratégia visava criar clima de temor e responsabilizar os empregados por suposta crise caso não seguissem a orientação política das empresas.

O Tribunal Superior do Trabalho condenou empresários por assédio eleitoral pró-Bolsonaro contra trabalhadores em Caçador, em Santa Catarina, nas eleições de 2022. ACIC, CDL de Caçador e AMPE do Alto Vale do Contestado terão de pagar R$ 600 mil por dano moral coletivo por estimular patrões a pressionar funcionários contra Lula e a favor da reeleição de Jair Bolsonaro.

A decisão foi divulgada pelo Tribunal Superior do Trabalho e foi tomada pela 7ª Turma no processo RR-809-24.2022.5.12.0013. O julgamento reformou decisões anteriores da Justiça do Trabalho em Santa Catarina, que haviam rejeitado a ação do Ministério Público do Trabalho.

A Revista Fórum revelou o caso em outubro de 2022, com áudios de uma reunião entre empresários e políticos de Caçador. O material mostrava uma ação articulada para orientar empregadores a pressionar trabalhadores no segundo turno da eleição presidencial.

TST condena empresários por assédio eleitoral revelado pela Fó",2026-05-05 07:47:22-03:00,https://revistaforum.com.br/revista-forum/tst-condena-empresarios-por-assedio-eleitoral/,revistaforum
"Morre Sacha de Moraes Carvalho, filho de Heloísa Helena, aos 42 anos","Segundo informações da Rede Sustentabilidade, a cerimônia de despedida do filho de Heloísa Helena ocorrerá na capital fluminense, restrita à família","Segundo informações da Rede Sustentabilidade, a cerimônia de despedida ocorrerá na capital fluminense, restrita à família

00:00 A+ A-

Ler o resumo da notícia Sacha de Moraes Carvalho, 42, filho da deputada federal Heloísa Helena (Rede‑Sustentabilidade), morreu na segunda‑feira (4) após dez dias internado no Hospital Municipal Miguel Couto, no Rio, por parada cardiorrespiratória.

A cerimônia de despedida será realizada na capital fluminense, restrita à família.

A deputada agradeceu orações, mensagens de apoio e o atendimento da equipe do Hospital Miguel Couto.

Em post no Instagram, Heloísa Helena dedicou mensagem emotiva ao filho, chamando‑o de seu “primeiro grande amor”.

Morreu nesta segunda-feira (4) Sacha de Moraes Carvalho, filho mais velho da deputada federal Heloísa Helena (Rede-RJ), aos 42 anos. A morte se deu em decorrência de parada cardiorrespiratória, após um período de dez dias de internação no Hospital Municipal Miguel Couto, no Rio de Janeiro.

Segundo informações da Rede Sustentabilidade, a cerimônia de despedida ocorrerá na capital fluminense, restrita à família.

“A deputada agradece as orações, as mensagens de apoio e a dedicação da equipe do Hospital Miguel Couto, que não mediu esforços no atendimento”, diz a nota da legenda.

Em seu perfil no Instagram, a deputada se manifestou. “Te amo para sempre, meu primeiro filhotinho, meu primeiro grande amor. Com imensa dor, sei que devo te dizer – Vá em paz, pois seu coração era puro demais pra suportar esse mundo de tantas dores, injustiças, lágrimas, preconceitos”, postou.",2026-05-04 22:20:36-03:00,https://revistaforum.com.br/politica/morre-filho-de-heloisa-helena/,revistaforum
Moraes proíbe Alerj de soltar deputado e mantém Thiago Rangel na cadeia,"O ministro Alexandre de Moraes, do Supremo Tribunal Federal (STF), determinou nesta quarta-feira (6) a manutenção da prisão preventiva do deputado estadual","Ministro do Supremo exortou aos colegas que Corte acabe com a farra das Assembleias estaduais que colocam seus integrantes em liberdade, passando por cima da Justiça

00:00 A+ A-

Ler o resumo da notícia Ministro Alexandre de Moraes (STF) manteve, nesta quarta (6), a prisão preventiva do deputado estadual Thiago Rangel (Avante).

A decisão impede a Assembleia Legislativa do Rio (Alerj) de soltar o parlamentar, sem necessidade de autorização dos demais deputados.

Rangel foi alvo da quarta fase da Operação Unha e Carne, da Polícia Federal, que investiga esquema de corrupção na Secretaria Estadual de Educação.

Mensagens interceptadas apontam que o deputado ofereceu cargos a indicados por traficante “Junior do Beco”, reforçando a gravidade das acusações.

O ministro Alexandre de Moraes, do Supremo Tribunal Federal (STF), determinou nesta quarta-feira (6) a manutenção da prisão preventiva do deputado estadual Thiago Rangel (Avante). Em um despacho contundente, o magistrado estabeleceu que a medida cautelar deve ser cumprida imediatamente e de forma soberana, sem a necessidade de submissão ou autorização dos pares do parlamentar na Assembleia Legislativa do Rio (Alerj).

Thiago Rangel foi o alvo central da quarta fase da Operação Unha e Carne, deflagrada pela Polícia Federal na última terça-feira (5). A investigação apura um esquema de corrupção enraizado na Secretaria Estadual de Educação do Rio de Janeiro, envolvendo fraudes em processos licitatórios e contratação de serviços.

As evidências que pesam contra o parlamentar são graves: mensagens interceptadas entre Rangel e seu braço direito, Fábio Pourbaix de Azevedo, revelam um balcão de negócios ilícitos. Segundo a PF, o deputado chegou a oferecer cargos na estrutura da Educação para pessoas indicadas por “Junior do Beco”, um traficante de alta periculosidade com histórico de homicídios.

O fim da “blindagem” legislativa

A decisão de Moraes é uma resposta direta ao histórico recente da Alerj. O ministro citou nomina",2026-05-06 16:29:27-03:00,https://revistaforum.com.br/politica/moraes-alerj-deputado-thiago-rangel-cadeia/,revistaforum
“Não vendo a alma”: Vice de Nunes ataca Tarcísio e PL após ser rifado na disputa pelo Senado,"Mello Araújo reage à escolha de nome apadrinhado por Valdemar Costa Neto, expõe racha interno e diz que Tarcísio e a cúpula do partido ""não são bolsonaristas""","Mello Araújo reage à escolha de nome apadrinhado por Valdemar Costa Neto, expõe racha interno e diz que Tarcísio e a cúpula do partido ""não são bolsonaristas""

00:00 A+ A-

Ler o resumo da notícia O vice de Nunes criticou o governador Tarcísio e o deputado PL.

A crítica ocorreu após o vice ser excluído da disputa pelo Senado.

O discurso enfatizou que não venderia a alma por cargos.

A controvérsia surge no contexto da corrida eleitoral para o Senado.

O vice-prefeito de São Paulo, Ricardo Mello Araújo (PL), afirmou nesta quarta-feira (6) que teria sido preterido como um dos pré-candidatos ao Senado na chapa do governador paulista Tarcísio de Freitas (Republicanos) porque “não vende a alma”.

“O Tarcísio e o Valdemar [Costa Neto, presidente nacional do PL] queriam outro perfil e convenceram o Eduardo [Bolsonaro]. Sou o político que não rouba e não deixa roubar, que não faz amarras. Eu não vendo a minha alma para chegar em nenhum lugar. Como já sabem, comigo não existe negociação”, afirmou Araújo.

Nesta terça-feira (5), foi anunciada oficialmente a chapa de Tarcísio em São Paulo. Além do deputado federal Guilherme Derrite (PP), que já havia sido definido como pré-candidato ao Senado, o deputado estadual André do Prado (PL), atual presidente da Assembleia Legislativa de São Paulo (Alesp) concorrerá à outra vaga. Eduardo Bolsonaro será o primeiro suplente de Prado e o segundo será o ex-prefeito de Holambra, Fernando Fiori de Godoy.

Prado era o nome favorito de Valdemar Costa Neto, e contava com o endosso de Tarcísio de Freitas (Republicanos). O obstáculo era convencer o “03”, hoje radicado nos Estados Unidos, que perdeu o mandato de deputado federal e tem contra si um inquérito aberto no Supremo Tribunal Federal (STF). O acordo foi fechado após visita do dirigente partidário ao ex-deputado federal.

Mello Araújo: Tarcísio e PL “não são bolsonaristas”

Araújo chegou a ter sua candidatura ventilada pelo ex-presidente Jair Bolsonaro (PL), já que é considerado um “bolso",2026-05-06 20:11:23-03:00,https://revistaforum.com.br/politica/vice-nunes-ataca-tarcisio-pl-senado/,revistaforum
Na mira da Justiça: Zema pode ser denunciado por difamação; entenda,"PGR estuda atender pedido feito pelo ministro Gilmar Mendes, do STF, para investigar ex-governador de Minas Gerais","00:00 A+ A-

Ler o resumo da notícia Ex-governador de Minas Gerais e pré-candidato à presidência, Romeu Zema, está sob análise da PGR para possível denúncia por difamação.

O pedido foi feito pelo ministro Gilmar Mendes, que solicitou a inclusão de Zema no inquérito de fake news que tramita no STF há sete anos.

A equipe do procurador‑geral Paulo Gonet avalia se o compartilhamento de um vídeo com IA, satirizando Mendes e o ministro Dias Toffoli, caracteriza crime contra a honra.

Se aceita, a denúncia poderia ser apresentada fora do inquérito conduzido por Alexandre de Moraes.

O ex-governador de Minhas Gerais e pré-candidato à presidência da República, Romeu Zema (Novo), está na mira da Justiça. Ele pode ser incluído em uma das duas frentes de investigação.

A Procuradoria-Geral da República (PGR) avalia qual encaminhamento dará ao pedido de Gilmar Mendes, ministro do Supremo Tribuna Federal, para inserir Zema no inquérito das fake news, que tramita no STF já há sete anos.

A equipe de Paulo Gonet, procurador-geral da República, está estudando quais crimes poderiam estar incorporados no caso, se existe alguma relação com o inquérito das fake news e se o ex-governador de Minas poderia ser incluído no processo.

Uma das possibilidades é a apresentação de uma denúncia contra Zema, por difamação contra o ministro, fora do inquérito conduzido por Alexandre de Moraes. O entendimento inicial é que o episódio específico corresponde a crime contra a honra e que não teria gravidade necessária para ser incluído no inquérito das fake news.

Solicitação de Gilmar Mendes

O ministro Gilmar Mendes pediu ao colega Alexandre de Moraes, responsável pela apuração, que Zema fosse investigado depois de ter compartilhado um vídeo, produzido com inteligência artificial, no qual dois fantoches, representando Gilmar e Dias Toffoli, discutem o escândalo do Banco Master. Moraes transferiu o pedido do colega ao PGR.",2026-05-05 12:28:47-03:00,https://revistaforum.com.br/politica/zema-denunciado-difamacao-entenda/,revistaforum
Minerais críticos e a posição do PT na Câmara,"A bancada do PT na Câmara votou a favor da Política Nacional de Minerais Críticos e Estratégicos (PNMCE), aprovada nesta quarta-feira (6), e afirmou que a","Partido do presidente Lula considera a legislação sobre terras raras e minerais críticos e estratégicos aprovada na Câmara ""um avanço necessário, porém insuficiente""

A POSIçãO DO PT APóS APROVAçãO DE POLíTICA PARA TERRAS RARAS E MINERAIS CRíTICOS NA CâMARA

A POSIçãO DO PT APóS APROVAçãO DE POLíTICA PARA TERRAS RARAS E MINERAIS CRíTICOS NA CâMARA

00:00 A+ A-

Ler o resumo da notícia A bancada do PT votou a favor da Política Nacional de Minerais Críticos e Estratégicos (PNMCE) na Câmara dos Deputados nesta quarta‑feira (6).

O partido declarou que a aprovação representa um avanço para a soberania, mas considera as medidas ainda insuficientes frente à disputa global por terras raras.

Em nota, o PT reafirmou a defesa da criação da Terrabras e de mecanismos mais rígidos de controle estatal sobre a exploração mineral.

A lei cria o Fundo Garantidor da Atividade Mineral (Fgam) com aporte inicial de R$ 2 bilhões da União e define diretrizes para minerais estratégicos em energia, tecnologia e defesa.

A bancada do PT na Câmara votou a favor da Política Nacional de Minerais Críticos e Estratégicos (PNMCE), aprovada nesta quarta-feira (6), e afirmou que a proposta representa um avanço importante para a soberania brasileira. O partido, porém, avaliou que as medidas aprovadas ainda são insuficientes diante da disputa geopolítica global em torno das terras raras e minerais estratégicos.

Em nota divulgada após a votação, o PT declarou que seguirá defendendo a criação da Terrabras, uma empresa pública nacional voltada ao setor, além de mecanismos mais rígidos de controle estatal sobre a exploração mineral. Para a bancada, o Brasil precisa deixar de atuar apenas como exportador de matéria-prima e avançar na industrialização e no domínio tecnológico dessas cadeias produtivas.

“A legislação em debate avança ao criar instrumentos públicos de coordenação, planejamento e indução”, afirma a nota. O texto também sustenta que o país “precisa de lei, precisa de Estado, precisa de plane",2026-05-07 05:50:05-03:00,https://revistaforum.com.br/politica/posicao-pt-minerais-criticos/,revistaforum
"Flávio Bolsonaro faz dobradinha com Ciro Nogueira, o “amigo da vida” de Vorcaro, para atacar Lula em economia","Após imergir diante do escândalo do Banco Master, Ciro Nogueira (PPO-PI), o ""amigo da vida"" de Daniel Vorcaro, voltou a atacar Lula nas redes sociais e ganhou","Após imergir diante do escândalo de Vorcaro, Ciro Nogueira voltou a atacar Lula pelo programa Desenrola e teve apoio de Flávio Bolsonaro, que foi cobrado por aliado sobre as propostas que esconde na Economia.

FLáVIO BOLSONARO FAZ DOBRADINHA COM CIRO NOGUEIRA, O “AMIGO DA VIDA” DE VORCARO, PARA ATACAR LULA EM ECONOMIA

FLáVIO BOLSONARO FAZ DOBRADINHA COM CIRO NOGUEIRA, O “AMIGO DA VIDA” DE VORCARO, PARA ATACAR LULA EM ECONOMIA

00:00 A+ A-

Ler o resumo da notícia Flávio Bolsonaro compartilhou nas redes a crítica de Ciro Nogueira ao governo Lula, apontando “descontrole fiscal” e gastos excessivos.

Nogueira, principal lobista de Vorcaro e da Faria Lima, afirmou que tais políticas elevam a taxa de juros e comprimem a renda dos brasileiros.

O lobista citou que a alta dos juros foi mantida na gestão de Roberto Campos Neto no Banco Central e está sendo reduzida gradualmente por Gabriel Galípolo.

A divulgação ocorreu após Flávio Bolsonaro fechar acordo político com Davi Alcolumbre e Alexandre de Moraes, encerrando a CPI do Master.

Após imergir diante do escândalo do Banco Master, Ciro Nogueira (PPO-PI), o “amigo da vida” de Daniel Vorcaro, voltou a atacar Lula nas redes sociais e ganhou o apoio de Flávio Bolsonaro (PL) para atacar o presidente justamente na economia, pauta que na gestão de Paulo Guedes e Jair Bolsonaro (PL) permitiu com que o banqueiro desse início à série de crimes investigados pela Polícia Federal.

Principal lobista de Vorcaro e da Faria Lima, Ciro Nogueira atacou Lula por lançar “dois “Desenrola” no espaço de apenas um mandato” e fez eco à narrativa da mídia liberal e do sistema financeiro, de que há “descontrole fiscal” e “gastos desenfreados”, que seriam o motivo para a alta taxa de juros, elevada durante a gestão Roberto Campos Neto no Banco Central (BC) – e que vem sendo reduzida aos poucos por Gabriel Galípolo para não provocar choro e ranger de dentes no “mercado”.

“O descontrole fiscal do Planalto não é prejudicial somente pelo mal exemplo",2026-05-05 13:37:44-03:00,https://revistaforum.com.br/politica/flavio-bolsonaro-faz-dobradinha-com-ciro-nogueira-o-amigo-da-vida-de-vorcaro-para-atacar-lula-em-economia/,revistaforum
Revista Fórum,,"Brecha

Pablo Melian, da AFP

Com o corte confirmado do atacante do Real Madrid e a nova lesão da joia do Chelsea, abre-se uma brecha inesperada para o retorno do astro do Santos à lista de convocados do Brasil",,https://revistaforum.com.br/editoria/esporte/,revistaforum
PF encontra mensagens com menções a atos violentos em celular de deputado preso no RJ,"A Polícia Federal (PF) encontrou mensagens com menções a atos violentos no celular do deputado estadual Thiago Rangel (Avante), preso pela Polícia Federal","Thiago Rangel, preso no âmbito da Operação Unha e Carne, coordenava ataques a opositores em grupos

PF ENCONTRA MENSAGENS COM MENçõES A ATOS VIOLENTOS EM CELULAR DE DEPUTADO PRESO NO RJ

PF ENCONTRA MENSAGENS COM MENçõES A ATOS VIOLENTOS EM CELULAR DE DEPUTADO PRESO NO RJ

00:00 A+ A-

Ler o resumo da notícia Polícia Federal prendeu o deputado estadual Thiago Rangel (Avante) em 5 de maio, na quarta fase da Operação Unha e Carne, que investiga fraudes em contratos da Secretaria de Educação do RJ.

Investigadores interceptaram mensagens no celular do parlamentar contendo ameaças de violência contra um crítico chamado Felipe.

As conversas, trocadas em 2021 com o assessor Fábio Pourbaix Azevedo, incluíam planos de “mandar uma surpresa” e referência a “12 tiros no portão”.

As mensagens foram inseridas na decisão do ministro Alexandre de Moraes (STF), que autorizou a deflagração da operação.

A Polícia Federal (PF) encontrou mensagens com menções a atos violentos no celular do deputado estadual Thiago Rangel (Avante), preso pela Polícia Federal (PF). O parlamentar foi alvo nesta terça-feira (5) da quarta fase da Operação Unha e Carne, que apura supostas fraudes em contratos de compras para a Secretaria de Educação do estado.

Durante as investigações, os investigadores da PF interceptaram, com autorização judicial, conversas entre o deputado e outros acusados de pertencer ao suposto esquema de desvios.

Os diálogos foram inseridos na decisão do ministro Alexandre de Moraes, do Supremo Tribunal Federal (STF), que autorizou a deflagração da operação.

Em 2021, em uma das mensagens enviadas pelo WhatsApp a Fábio Pourbaix Azevedo, braço direito do deputado, Thiago Rangel sugeriu “mandar uma surpresa” a um homem identificado como Felipe, que o criticou em uma rede social. Na época, Thiago exercia o cargo de vereador.

“Thiago Rangel, por sua vez, responde dizendo ‘vou dar jeito nele’, e pede a Fábio para descobrir o endereço de Felipe. Mais adiante, envia mensagem dizendo qu",2026-05-06 11:50:41-03:00,https://revistaforum.com.br/politica/pf-mensagens-mencoes-atos-violentos-em-celular-deputado-preso-rj/,revistaforum
