titulo,subtitulo,texto,data,url,portal
"Quem é Dr. Luizinho, líder do PP que tentou sair escondido da casa de Ciro Nogueira","Líder do PP na Câmara, Dr. Luizinho tentou sair escondido da casa de Ciro Nogueira durante ação da PF e estava no voo investigado no caso das malas.","Deputado do Rio estava em voo investigado pela PF no caso das malas que entraram sem fiscalização no aeroporto de São Roque

QUEM é DR. LUIZINHO, LíDER DO PP QUE TENTOU SAIR ESCONDIDO DA CASA DE CIRO NOGUEIRA

QUEM é DR. LUIZINHO, LíDER DO PP QUE TENTOU SAIR ESCONDIDO DA CASA DE CIRO NOGUEIRA

00:00 A+ A-

Ler o resumo da notícia Na quinta‑feira (7), o deputado Dr. Luizinho, líder do PP na Câmara, foi flagrado em Brasília tentando sair discretamente da casa do senador Ciro Nogueira, alvo da 5ª fase da Operação Compliance Zero.

A operação investiga suspeitas de corrupção, lavagem de dinheiro e organização criminosa ligadas ao Banco Master e realizou busca e apreensão na residência de Ciro Nogueira.

Dr. Luizinho também estava no voo investigado pela PF por transportar cinco volumes sem fiscalização, que desembarcaram no Aeroporto Executivo Internacional Catarina, em São Roque (SP).

Autorizada pelo ministro André Mendonça (STF), a fase cumpriu dez mandados de busca e apreensão e um de prisão temporária em Piauí, São Paulo, Minas Gerais e Distrito Federal.

Dr. Luizinho, líder do PP na Câmara dos Deputados, foi flagrado nesta quinta-feira (7), em Brasília, tentando sair sem ser visto da casa do senador Ciro Nogueira (PP-PI), alvo de busca e apreensão da Polícia Federal na 5ª fase da Operação Compliance Zero, que apura suspeitas de corrupção, lavagem de dinheiro, organização criminosa e crimes contra o Sistema Financeiro Nacional ligados ao Banco Master.

O deputado também estava no voo investigado pela PF no caso das malas do aeroporto. A apuração mira a entrada de cinco volumes sem fiscalização no Brasil após desembarque no Aeroporto Executivo Internacional Catarina, em São Roque, no interior de São Paulo. No avião também estavam Ciro Nogueira, o presidente da Câmara, Hugo Motta (Republicanos-PB), e o deputado Isnaldo Bulhões (MDB-AL).

O episódio na casa de Ciro foi revelado pela matéria-mãe da Fórum, que mostrou o líder do PP tentando deixar a residência abaixado ",2026-05-08 07:23:38-03:00,https://revistaforum.com.br/politica/dr-luizinho-ciro-nogueira/,revistaforum
Brasil e EUA confirmam nova rodada de negociações comerciais em 30 dias,"Após a reunião entre os presidentes Luiz Inácio Lula da Silva e Donald Trump, o Brasil já está se preparando para uma nova rodada de negociações com os","00:00 A+ A-

Ler o resumo da notícia Lula e Trump se reuniram e anunciaram nova rodada de negociações comerciais entre Brasil e EUA.

O ministro Márcio Elias Rosa afirmou que, em 30 dias, haverá reunião para discutir o fim das tarifas e o encerramento da Seção 301.

O Brasil apresentou dados que refutam a alegação de comércio desleal com os Estados Unidos.

Foram debatidos investimentos mútuos, com o Brasil ampliando investimentos nos EUA e empresas americanas expandindo no Brasil.

Após a reunião entre os presidentes Luiz Inácio Lula da Silva e Donald Trump, o Brasil já está se preparando para uma nova rodada de negociações com os Estados Unidos.

O ministro do Desenvolvimento, Márcio Elias Rosa, afirmou que, nos próximos 30 dias, o governo brasileiro e os americanos devem se reunir novamente para discutir o fim das tarifas impostas aos produtos brasileiros e o encerramento da Seção 301.

Durante a coletiva, Rosa destacou que o Brasil apresentou dados que desmentem a ideia de uma relação comercial desleal com os EUA. “Apresentamos todos os dados que desmentem a existência de uma relação comercial desarmoniosa entre os nossos países”, afirmou o ministro. A Seção 301 é um mecanismo utilizado pelos Estados Unidos para investigar práticas comerciais que consideram prejudiciais, e o Brasil quer que o procedimento seja encerrado o mais rápido possível.

O ministro também apontou que, além das tarifas, foram discutidos os investimentos dos dois países. O Brasil tem investido mais nos Estados Unidos, enquanto empresas americanas também têm aumentado suas operações por aqui. Rosa afirmou que a próxima reunião, marcada para ocorrer em 30 dias, será um momento importante para que os dois países avancem na resolução dessas questões comerciais pendentes.

Ao longo da coletiva, Rosa também enfatizou a importância de que a negociação não só resolva os impasses tarifários, mas também seja um passo na criação de uma relação comercial mais equilibrada e estratégica entre os dois paí",2026-05-07 17:14:52-03:00,https://revistaforum.com.br/politica/brasil-e-eua-confirmam-nova-rodada-de-negociacoes-comerciais-em-30-dias/,revistaforum
Revista Fórum,,"TERROR

Policial civil aposentado Divoney Perasa de Souza divulgou vídeo ameaçando decapitar a ex-esposa e ""jogar bola"" com a cabeça dela. Ele fugiu pela segunda vez em pouco mais de um ano e é procurado pela polícia do Amazonas.",,https://revistaforum.com.br/editoria/mulher/,revistaforum
"Mendonça e Ciro: Com juiz e acusado bolsonaristas, haverá possibilidade de justiça?",Brasília amanheceu nesta quinta-feira (7) sob o impacto de mais uma operação da Polícia Federal que atinge o coração do poder político nacional: o Congresso.,"00:00 A+ A-

Ler o resumo da notícia Na manhã de quinta‑feira (7), a Polícia Federal realizou operação no Congresso de Brasília contra o senador Ciro Nogueira (PP‑PI).

Nogueira é investigado por integrar esquema que desviava recursos do banqueiro Daniel Vorcaro, dono do Banco Master.

O Supremo Tribunal Federal designou o ministro André Mendonça como relator do caso, após a desistência de Dias Toffoli, suscitando dúvidas sobre imparcialidade por vínculos anteriores entre os dois.

A ação destaca supostas ligações entre membros do governo Bolsonaro e o Judiciário, alimentando debate sobre a independência da justiça.

Brasília amanheceu nesta quinta-feira (7) sob o impacto de mais uma operação da Polícia Federal que atinge o coração do poder político nacional: o Congresso. O alvo central é o senador Ciro Nogueira (PP-PI), cacique-mor do Centrão, envolvido em um esquema que, segundo as investigações, drenava montantes vultosos do banqueiro Daniel Vorcaro, dono do Banco Master, que tentava expandir seus trambiques com a ajuda direta e bem paga do parlamentar. Contudo, para além das cifras milionárias e do modus operandi da tal organização criminosa, um elemento institucional acende o alerta máximo na capital federal: a relação umbilical entre o investigado e o magistrado responsável por julgar seus atos no Supremo Tribunal Federal.

O sorteio que designou o ministro André Mendonça como relator do caso não foi dos mais mais tranquilos e veio depois da desistência do relator inicial, o ministro Dias Toffoli, suspeito de estar também enrolado no escândalo. Após isso, com a chegada de Mendonça para o posto, a situação tornou-se um verdadeiro teste de estresse para a noção de imparcialidade do Judiciário. Mendonça e Nogueira não são apenas figuras que frequentaram os mesmos salões até pouco tempo atrás, eles foram peças-chave do mesmo tabuleiro de xadrez que sustentou o governo de Jair Bolsonaro (PL). Enquanto um operava a máquina política como ministro-chefe da Casa Civil,",2026-05-07 15:23:57-03:00,https://revistaforum.com.br/politica/mendonca-ciro-bolsonaristas-justica/,revistaforum
Lula afirma ter debatido com Trump o combate ao crime organizado,Presidente citou em suas redes uma série de medidas adotadas pelo governo brasileiro; ele falou também sobre o plano que será lançado na próxima semana,"Presidente citou em suas redes uma série de medidas adotadas pelo governo brasileiro; ele falou também sobre o plano que será lançado na próxima semana

00:00 A+ A-

Ler o resumo da notícia Lula e Donald Trump se encontraram na Casa Branca, na quinta‑feira, 7, para discutir o combate ao crime organizado.

Lula informou que foi criada uma base em Manaus com polícias da América do Sul para enfrentar tráfico de armas e drogas na fronteira brasileira, convidando os EUA a participar.

O presidente brasileiro enfatizou a necessidade de destruir o potencial financeiro das facções criminosas.

Trump elogiou Lula, chamando‑o de “bom homem” e “inteligente”, e afirmou que a reunião foi ótima.

O presidente Luiz Inácio Lula da Silva afirmou através de suas redes sociais nesta sexta-feira (08), ter debatido com o presidente dos EUA Donald Trump sobre o combate ao crime organizado.

“Um dos temas que debatemos na reunião com o presidente Trump foi o combate ao crime organizado”, afirmou Lula. O presidente lembrou durante a sua visita à Casa Branca: “Temos uma extraordinária Polícia Federal e muita experiência no combate ao tráfico de drogas e de armas. Nossas aduanas já estão cooperando neste sentido”.

Segundo Lula, foi criada “uma base na cidade de Manaus com a participação de representantes das polícias de países da América do Sul para combater o crime organizado, o tráfico de armas e drogas na fronteira brasileira. Se os Estados Unidos quiserem participar conosco, estarão convidados”, lembrou.

“Também precisamos destruir o potencial financeiro do crime organizado e das facções”, alertou Lula. “Esta é outra frente de trabalho importante que estamos atuando, e que estamos dispostos a colaborar. E que integra o plano Brasil Contra o Crime Organizado, que vamos lançar na semana que vem”, encerrou.

A visita

O presidente dos Estados Unidos, Donald Trump, voltou a elogiar o presidente Luiz Inácio Lula da Silva após reunião com o mandatário brasileiro nesta quinta-feira (7) na Cas",2026-05-08 12:11:29-03:00,https://revistaforum.com.br/politica/lula-afirma-ter-debatido-com-trump-o-combate-ao-crime-organizado/,revistaforum
STJ aplica pena recorde de 25 anos a ex-governador bolsonarista,Maior condenação da história da Corte Especial pune desvios milionários que teriam sido usados para enriquecer núcleo familiar de político bolsonarista,"00:00 A+ A-

Ler o resumo da notícia O Superior Tribunal de Justiça (STJ) aplicou 25 anos de prisão a ex-governador bolsonarista, estabelecendo a pena mais longa já registrada no tribunal.

A Corte Especial do Superior Tribunal de Justiça (STJ) impôs a maior pena já registrada em uma ação penal originária (processo que tem início diretamente na Corte) do tribunal ao condenar o ex-governador do Acre, Gladson Cameli (PP), a 25 anos e nove meses de prisão em regime inicial fechado. Ele foi considerado culpado pelos crimes de organização criminosa, corrupção ativa e passiva, peculato, lavagem de dinheiro e fraudes em licitações.

Cameli também foi condenado a pagar R$ 11.785.020,31 em multa e indenização ao estado do Acre. A decisão do colegiado decretou ainda a perda de seu cargo público, embora o ex-mandatário já houvesse renunciado no mês passado com a intenção de disputar uma vaga no Senado Federal nas eleições de 2026.

De acordo com a relatora do caso, ministra Nancy Andrighi, o ex-governador usou seu cargo para estruturar um esquema ilícito dividido em núcleos familiar, político e empresarial. A ministra destacou que o então governador e seu irmão, Gledson de Lima Cameli, arquitetaram um esquema de contratação fraudulenta de empresas ligadas a este último, para prestação de serviços de alto custo ao estado do Acre.

A estratégia, segundo ela, incluía a contratação indireta e dissimulada da Construtora Rio Negro Ltda., da qual o irmão do governador seria sócio. “Extraem-se dos autos diversas movimentações financeiras que apontam que a verba desviada do erário enriqueceu Gladson e seu núcleo familiar”, observou a magistrada.

Nancy Andrighi também rejeitou as alegações de nulidade apresentadas pela defesa de Cameli. Segundo ela, a decisão do STF que declarou a invalidade de provas por usurpação de competência não comprometeu o andamento da ação penal, uma vez que tais elementos não foram utilizados nem na denúncia nem em seu voto de mérito. “O artigo 157, parágrafo",2026-05-07 20:18:06-03:00,https://revistaforum.com.br/politica/stj-pena-ex-governador-bolsonarista/,revistaforum
"Caso Master: Romeu Zema esconde Marcelo Aro, “rabo preso” dele com Ciro Nogueira","Enquanto busca lacrar nas redes sociais com declarações polêmicas - às vezes criminosas, como a defesa do trabalho infantil - e um discurso para atacar","Enquanto busca lacrar com seu discurso contra os ""intocáveis"", Zema esconde que seu ex-Casa Civil e principal articulador político é vice-presidente do PP, de Ciro Nogueira. Saiba quem é Marcelo Aro.

00:00 A+ A-

Ler o resumo da notícia Romeu Zema, ex‑governador de Minas e pré‑candidato à Presidência, tem Marcelo Aro como principal articulador político.

Marcelo Aro, vice‑presidente nacional do Progressistas, atua como interlocutor de Ciro Nogueira em Minas Gerais.

Na última semana, Zema esteve em Brasília e se reuniu com o senador Ciro Nogueira para discutir pautas do governo.

Após derrota no Senado em 2022, Aro foi transferido em fevereiro de 2025 da Secretaria da Casa Civil para a Secretaria de Governo, assumindo a articulação política de Zema.

Enquanto busca lacrar nas redes sociais com declarações polêmicas – às vezes criminosas, como a defesa do trabalho infantil – e um discurso para atacar aqueles que considera “intocáveis”, especialmente no caso Master, Romeu Zema (Novo) esconde o “rabo preso” que tem com Ciro Nogueira (PP-PI), ex-ministro da Casa Civil de Jair Bolsonaro (PL), que é considerado pela Polícia Federal como principal lobista da organização criminosa de Daniel Vorcaro.

Ex-governador mineiro e pré-candidato à Presidência, Zema tem como um de seus principais articuladores políticos Marcelo Aro (PP-MG), seu ex-secretário de governo, que comanda o Progressistas no Estado e é vice-presidente nacional da sigla, que tem Ciro Nogueira no comando desde 2013.

Zema, que faz malabarismos para atacar Lula no caso Master, ignora que tem “rabo preso” com o cacique piauiense, que controla o PP com mão de ferro. Aro é o principal interlocutor de Nogueira em Minas Gerais e foi considerado líder do governo Zema no Congresso Nacional até 2023, quando cumpria seu segundo mandato como deputado federal.

Próxima de Nogueira, Aro chegou a intermediar um encontro entre Zema e o então chefe da Casa Civil de Bolsonaro em julho de 2021.

“Nesta semana, o Governador @r",2026-05-11 12:14:40-03:00,https://revistaforum.com.br/politica/master-romeu-zema-rabo-preso-dele-com-ciro-nogueira/,revistaforum
"“Passo importante na relação com os EUA”, diz Lula após encontro com Trump","O presidente Luiz Inácio Lula da Silva e o presidente dos Estados Unidos, Donald Trump, se reuniram nesta quinta-feira (7), na Casa Branca, para discutir uma","“PASSO IMPORTANTE NA RELAçãO COM OS EUA”, DIZ LULA APóS ENCONTRO COM TRUMP

“PASSO IMPORTANTE NA RELAçãO COM OS EUA”, DIZ LULA APóS ENCONTRO COM TRUMP

00:00 A+ A-

Ler o resumo da notícia Lula e Trump se encontraram nesta quinta-feira (7) para tratar de tarifas comerciais, segurança e mineração de terras raras.

Lula pediu a revisão das tarifas americanas, apontando déficit comercial de US$ 20 bi e a escassa participação de empresas dos EUA em licitações brasileiras.

O presidente brasileiro destacou a necessidade de cooperação bilateral para combater tráfico de armas, drogas e crime organizado.

O encontro foi descrito por Lula como “passo importante” na relação Brasil‑Estados Unidos, visando fortalecer a soberania nacional e a cooperação.

O presidente Luiz Inácio Lula da Silva e o presidente dos Estados Unidos, Donald Trump, se reuniram nesta quinta-feira (7), na Casa Branca, para discutir uma série de temas cruciais para o futuro das relações entre Brasil e EUA. O encontro, que durou cerca de três horas, abordou o comércio bilateral, questões de segurança internacional, e a exploração de minerais críticos.

Após a reunião, Lula participou de uma coletiva de imprensa na embaixada brasileira em Washington e destacou os principais pontos discutidos.

Brasil busca revisão de medidas comerciais

Lula reafirmou o interesse do Brasil em revisar as tarifas impostas pelos EUA. Durante a reunião, o presidente brasileiro destacou a necessidade de um diálogo aberto sobre o déficit comercial, que chega a US$ 20 bilhões.

O presidente brasileiro também criticou a falta de presença das empresas americanas nas licitações brasileiras, especialmente nas áreas de infraestrutura. “Estamos dispostos a discutir o comércio e as tarifas de forma justa, sem unilateralismo”, afirmou Lula.

LEIA TAMBÉM: Mídia dos EUA reconhece quem lidera a América do Sul

Segurança e crime organizado

Outro ponto discutido foi o combate ao crime organizado. Lula destacou a necessidade de uma ação conjun",2026-05-07 17:38:48-03:00,https://revistaforum.com.br/politica/passo-importante-na-relacao-com-os-eua-diz-lula-apos-encontro-com-trump/,revistaforum
Efeito Master: Tarcísio se cala e cancela ato com Ciro Nogueira após PF colocar aliado no centro do escândalo,"A hecatombe causada pela operação Compliance Zero, que colocou Ciro Nogueira (PP-PI), ex-ministro da Casa Civil de Jair Bolsonaro (PL), no centro das","Tarcísio e Flávio Bolsonaro sequer tocam no nome de Ciro Nogueira e temem que a PF avance sobre Rueda, do União Brasil. Candidato ao Senado pelo PP, Derrite escondeu o presidente do partido ao divulgar lançamento da campanha.

EFEITO MASTER: TARCíSIO SE CALA E CANCELA ATO COM CIRO NOGUEIRA APóS PF COLOCAR ALIADO NO CENTRO DO ESCâNDALO

EFEITO MASTER: TARCíSIO SE CALA E CANCELA ATO COM CIRO NOGUEIRA APóS PF COLOCAR ALIADO NO CENTRO DO ESCâNDALO

00:00 A+ A-

Ler o resumo da notícia Operação Compliance Zero da PF colocou Ciro Nogueira (PP‑PI) no centro das investigações do caso Master.

O governador Tarcísio Gomes de Freitas (Republicanos‑SP) cancelou o ato conjunto com Nogueira e Antônio Rueda (União Brasil), previsto para 4 e adiado para 11 de abril.

Em declaração ao Estadão, Tarcísio qualificou o caso como “escândalo grave” que deve ser investigado, sem comentar Nogueira.

Nogueira foi tratado como persona non grata e ocultado na divulgação da candidatura ao Senado marcada para 15 de abril, gerando temores sobre a união da direita.

A hecatombe causada pela operação Compliance Zero, que colocou Ciro Nogueira (PP-PI), ex-ministro da Casa Civil de Jair Bolsonaro (PL), no centro das investigações sobre o caso Master, causou turbulência também na pré-campanha eleitoral de Tarcísio Gomes de Freitas (Republicanos) em São Paulo.

Assim como Flávio Bolsonaro (PL-RJ), pré-candidato do grupo político à Presidência, Tarcísio se calou sobre Ciro Nogueira e tratou a ação da PF no Caso Master de forma genérica em breve declaração ao Estadão.

“É um escândalo grave precisa ser apurado, precisa ser investigado, doa a quem doer”, disse Tarcísio. “Todas as pessoas que tem envolvimento precisam ser investigadas”, emendou o governador paulista, sem tocar no nome do aliado.

A ação da PF por pouco não causou um estrago maior na pré-campanha do governador paulista. Ciro Nogueira, presidente nacional do PP, e Antônio Rueda, que comanda o União Brasil, estariam no ato de apoio à campanha",2026-05-08 13:27:01-03:00,https://revistaforum.com.br/politica/master-tarcisio-se-cala-e-cancela-ato-com-ciro-nogueira/,revistaforum
Sâmia Bomfim aciona Corregedoria e MP por ação truculenta de PMs contra estudantes na USP,A deputada federal Sâmia Bomfim (PSOL) anunciou que adotará medidas legais contra a operação da Polícia Militar na Universidade de São Paulo (USP). A,"00:00 A+ A-

Ler o resumo da notícia Deputada Sâmia Bomfim solicitou à Corregedoria da PM e ao Ministério Público a apuração de suposta ação truculenta de policiais contra estudantes que ocupavam a reitoria da USP.

A ocupação da reitoria começou na quinta‑feira (7 de maio) como protesto por moradia e alimentação estudantil, com estudantes em greve há três semanas.

Por volta das 4h15 da madrugada, a Polícia Militar interveio sem ordem judicial, após a universidade cortar serviços básicos ao prédio.

Os manifestantes cobram ampliação da assistência socioeconômica e melhorias na infraestrutura, alegando que os aumentos nos auxílios estudantis foram insuficientes.

A deputada federal Sâmia Bomfim (PSOL) anunciou que adotará medidas legais contra a operação da Polícia Militar na Universidade de São Paulo (USP). A parlamentar informou pelas redes sociais que acionará a Corregedoria da Polícia Militar e o Ministério Público diante da operação e relatou que a tropa de choque empregou bombas de efeito moral, gás lacrimogêneo e cassetetes, deixando os estudantes feridos.

“Estou acionando a Corregedoria da Polícia Militar e o Ministério Público para apurar a conduta ilegal e truculenta na última madrugada”, escreveu Sâmia. A ocupação da reitoria daa USP começou na última quinta-feira, por meio da defesa de pautas relativas à moradia e alimentação estudantil. Segundo o Diretório Central dos Estudantes, a intervenção policial ocorreu por volta das 4h15, sem reintegração de posse autorizada pela Justiça, e após o corte de serviços básicos pela universidade.

Em greve, estudantes da USP ocupam reitoria e cobram novas negociações

Nesta quinta-feira (7), estudantes em greve da USP ocuparam o prédio da reitoria com um cordão humano para cobrar novas negociações. A paralisação, que já dura três semanas, cobra melhoria das condições de permanência e infraestrutura da universidade e ampliação da assistência socioeconômica.

De acordo com os estudantes, a reitoria não tem atendido de",2026-05-11 09:38:16-03:00,https://revistaforum.com.br/politica/samia-bomfim-aciona-corregedoria-e-mp-por-acao-truculenta-de-pms-contra-estudantes-na-usp/,revistaforum
Bolsonaro pede ao STF anulação do processo do golpe e absolvição de todos os crimes,"A defesa de Jair Bolsonaro protocolou, nesta sexta-feira (8), um pedido de revisão criminal no Supremo Tribunal Federal (STF) para anular sua condenação de 27","Pedido foi protocolado pela defesa de Bolsonaro no mesmo dia em que Davi Alcolumbre promulgou a Lei da Dosimetria; entenda

BOLSONARO PEDE AO STF ANULAçãO DO PROCESSO DO GOLPE E ABSOLVIçãO DE TODOS OS CRIMES

BOLSONARO PEDE AO STF ANULAçãO DO PROCESSO DO GOLPE E ABSOLVIçãO DE TODOS OS CRIMES

00:00 A+ A-

Ler o resumo da notícia Jair Bolsonaro solicitou ao Supremo Tribunal Federal a anulação do processo judicial relativo ao suposto golpe.

O pedido inclui a absolvição de todos os crimes que lhe foram imputados.

A defesa de Jair Bolsonaro protocolou, nesta sexta-feira (8), um pedido de revisão criminal no Supremo Tribunal Federal (STF) para anular sua condenação de 27 anos e 3 meses de prisão por envolvimento na tentativa de golpe de Estado de 2023. O ex-presidente, condenado por crimes como organização criminosa armada, tentativa de abolição do Estado Democrático de Direito e golpe de Estado, quer que todo o processos seja declarado nulo e que o STF emita uma nova sentença de absolvição.

Pedido de revisão criminal de Bolsonaro: o que está em jogo?

A defesa de Bolsonaro argumenta que a condenação é fruto de um “erro judiciário”. De acordo com seus advogados, o julgamento foi conduzido de forma inadequada, pois, na visão da defesa, Bolsonaro deveria ter sido julgado pelo plenário do STF, dada a sua condição de ex-presidente, e não pela Primeira Turma. Eles afirmam que a sentença deve ser anulada para corrigir essa falha processual.

Em um trecho do pedido protocolado, os advogados de Bolsonaro argumentam:

“O pedido visa corrigir um erro judiciário que prejudicou a defesa do ex-presidente, e é imprescindível para garantir a justiça do processo.”

A defesa também questiona a colaboração premiada de Mauro Cid, ex-ajudante de ordens de Bolsonaro, e pede a nulidade de todas as provas derivadas dessa delação, alegando que não foi voluntária.

Lei da Dosimetria e o pedido de Bolsonaro

Curiosamente, o pedido de revisão criminal foi protocolado no mesmo dia em que a Lei d",2026-05-09 06:42:18-03:00,https://revistaforum.com.br/politica/bolsonaro-anulacao-golpe-stf/,revistaforum
Revista Fórum,,"Brecha

Pablo Melian, da AFP

Com o corte confirmado do atacante do Real Madrid e a nova lesão da joia do Chelsea, abre-se uma brecha inesperada para o retorno do astro do Santos à lista de convocados do Brasil",,https://revistaforum.com.br/editoria/esporte/,revistaforum
