titulo,subtitulo,texto,data,url,portal
O que o PT pretende fazer em MG com a desistência de Rodrigo Pacheco,"A sucessão estadual em Minas Gerais, peça-chave no tabuleiro estratégico de 2026 para o presidente Lula (PT), sofreu um abalo irreversível nos últimos dias","00:00 A+ A-

Ler o resumo da notícia O PT viu seu plano de sucessão em Minas Gerais para 2026 ser abalado após a desistência do senador Rodrigo Pacheco (PSB‑MG).

A decisão de Pacheco vem após a rejeição de Jorge Messias ao STF, que gerou suspeitas de “jogo duplo” ao apoiar Davi Alcolumbre (União‑AP).

A cúpula do PT já elabora “planos B, C e D”, tratando a candidatura de Pacheco como fora do baralho.

Fontes indicam que Pacheco não tem pretensão de concorrer ao governo estadual, deixando o partido buscar outra alternativa.

A sucessão estadual em Minas Gerais, peça-chave no tabuleiro estratégico de 2026 para o presidente Lula (PT), sofreu um abalo irreversível nos últimos dias que altera profundamente o planejamento do Palácio do Planalto. O que antes era apenas uma desconfiança silenciosa sobre o real entusiasmo do senador Rodrigo Pacheco (PSB-MG) em disputar o Palácio Tiradentes, agora transbordou para uma crise de confiança política de grandes proporções. A Fórum apurou que a cúpula do PT já trabalha intensamente com um “plano B”, ou até mesmo “planos C e D”, passando a tratar a candidatura do ex-presidente do Senado como uma carta praticamente fora do baralho. A avaliação interna é de que o cenário mudou de figura e exige rapidez para que o palanque mineiro, o segundo maior do país e visto também como o mais importante, não fique à deriva diante das forças de extrema direita nos cenários estadual e nacional.

O estopim para essa deterioração acelerada da relação foi a recente rejeição do nome de Jorge Messias para o Supremo Tribunal Federal (STF). Nos bastidores de Brasília, a leitura de setores influentes e próximos ao governo é de que Pacheco teria operado um perigoso “jogo duplo”, mantendo uma fachada de apoio institucional ao indicado de Lula enquanto, por baixo dos panos, auxiliava Davi Alcolumbre (União-AP) na articulação minuciosa da derrota de Messias. Embora o presidente Lula tenha tentado colocar panos quentes publicamente nesse aspecto específico, af",2026-05-05 15:22:01-03:00,https://revistaforum.com.br/politica/pt-mg-rodrigo-pacheco/,revistaforum
Ex-presidente do BRB deve citar Ibaneis e Celina Leão em delação do caso Master,"O ex-presidente do Banco de Brasília (BRB), Paulo Henrique Bezerra Rodrigues Costa, deve citar Ibaneis e Celina Leão em delação do caso Master.","00:00 A+ A-

Ler o resumo da notícia Ex‑presidente do Banco de Brasília (BRB) deve citar o governador Ibaneis e a deputada Celina Leão em delação.

A delação está vinculada ao caso Master, que está sob investigação.

Não foram divulgadas data ou local para a apresentação da delação.

O ex-presidente do Banco de Brasília (BRB), Paulo Henrique Bezerra Rodrigues Costa, iniciou tratativas para firmar um acordo de colaboração premiada no âmbito das investigações do caso Master, que apura suspeitas de fraudes bilionárias envolvendo operações financeiras entre o BRB e o Banco Master.

As negociações ainda estão em fase preliminar, mas já indicam que Costa pretende apresentar um conjunto robusto de informações às autoridades. Segundo relatos iniciais, o ex-dirigente elencou cerca de 20 episódios considerados irregulares, incluindo operações classificadas como heterodoxas e possíveis esquemas de fraude. Ele também teria se comprometido a apresentar provas relacionadas aos fatos e aos envolvidos.

Ibaneis Rocha e Celina Leão podem ser citados

Entre os nomes que podem ser citados na eventual delação estão figuras centrais da política do Distrito Federal. O ex-governador Ibaneis Rocha aparece entre os mencionados, enquanto a atual governadora Celina Leão surge como possível novidade na lista.

Além deles, o material preliminar incluiria referências a um ministro do Tribunal de Contas da União (TCU), um dirigente partidário ligado ao Centrão, servidores do Banco Central e deputados distritais. Parlamentares federais, por ora, não estariam entre os citados.

Prisão mantida pelo STF impulsiona negociação

A iniciativa de colaborar com as investigações foi formalizada após a Segunda Turma do Supremo Tribunal Federal (STF) decidir manter a prisão preventiva de Costa. Em petição encaminhada ao ministro relator André Mendonça, a defesa informou a intenção de contribuir com as apurações “possivelmente por meio de colaboração premiada”.

Os advogados também solicitaram a transferência ",2026-05-03 09:42:32-03:00,https://revistaforum.com.br/politica/ex-presidente-brb-delacao-master/,revistaforum
Revista Fórum,,"Lugares do Brasil

Anne Silva

Na região do semiárido, inserido no bioma da Caatinga e porta de entrada para a Chapada Diamantina, um município baiano é opção para a modalidade de ecoturismo “rústico” que tem chamado a atenção dos brasileiros nos últimos anos",,https://revistaforum.com.br/editoria/brasil/nordeste/,revistaforum
Flávio Bolsonaro ataca general acusado por Van Hatten: “não está à altura do Exército”,Senador Flávio Bolsonaro ataca general do Exército e defende Marcel van Hattem após bate-boca tenso nos corredores da Câmara dos Deputados.,"Senador reforça pressão contra a cúpula do Exército e endossa ofensiva de deputado do Novo; Wajngarten engrossa ataques e cita ""BBBs'.

00:00 A+ A-

Ler o resumo da notícia Senador Flávio Bolsonaro (PL‑RJ) defendeu o deputado Marcel van Hattem (Novo‑RS) na sexta‑feira (1º) após este acusar o general Emílio Vanderlei Ribeiro de constrangimento na Câmara dos Deputados.

Van Hattem alegou que o general o abordou após criticar o comandante do Exército, general Tomás Paiva, em sessão da Comissão de Relações Exteriores e de Defesa Nacional em 29 de abril.

Em post no X, Flávio Bolsonaro afirmou que o militar “não está à altura do Exército Brasileiro”, reforçando a ofensiva da direita contra o Alto Comando.

O caso amplia a crise política entre o Congresso e as Forças Armadas, intensificando a pressão sobre o comandante Tomás Paiva, alvo de críticas desde que isolou o Exército de articulações golpistas

O senador Flávio Bolsonaro (PL-RJ) saiu em defesa do deputado federal Marcel van Hattem (Novo-RS) nesta sexta-feira (1º), após o parlamentar acusar o general do Exército Brasileiro Emílio Vanderlei Ribeiro de tentar constrangê-lo nas dependências da Câmara dos Deputados. O episódio intensifica a crise e a ofensiva bolsonarista contra o atual Alto Comando militar.

Em publicação no X (antigo Twitter), Flávio Bolsonaro atacou o militar, que atua como chefe da assessoria parlamentar do Exército: “Minha solidariedade ao @marcelvanhattem! Esse tipo de militar não está à altura do Exército Brasileiro!”.

Ofensiva bolsonarista contra Tomás Paiva e a cúpula do Exército

A confusão ocorreu na última quarta-feira (29), após uma sessão da Comissão de Relações Exteriores e de Defesa Nacional. Van Hattem afirma ter sido abordado pelo general Emílio logo após discursar com duras críticas ao comandante da Força, general Tomás Paiva.

A reação de Flávio Bolsonaro mira diretamente a interlocução institucional das Forças Armadas com o Congresso Nacional, reforçando a pressão política contra ",2026-05-02 11:35:22-03:00,https://revistaforum.com.br/politica/flavio-bolsonaro-ataca-general/,revistaforum
"Conselho de Ética aprova suspensão dos mandatos de Marcos Pollon, Zé Trovão e Marcel Van Hattem",O Conselho de Ética e Decoro Parlamentar da Câmara dos Deputados aprovou nesta terça-feira (5) a suspensão dos mandatos dos deputados bolsonaristas Marcos,"Bolsonaristas tiveram seus mandatos suspensos por motim golpista realizado na Câmara em 2025; decisão ainda precisa passar pelo plenário da Casa

00:00 A+ A-

Ler o resumo da notícia Conselho de Ética e Decoro Parlamentar da Câmara dos Deputados aprovou, em 5 de maio, a suspensão de 60 dias dos deputados Marcos Pollon (PL‑MS), Zé Trovão (PL‑SC) e Marcel Van Hattem (Novo‑RS).

A punição decorre da participação dos parlamentares na ocupação da Mesa Diretora em agosto de 2025, durante motim que visava pressionar a votação de anistia para envolvidos nos atos golpistas de 8 de janeiro.

O parecer, elaborado pelo deputado Moses Rodrigues (União‑CE), aumentou a sanção de 30 para 60 dias, justificando a necessidade de resposta institucional ao bloqueio do funcionamento do Parlamento.

A decisão ainda precisa ser aprovada pela Comissão de Constituição e Justiça e pelo plenário da Câmara, com apoio de ao menos 257 deputados, para se tornar definitiva.

O Conselho de Ética e Decoro Parlamentar da Câmara dos Deputados aprovou nesta terça-feira (5) a suspensão dos mandatos dos deputados bolsonaristas Marcos Pollon (PL-MS), Zé Trovão (PL-SC) e Marcel Van Hattem (Novo-RS) por 60 dias. Os três parlamentares foram punidos pela participação na ocupação da Mesa Diretora da Câmara durante o motim realizado em agosto de 2025 para pressionar pela votação da anistia aos envolvidos nos atos golpistas de 8 de janeiro.

A decisão do colegiado ainda precisará passar pela Comissão de Constituição e Justiça (CCJ) e, posteriormente, pelo plenário da Câmara, onde dependerá do apoio de ao menos 257 deputados para ser confirmada.

O parecer aprovado foi elaborado pelo deputado Moses Rodrigues (União-CE), que endureceu a punição inicialmente sugerida pela Mesa Diretora — de 30 para 60 dias de afastamento. Segundo o relator, era necessário dar uma resposta institucional firme diante da tentativa de inviabilizar o funcionamento do Parlamento.

“Não se pode admitir que um grupo de parlamentares, qualqu",2026-05-06 04:38:21-03:00,https://revistaforum.com.br/politica/conselho-etica-suspensao-dos-mandatos/,revistaforum
Nikolas Ferreira no jatinho de Vorcaro: TCU envia caso à Justiça eleitoral,O Tribunal de Contas da União (TCU) enviou ao Tribunal Superior Eleitoral (TSE) e ao Ministério Público Eleitoral (MPE) a representação para investigar,"Nikolas Ferreira comemorou nas redes o ""arquivamento"" do caso. No entanto, TCU reconheceu não ter competência para julgar o caso e enviou ação sobre voos do deputado no jatinho de Vorcaro para fazer campanha para Bolsonaro à Justiça Eleitoral.

00:00 A+ A-

Ler o resumo da notícia TCU enviou ao TSE e ao Ministério Público Eleitoral representação para investigar Nikolas Ferreira (PL‑MG) por usar jet de Daniel Vorcaro em campanha de Jair Bolsonaro nas eleições de 2022.

A ação, assinada pelo subprocurador‑geral Lucas Rocha, foi apresentada pelo MP que atua junto ao TCU, que reconheceu falta de competência e arquivou o caso em sua corte.

O Embraer 505 Phenom 300, registrado ao grupo Prime You, teria levado Ferreira a pelo menos 10 destinos – capitais do Nordeste, DF, Vale do Jequitinhonha e Triângulo Mineiro – acompanhado do pastor Guilherme Batista na “caravana Juventude pelo Brasil”.

A denúncia surgiu após Valdemar da Costa Neto revelar depósito de R$ 3 mi por pastor Fabiano Zettel na conta de Bolsonaro, e foi divulgada por Malu Gaspar no O Globo.

O Tribunal de Contas da União (TCU) enviou ao Tribunal Superior Eleitoral (TSE) e ao Ministério Público Eleitoral (MPE) a representação para investigar Nikolas Ferreira (PL-MG) pelo uso de um jatinho de Daniel Vorcaro, dono do Banco Master, para fazer campanha para Jair Bolsonaro (PL) em 2022.

A ação, assinada pelo subprocurador-geral Lucas Rocha, foi apresentada pelo Ministério Público que atua junto ao TCU, que reconheceu não ser o âmbito para tramitação do processo, enviou à justiça eleitoral e arquivou o caso na corte.

Nas redes, o deputado bolsonarista comemorou como se o processo tivesse chegado ao fim, ignorando o fato que a apreciação agora será feita em outra esfera judicial.

“Nada como um dia após o outro”, escreveu.

Jatinho de Vorcaro

Após Valdemar da Costa Neto revelar que o pastor Fabiano Zettel teria depositado R$ 3 milhões “diretamente na conta do [Jair] Bolsonaro” em 2022, foi revelado em março que N",2026-05-02 07:58:50-03:00,https://revistaforum.com.br/politica/nikolas-ferreira-no-jatinho-de-vorcaro-caso-justica-eleitoral/,revistaforum
Blog do Rovai,,"BLOG DO ROVAI

Mas, por que Wagner trairia Lula e o governo do qual indicou inúmeros ministros e assessores? Quando essa pergunta é feita, a resposta é que o caso do Banco Master faria parte da explicação.",,https://revistaforum.com.br/editoria/blogs/blog-do-rovai/,revistaforum
Política de Privacidade,"Esta Política de Privacidade descreve como a Revista Fórum (“Revista”) coleta, utiliza, armazena e protege os dados pessoais dos usuários que acessam seus","Introdução

Esta Política de Privacidade descreve como a Revista Fórum (“Revista”) coleta, utiliza, armazena e protege os dados pessoais dos usuários que acessam seus conteúdos e serviços digitais. Ao utilizar qualquer serviço disponibilizado pela Revista, o usuário declara estar ciente e de acordo com as práticas descritas neste documento.

Coleta de Dados Pessoais

A Revista pode coletar dados fornecidos diretamente pelo usuário, como nome, e-mail, dados de assinatura, informações de pagamento e dados enviados em formulários, comentários ou áreas de interação. Também podem ser coletadas informações de navegação, incluindo endereço IP, páginas acessadas, dispositivo, navegador e cookies.

Finalidades do Tratamento

Os dados pessoais coletados pela Revista são utilizados para possibilitar o acesso a conteúdos, gerenciar assinaturas, enviar comunicações, melhorar a experiência do usuário, personalizar conteúdos, garantir a segurança da plataforma e cumprir obrigações legais aplicáveis.

Compartilhamento de Dados

A Revista não vende dados pessoais. O compartilhamento poderá ocorrer somente com fornecedores e parceiros necessários para a operação dos serviços, como sistemas de pagamento, hospedagem e plataformas de envio de mensagens, sempre respeitando esta Política de Privacidade e a legislação vigente.

Comentários e Conteúdo Gerado por Usuários

A Revista oferece espaços de interação, como fóruns e seções de comentários. O usuário é responsável pelo conteúdo que publica. Mensagens ofensivas, discriminatórias, ilícitas ou que violem direitos de terceiros poderão ser removidas, conforme os Termos de Uso.

Cookies e Tecnologias de Rastreamento

A Revista utiliza cookies e tecnologias semelhantes para melhorar o desempenho do site, analisar métricas, personalizar experiências e exibir publicidade relevante. O usuário pode ajustar as preferências de cookies diretamente em seu navegador.

Segurança da Informação

A Revista adota medidas técnicas e administrativas para p",2025-11-27 09:48:21-03:00,https://revistaforum.com.br/politica-de-privacidade/,revistaforum
Revista Fórum,,"COBRANÇA AUTOMÁTICA

Sistema de cobrança automático está no centro de reclamações da população da Costa Verde, faixa litorânea situada no sul do estado do RJ. Iniciativa foi do ex-ministro de Bolsonaro, hoje governador de SP",,https://revistaforum.com.br/editoria/rio/,revistaforum
Revista Fórum,,"OPINIÃO

Arthur Oscar Guimarães

Quando tratamos de Terras Raras são inúmeras as razões pelas quais nos parece fundamental que o País não abra mão de sua soberania. A opção aqui não é o debate apenas para especialistas, mas trazer a todo leitor interessado no tema um texto compreensível, franco, objetivo e claro",,https://revistaforum.com.br/editoria/opiniao/,revistaforum
"VÍDEO: “Esse cara ainda quer ser presidente”, diz Lindbergh sobre Zema",Ex-governador de Minas Gerais e pré-candidato à presidência da República defendeu trabalho infantil,"00:00 A+ A-

Ler o resumo da notícia Em entrevista ao podcast “Inteligência Limitada”, na sexta‑feira 1º de maio, o ex‑governador de Minas Gerais, Romeu Zema, afirmou que “trabalhar não prejudica a criança” e citou crianças nos EUA entregando jornais.

O deputado federal Lindbergh reagiu ao vídeo, acusando Zema de defender trabalho infantil e de ter defendido jornada de 12 horas para trabalhadores.

Lindbergh também lembrou que Zema já fez ataques a nordestinos e questionou sua candidatura à presidência da República.

O parlamentar vinculou as declarações de Zema ao histórico de 350 anos de escravidão no Brasil, alegando que tal discurso mantém viva essa cultura.

O deputado federal Lindbergh Farias (PT-RJ) fez duras críticas ao ex-governador de Minas Gerais, Romeu Zema (Novo). O pré-candidato à presidência da República defendeu o trabalho infantil, durante participação em um podcast. O parlamentar publicou um vídeo nas redes sociais, neste sábado (2), para reagir às afirmações.

Em entrevista ao podcast Inteligência Limitada, na sexta-feira (1º), Dia do Trabalhador, Zema disse: “No Brasil parece que a esquerda criou essa noção de que trabalhar prejudica a criança. Lá fora, nos Estados Unidos, criança sai entregando jornal. Aqui é proibido, você está escravizando criança. Então, é lamentável. Mas acho que, tenho certeza que nós vamos mudar isso aí”.

Lindbergh reagiu: “Zema defendendo trabalho infantil. Esse cara já atacou nordestino, já defendeu que os trabalhadores tivessem jornada de 12 horas diárias. Veja isso aqui”, disse, postando o vídeo em que o ex-governador mineiro defende o trabalho infantil.

“E esse cara ainda quer ser presidente da República. É a velha cabeça escravocrata. Nós tivemos 350 anos de escravidão no nosso país. Essa cultura ainda está presente numa fala como essa”, completou o deputado.

Junto ao vídeo, Lindbergh escreveu: “Trabalho infantil não é solução, Zema. É retrocesso. Romeu Zema normalizando criança trabalhando como se fosse algo pos",2026-05-02 18:02:31-03:00,https://revistaforum.com.br/politica/video-esse-cara-presidente-lindbergh-zema/,revistaforum
"Lula recebe derrubada do veto da Dosimetria, mas deve se recusar a promulgar a lei",A derrubada do veto presidencial ao projeto da Dosimetria pelo Congresso Nacional abriu um novo capítulo na disputa política e jurídica sobre os,"PT deve acionar o STF para derrubar lei que reduz pena de Bolsonaro e outros condenados por tentativa de golpe de Estado

LULA RECEBE DERRUBADA DO VETO DA DOSIMETRIA, MAS DEVE SE RECUSAR A PROMULGAR A LEI

LULA RECEBE DERRUBADA DO VETO DA DOSIMETRIA, MAS DEVE SE RECUSAR A PROMULGAR A LEI

00:00 A+ A-

Ler o resumo da notícia Lula recebeu nesta segunda‑feira (4) a decisão do Congresso que derrubou seu veto ao projeto da Dosimetria.

O presidente tem 48 horas para promulgar a lei, mas aliados indicam que ele deve delegar a tarefa ao presidente do Senado, Davi Alcolumbre.

A proposta reduz penas de condenados por crimes contra o Estado Democrático de Direito, beneficiando, entre outros, o ex‑presidente Jair Bolsonaro.

O PT pretende levar a lei ao STF para contestar sua constitucionalidade, alegando que a redução de penas fragiliza a resposta institucional ao golpe de 8 de janeiro.

A derrubada do veto presidencial ao projeto da Dosimetria pelo Congresso Nacional abriu um novo capítulo na disputa política e jurídica sobre os desdobramentos dos atos golpistas de 8 de janeiro. O presidente Luiz Inácio Lula da Silva recebeu a decisão formal nesta segunda-feira (4), mas, segundo aliados, não deve promulgar a nova lei, transferindo a responsabilidade ao presidente do Senado, Davi Alcolumbre.

Pelo rito constitucional, Lula tem até 48 horas para promulgar o texto após a formalização da derrubada do veto. Caso não o faça, a tarefa passa automaticamente ao comando do Senado — cenário considerado como certo dentro do Planalto.

A proposta, que reduz consideravelmente penas para condenados por crimes contra o Estado Democrático de Direito, configura uma iniciativa beneficiar diretamente envolvidos na tentativa de golpe, incluindo o ex-presidente Jair Bolsonaro, que está em prisão domiciliar.

Governo e PT reagem e preparam ofensiva no STF

A reação do governo deve seguir pelo caminho judicial. Integrantes do Partido dos Trabalhadores (PT) confirmam que a legenda pretende acionar",2026-05-05 06:07:02-03:00,https://revistaforum.com.br/politica/lula-veto-dosimetria-lei/,revistaforum
"Disputa presidencial, escala 6x1 e bets: o que traz a nova pesquisa Real Time Big Data",Levantamento inédito da Real Time Big Data testa a força de Lula contra nomes da direita e mede o pulso da população sobre temas polêmicos,"Levantamento testa a força de Lula contra nomes da direita e mede o pulso da população sobre temas polêmicos

00:00 A+ A-

Ler o resumo da notícia Pesquisa Real Time Big Data será divulgada nesta terça‑feira (5) e analisa a disputa presidencial e temas do debate político no Brasil.

No primeiro turno são testados dois cenários, um com Ciro Gomes (PSDB) como pré‑candidato e outro sem ele; no segundo turno há cinco simulações com Lula contra Ciro, Flávio Bolsonaro (PL), Ronaldo Caiado (PSD), Romeu Zema (Novo) e Renan Santos (Missão).

O questionário avalia a aprovação de propostas como redução da jornada 6x1 para 5x2, proibição de propaganda de apostas esportivas e diminuição da maioridade penal para 16 anos, além da isenção do IR para rendimentos até R$ 5 mil.

Também são perguntados posicionamentos sobre afirmações sociais, confiança nas instituições (STF, Congresso, imprensa, Forças Armadas) e apoio a Trump, servindo como termômetro para o governo e a percepção econômica.

Está prevista para esta terça-feira (5) a divulgação de uma pesquisa Real Time Big Data sobre a disputa presidencial, abordando também outras questões presentes no debate político brasileiro.

Em relação à corrida pelo Planalto, são testados dois cenários de primeiro turno, uma com Ciro Gomes (PSDB) como pré-candidato e outro sem o tucano. Já no segundo turno, são avaliadas cinco simulações com Lula enfrentando Ciro, Flávio Bolsonaro (PL), Ronaldo Caiado (PSD), Romeu Zema (Novo) e Renan Santos (Missão).

Propostas sob análise

A Real Time Big Data questiona se os entrevistados aprovam ou reprovam as propostas que estão no debate político e uma que já está em vigor, a isenção do Imposto de Renda de Pessoa Física para quem ganha até 5 mil reais mensais. Os eleitores são questionados sobre a redução da escala da jornada de trabalho de 6×1 para 5×2, proibição de divulgação de propaganda das bets (empresas de apostas esportivas) e diminuição da maioridade penal para 16 anos.

O entrevistado é confront",2026-05-04 22:58:25-03:00,https://revistaforum.com.br/politica/nova-pesquisa-real-time-big-data/,revistaforum
Revista Fórum,,"DEBATES

Rodrigo Monteiro e Jacy Afonso

Chegamos em 2026, passados cerca de 250 anos do início da revolução industrial e quase 140 anos da abolição da escravidão, e durante a discussão do fim da escala de trabalho 6 x 1 e da adoção da jornada de 5 x 2 é impressionante observar como a narrativa se mantém: “a economia não vai aguentar”",,https://revistaforum.com.br/editoria/debates/,revistaforum
