titulo,subtitulo,texto,data,url,portal
Câmara aprova penas maiores para estupro e assédio sexual,"A Câmara dos Deputados aprovou projeto de lei que aumenta as penas pelos crimes de estupro, assédio sexual e registro não autorizado da intimidade sexual.","Projeto que segue para o Senado também trata de crimes relacionados a pedofilia no Estatuto da Criança e do Adolescente (ECA)

00:00 A+ A-

Ler o resumo da notícia Câmara dos Deputados aprovou o PL 3984/25, que aumenta as penas para estupro, assédio sexual e registro não autorizado de intimidade sexual.

Projeto, de autoria da deputada Delegada Katarina (PSD‑SE) e substituído pela relatora Delegada Ione (Avante‑MG), eleva a pena de estupro de 6‑10 para 8‑12 anos, e de 12‑30 para 14‑32 anos quando resulta em morte.

Quando há lesão grave, a pena de estupro passa de 8‑12 para 10‑14 anos; o assédio sexual tem a detenção aumentada de 1‑2 para 2‑4 anos.

O registro não autorizado da intimidade sexual tem a detenção elevada de 6 meses‑1 ano para 1‑3 anos, e o texto prevê punições mais severas para crimes de pedofilia no ECA.

A Câmara dos Deputados aprovou projeto de lei que aumenta as penas pelos crimes de estupro, assédio sexual e registro não autorizado da intimidade sexual. Também haverá punição maior para os crimes relacionados a pedofilia no Estatuto da Criança e do Adolescente (ECA). A proposta será enviada ao Senado.

De autoria da deputada Delegada Katarina (PSD-SE), o Projeto de Lei 3984/25 foi aprovado com substitutivo da relatora, deputada Delegada Ione (Avante-MG).

Segundo o texto, a pena por estupro passa de 6 a 10 anos de reclusão para 8 a 12 anos. Quando da conduta resultar lesão grave, a pena atual de 8 a 12 anos ficará de 10 a 14 anos. Se resultar em morte da vítima, a reclusão de 12 a 30 anos passa a ser de 14 a 32 anos.

O assédio sexual, cuja pena atual é de detenção de 1 a 2 anos, será punido com pena de detenção de 2 a 4 anos. Já o registro não autorizado da intimidade sexual, atualmente punível com detenção de 6 meses a 1 ano, passa para detenção de 1 a 3 anos.

Haverá ainda aumento de 1/3 a 2/3 da pena se os crimes contra a dignidade sexual forem cometidos:

por razões da condição do sexo feminino;

contra pessoa com deficiência ou maior de 60 an",2026-05-08 11:41:03-03:00,https://revistaforum.com.br/politica/camara-aprova-penas-maiores-para-estupro-e-assedio-sexual/,revistaforum
Alexandre de Moraes suspende aplicação da Lei da Dosimetria,"O ministro do Supremo Tribunal Federal (STF) Alexandre de Moraes determinou neste sábado (9) a suspensão da aplicação da Lei da Dosimetria, que beneficia","Decisão vale até que o plenário da Corte analise as ações diretas de inconstitucionalidade contra a norma, promulgada após o Congresso derrubar veto do presidente Lula

00:00 A+ A-

Ler o resumo da notícia Ministro Alexandre de Moraes, do STF, suspendeu a aplicação da Lei da Dosimetria neste sábado (9) até o plenário julgar as ADIs que contestam a norma.

A medida foi tomada em resposta ao pedido de revisão da pena de Nara Faustino de Menezes, condenada pelos atos golpistas de 8 de janeiro, e por segurança jurídica.

Moraes foi designado relator das ADIs 7966 e 7967, ajuizadas pela ABI e pelo PSOL‑Rede, que questionam a constitucionalidade da lei promulgada após o Congresso derrubar o veto presidencial.

A Lei da Dosimetria (Lei 15.402/2026) reduz penas e flexibiliza a progressão de regime para condenados por tentativa de golpe e pelos eventos de 8 de janeiro.

O ministro do Supremo Tribunal Federal (STF) Alexandre de Moraes determinou neste sábado (9) a suspensão da aplicação da Lei da Dosimetria, que beneficia condenados do 8 de Janeiro e o ex-presidente Jair Bolsonaro (PL), até que o plenário da Corte julgue o mérito das ações diretas de inconstitucionalidade que questionam a norma.

A decisão do magistrado foi publicada no despacho em resposta ao pedido de alteração da pena de Nara Faustino de Menezes, condenada pelo envolvimento nos atos golpistas, e também em relação a outras solicitações formuladas sobre a aplicação da nova lei às condenações,.

Segundo Moraes, por segurança jurídica, a norma ainda não deve ser aplicada. “A superveniência de interposição de ação direta de inconstitucionalidade e, consequentemente a pendência de julgamento em controle concentrado de constitucionalidade, configura fato processual novo e relevante, que poderá influenciar no julgamento dos pedidos realizados pela defesa”, disse o ministro.

Alexandre de Moraes é relator de ações sobre Lei da Dosimetria

O ministro Alexandre de Moraes foi sorteado, nesta sexta-feira (8), como rela",2026-05-09 15:46:51-03:00,https://revistaforum.com.br/politica/alexandre-de-moraes-dosimetria/,revistaforum
Renda de até R$ 13 mil? Governo Lula aumenta acesso a programa que ajuda na reforma da casa,"O Conselho Monetário Nacional (CMN) aprovou, na terça-feira (5), novas condições financeiras para o Reforma Casa Brasil, programa do Ministério das Cidades","00:00 A+ A-

Ler o resumo da notícia CMN aprovou, em 5 de maio, novas condições financeiras para o programa Reforma Casa Brasil.

Programa passa a atender famílias com renda mensal de até R$ 13 mil, ampliando a faixa anterior de R$ 9,6 mil.

Juros totais foram reduzidos para 0,99% ao mês e o prazo de financiamento estendido de 60 para 72 meses.

Mudança visa facilitar reformas habitacionais usando recursos do Fundo Social, reduzindo prestações e ampliando o acesso.

O Conselho Monetário Nacional (CMN) aprovou, na terça-feira (5), novas condições financeiras para o Reforma Casa Brasil, programa do Ministério das Cidades voltado à qualificação de moradias já existentes. A medida dá sequência à proposta apresentada pelo Governo do Brasil em abril, durante reunião no Palácio do Planalto com o presidente Lula, quando o ministro das Cidades, Vladimir Lima, apresentou as melhorias propostas nas condições de financiamento para reformas habitacionais com recursos do Fundo Social.

O Reforma Casa Brasil passará a ser acessível a famílias com renda mensal de até R$ 13 mil e não só para aquelas com renda de até R$ 9,6 mil. Com a nova regulamentação, a taxa de juros nominal para os mutuários do Reforma Casa Brasil foi reduzida para 0,82% ao mês para as famílias com renda até R$ 9,6 mil por mês. Com encargos financeiros de 0,17% para remuneração ao Fundo Social, a taxa de juros total será de 0,99% ao mês, o que representa uma queda significativa em relação às taxas anteriores de 1,17% e 1,95% para faixas 1 e 2, respectivamente.

O prazo máximo de financiamento e amortização também foi ampliado de 60 para 72 meses. As mudanças têm como objetivo tornar o crédito mais acessível, reduzir o valor das prestações mensais e permitir que mais famílias possam realizar melhorias em suas casas sem comprometer o orçamento doméstico.

As novas condições estão vinculadas ao uso de recursos do Fundo Social, que passou a ter papel estratégico no financiamento habitacional. Em abril, o Ministério ",2026-05-07 11:15:57-03:00,https://revistaforum.com.br/politica/renda-de-ate-r-13-mil-governo-lula-aumenta-acesso-a-programa-que-ajuda-na-reforma-da-casa/,revistaforum
"Cotado para vice de Flávio Bolsonaro, Ciro Nogueira prometeu renunciar se for denunciado no caso Master","Cotado para ser candidato a vice-presidência pelo próprio Flávio Bolsonaro (PL), Ciro Nogueira (PP-PI), alvo da nova fase da Operação Compliance Zero","Flávio Bolsonaro afirmou que Ciro Nogueira ""tem todas as credenciais para ser"" seu vice e fez dobradinha com o ""amigo da vida de Vorcaro"" para atacar Lula. Após a revelação de ""vídeos íntimos"" no celular do banqueiro, senador disse que renunciaria se houvesse denunciado no caso Master.

00:00 A+ A-

Ler o resumo da notícia Ciro Nogueira, senador do PP‑PI, foi mencionado como possível candidato a vice‑presidência na chapa de Flávio Bolsonaro (PL).

Em 18 de março, Nogueira declarou que renunciará ao mandato senatorial se for denunciado na Operação Compliance Zero, que investiga o caso Banco Master.

A Operação Compliance Zero foi deflagrada nesta quarta‑feira (7) pela Polícia Federal após a apreensão de vídeos íntimos de políticos em celular de um banqueiro.

A indicação de Nogueira como vice recebeu apoio de Flávio Bolsonaro e do presidente do PL, Valdemar da Costa Neto.

Cotado para ser candidato a vice-presidência pelo próprio Flávio Bolsonaro (PL), Ciro Nogueira (PP-PI), alvo da nova fase da Operação Compliance Zero desencadeada nesta quarta-feira (7), prometeu renunciar ao mandato no Senado caso seja denunciado nas investigações sobre o escândalo financeiro do Banco Master.

Ex-ministro da Casa Civil de Jair Bolsonaro, o presidente nacional do PP deu a declaração em 18 de março, quando convocou jornalistas após a revelação de que o banqueiro teria “vídeos íntimos” de políticos e autoridades no celular periciado pela Polícia Federal – cujos dados haviam sido enviados à CPMI do INSS.

Na entrevista, Nogueira afirmou que renuncia ao seu mandato se aparecerem denúncias envolvendo seu nome.

“O CPF dele é um, o meu é outro. O que vai nortear a minha trajetória de vida é a minha história. E pode ter toda a certeza que o povo do Piauí, se surgir algum dia na vida alguma denúncia que seja comprovada, eu renuncio o meu mandato”, afirmou.

SENTIU! Ciro Nogueira disse que renunciará ao mandato caso o nome dele apareça nas investigações do Caso Banco Master. Já apareceu. Ma",2026-05-07 11:08:16-03:00,https://revistaforum.com.br/politica/ciro-nogueira-vice-de-flavio-bolsonaro-caso-master/,revistaforum
Revista Fórum,,"Constrangimento

Tati Fávaro

Em entrevista a podcast do jornal O Globo, atriz relata episódios constrangedores, diz que foi pressionada a afirmar que “estava tudo bem” e afirma que só conseguiu reagir após o caso vir à tona",,https://revistaforum.com.br/editoria/blogs/pop-noticias/,revistaforum
Moraes quer manifestação de Lula e Congresso sobre dosimetria,"O ministro Alexandre de Moraes, do Supremo Tribunal Federal, deu prazo de cinco dias para que a Presidência e o Congresso se manifestem sobre dosimetria.","00:00 A+ A-

Ler o resumo da notícia O ministro Alexandre de Moraes (STF) concedeu cinco dias para que o presidente Lula e o Congresso Nacional se manifestem sobre a Lei da Dosimetria, promulgada nesta sexta‑feira pelo presidente do Senado Davi Alcolumbre.

A lei altera a dosimetria de penas, aplicando apenas a pena mais grave em crimes de Estado Democrático de Direito e golpe de Estado praticados conjuntamente, reduzindo sentenças de atos de 8 de janeiro de 2023, inclusive de Jair Bolsonaro.

A constitucionalidade da norma está sendo contestada em duas ações – uma do PSOL e outra da Associação Brasileira de Imprensa – que alegam tratamento mais brando para crimes de ruptura institucional.

Os autores das ações também questionam o fatiamento do veto presidencial, cuja parte foi derrubada pelo Congresso na semana passada.

O ministro Alexandre de Moraes, do Supremo Tribunal Federal, deu prazo de cinco dias para que a Presidência da República e o Congresso Nacional se manifestem sobre a Lei da Dosimetria, promulgada nessa sexta-feira pelo presidente do Senado, Davi Alcolumbre (União-AP).

Moraes foi escolhido, em sorteio, para relatar as ações que contestam a constitucionalidade da lei, que reduz as penas para os condenados pelos atos golpistas de 8 de janeiro de 2023, entre eles, o ex-presidente Jair Bolsonaro.

O caso chegou ao STF a partir de duas ações – uma do PSOL e outra da Associação Brasileira de Imprensa. A nova lei prevê que em caso de crime de Estado Democrático de Direito e de golpe de Estado, quando praticados no mesmo contexto, seja aplicada a pena mais grave e não a soma delas, como era antes.

Um dos argumentos das ações é o de que, com isso, vai ser criado um tratamento mais favorável para crimes voltados à ruptura institucional. Condenados por atentados à ordem democrática passariam a receber regime mais brando do que o aplicado a autores de crimes violentos comuns.

O PSOL e a ABI também questionam o fatiamento do veto. É que apenas parte dele foi ",2026-05-09 13:23:59-03:00,https://revistaforum.com.br/politica/moraes-lula-dosimetria/,revistaforum
Revista Fórum,,"Luta

Sinpro-DF

Convocada em caráter de urgência, a paralisação dia 23/4 reivindica o pagamento integral da jornada dos contratos temporários conforme o piso da categoria. A metodologia implementada no sistema EducaDF provoca redução na remuneração e amplia precarização do trabalho docente",,https://revistaforum.com.br/editoria/movimentos/,revistaforum
Revista Fórum,Fazer jornalismo de qualidade e com compromisso social tem custos. Fórum conta com jornalistas e profissionais especializados entre os seus colaboradores.,"Fazer jornalismo de qualidade e com compromisso social tem custos. Fórum conta com jornalistas e profissionais especializados entre os seus colaboradores. Fórum não tem qualquer apoio de ONGs ou fundações internacionais e sobrevive da assinatura de leitores e publicidades programáticas. Por isso, a colaboração de entidades é fundamental para que o veículo continue fazendo seu trabalho de fortalecer as pautas progressistas. Nossos parceiros dispõem de espaço publieditorial e publicitário para divulgar suas pautas e campanhas em nosso site, alcançando milhões de leitores por mês. Saiba como a sua entidade pode se tornar parceira, entre em contato conosco pelo e-mail: [email protected]

Veja abaixo entidades parceiras da Fórum.",2025-12-05 14:02:16-03:00,https://revistaforum.com.br/parceiros/,revistaforum
Revista Fórum,,"Infraestrutura

O projeto chileno inclui cerca de 480 quilômetros de aquedutos, 17 estações de bombeamento e mais de 300 quilômetros de linhas de transmissão elétrica, além das subestações de distribuição para atender às regiões urbanas com baixo acesso à água potável",,https://revistaforum.com.br/editoria/tecnologia/,revistaforum
Revista Fórum,,"Inspirada no Fórum Social Mundial, a Fórum foi lançada com a cobertura do primeiro evento, realizado em janeiro de 2001 em Porto Alegre. Foi lá na Porto Alegre daqueles que sonhavam um outro mundo possível que a Fórum nasceu. Não é a publicação oficial do FSM, mas a revista traz no seu DNA a

força dos movimentos e a certeza de que é na multiplicidade de vozes que se faz um mundo melhor.

O número zero foi lançado em abril daquele 2001 e, devido ao sucesso junto aos movimentos sociais brasileiros, tornou-se periódica ainda em setembro. Até dezembro de 2013, suas edições em papel tiveram circulação mensal de 20 a 25 mil exemplares e eram vendidas em banca. Desde janeiro de 2014, a Fórum é só digital.

Fórum traz, diariamente, matérias, reportagens e entrevistas que buscam uma visão de mundo diferente da presente nos grandes meios de comunicação tradicionais. Hoje é uma das maiores audiências no segmento jornalístico nacional.

Para continuar existindo, a Fórum precisa do apoio de seus leitores.",2025-12-05 13:52:20-03:00,https://revistaforum.com.br/sobre/,revistaforum
Revista Fórum,,"Opinião

Entre a visão política de Juscelino Kubitschek, o gesto urbanístico de Lúcio Costa, a poesia arquitetônica de Oscar Niemeyer e a obstinação construtiva de Israel Pinheiro, a nova capital brasileira encontrou na literatura de Clarice Lispector uma das primeiras e mais penetrantes interpretações culturais de sua existência.",,https://revistaforum.com.br/editoria/opiniao/,revistaforum
Alexandre de Moraes é sorteado relator de ações contra o PL da Dosimetria,Ministro Alexandre de Moraes dá prazo para governo e Congresso se manifestarem sobre norma que diminui penas de condenados por tentativa de golpe de Estado,"Ministro dá prazo para governo e Congresso se manifestarem sobre norma que diminui penas de condenados por tentativa de golpe de Estado

ALEXANDRE DE MORAES é SORTEADO RELATOR DE AçõES CONTRA O PL DA DOSIMETRIA

ALEXANDRE DE MORAES é SORTEADO RELATOR DE AçõES CONTRA O PL DA DOSIMETRIA

00:00 A+ A-

Ler o resumo da notícia Alexandre de Moraes foi sorteado relator das ações que contestam o Projeto de Lei da Dosimetria.

O ministro do Supremo Tribunal Federal (STF) Alexandre de Moraes foi sorteado como relator das duas primeiras ações que chegaram à Corte questionando a constitucionalidade da chamada Lei da Dosimetria (Lei 15.402/2026), que reduz as penas e flexibiliza a progressão do regime de pessoas condenadas por tentativa de golpe de Estado e pelo 8 de Janeiro.

O Congresso Nacional derrubou o veto integral do presidente Luiz Inácio Lula da Silva (PT) no dia 30 de abril e, nesta sexta-feira (8), o presidente do Senado, Davi Alcolumbre (União Brasil-AP), promulgou a lei após o prazo concedido ao chefe do Executivo para a promulgação expirar.

As ações foram ajuizadas pela Associação Brasileira de Imprensa (ABI) e pela federação partidária PSOL-Rede nesta sexta. Nas Ações Diretas de Inconstitucionalidade (ADIs) 7966 e 7967 é questionada a promulgação da norma que alterou dispositivos da Lei de Execução Penal e do Código Penal.

O que dizem as ações relatadas por Alexandre de Moraes

A federação PSOL-Rede e a ABI apontam que a nova lei cria tratamento executório mais favorável para crimes voltados à ruptura institucional. Segundo as ADIs, os condenados por atentados à ordem democrática passariam a receber regime mais brando do que o aplicado a autores de crimes violentos comuns.

Outro argumento diz respeito à alegada violação ao princípio constitucional da individualização da pena, já que a Constituição exige que a sanção penal considere a gravidade concreta da conduta e as circunstâncias pessoais do réu, vedando que o legislador estabeleça mecanismos automáticos de",2026-05-08 22:09:18-03:00,https://revistaforum.com.br/politica/alexandre-de-moraes-relator-golpistas/,revistaforum
"Daniel Vorcaro planejou pagar R$ 8 mihões à rede de influenciadores, como Luiz Bacci, para atacar BC","Dono do Banco Master, Daniel Vorcaro contratou a agência Mithi, do publicitário Thiago Miranda, para produzi um plano em que pretendia gastar R$ 8 milhões","Nova revelação surge após divulgação de que, além de Ciro Nogueira, Hugo Motta teria apresentado emendas em favor de Daniel Vorcaro. Rede de influenciadores teria sido usada para atacar BC e ex-diretor da instituição.

00:00 A+ A-

Ler o resumo da notícia Daniel Vorcaro, dono do Banco Master, contratou a agência Mithi, de Thiago Miranda, para um plano de R$ 8 mi que financiaria influenciadores a atacar o Banco Central e o ex‑diretor Renato Gomes.

O “Projeto DV” desembolsou R$ 3,5 mi entre dezembro e janeiro, com publicações de Luiz Bacci, GPS Brasília, Not Journal e Charles Costa criticando a gestão de Renato Gomes.

Os contratos foram confirmados ou negados pelos influenciadores, mas a campanha foi interrompida quando a Polícia Federal iniciou investigações sobre o Banco Master.

A PF constatou ainda que Vorcaro atuou na promoção de propostas legislativas no Congresso, como a “Emenda Master” de Ciro Nogueira e iniciativa de Hugo Motta, que beneficiariam seus negócios.

Dono do Banco Master, Daniel Vorcaro contratou a agência Mithi, do publicitário Thiago Miranda, para produzi um plano em que pretendia gastar R$ 8 milhões para financiar uma rede de influenciadores para atacar o Banco Central (BC) e o ex-diretor de Organização do Sistema Financeiro e de Resolução da instituição, Renato Gomes. As informações são da Folha de S.Paulo.

LEIA TAMBÉM:

Renato Gomes: apadrinhado de Campos Neto é novo herói da Globo no caso Master; saiba quem é

Renato Gomes, herói da Globo no caso Master, manobrou no BC para entregar R$ 11 bi a André Esteves, do BTG

O “Projeto DV”, como é descrito, foi formulado pela agência de Thiago Miranda, que se classifica ainda como “fundador & sócio grupo Leo Dias” no Instagram, e chegou a distribuir R$ 3,5 milhões entre dezembro de 2025 e janeiro deste ano, quando teria sido interrompido em meio às investigações contra o banqueiro.

Um dos veículos financiados foi a BN Publicidade e Marketing, do jornalista Luiz Bacci, ex-SBT, que teria recebido R",2026-05-11 07:20:33-03:00,https://revistaforum.com.br/politica/daniel-vorcaro-r-8-mihoes-a-rede-de-influenciadores-luiz-bacci/,revistaforum
Ciro Gomes bate martelo sobre candidatura e costura aliança com a direita no Ceará,Tucano Ciro Gomes deve oficializar pré-candidatura ao Palácio da Abolição e tenta unir siglas como União Brasil e PL contra governador petista Elmano de Freitas,"Tucano deve oficializar pré-candidatura ao Palácio da Abolição e tenta unir siglas como União Brasil e PL contra o governador petista Elmano de Freitas

CIRO GOMES BATE MARTELO SOBRE CANDIDATURA E COSTURA ALIANçA COM A DIREITA NO CEARá

CIRO GOMES BATE MARTELO SOBRE CANDIDATURA E COSTURA ALIANçA COM A DIREITA NO CEARá

00:00 A+ A-

Ler o resumo da notícia Ciro Gomes confirmou sua candidatura nas próximas eleições.

O político anunciou a formação de aliança com partidos de direita.

A aliança foi costurada no estado do Ceará.

A estratégia visa ampliar a base de apoio no cenário eleitoral.

O ex-ministro Ciro Gomes (PSDB) postou na noite desta sexta-feira (8) em seu perfil no Instagram um convite para um evento no dia 16 de maio no bairro Conjunto Ceará, em Fortaleza. Embora não diga do que se trata, afirmando apenas que é um “encontro marcado com a história”, aliados apontam que será o lançamento de sua pré-candidatura ao governo do Ceará.

Segundo o jornal Diário do Nordeste, Ciro deve anunciar o lançamento na terça-feira (12) no Café da Oposição, realizado na Assembleia Legislativa do estado.

Ouvido pelo site OpiniãoCE, o deputado estadual Cláudio Pinho (PSDB) destacou que, se o ex-ministro não fosse concorrer ao governo estadual, o evento não seria realizado no Ceará. “Será candidato a governador”, cravou.

Com a confirmação da pré-candidatura, além do tucano e do governador que vai concorrer à reeleição, Elmano de Freitas (PT), a corrida pelo Palácio da Abolição contará com o senador Eduardo Girão (Novo), Jarir Pereira (Psol), Zé Batista (PSTU) e Giovanni Sampaio (PRD).

Ciro chegou a ser cogitado como possível pré-candidato à Presidência da República pelo presidente nacional da legenda, deputado Aécio Neves (MG) e desde o ano passado vinha sendo instado por aliados locais a concorrer ao governo estadual. Chegou a defender o nome do ex-prefeito de Fortaleza, Roberto Cláudio (União), para a vaga, antes de decidir concorrer.

Michelle rejeita apoio do PL a Ciro G",2026-05-08 21:15:05-03:00,https://revistaforum.com.br/politica/ciro-gomes-bate-martelo-candidatura/,revistaforum
Diretor da Anvisa responsável por gerência que suspendeu produtos da Ypê foi indicado por Bolsonaro,"Após a Agência Nacional de Vigilância Sanitária (Anvisa) ter anunciado, na quinta-feira (7), medidas relacionadas a produtos da Ypê, depois de identificar","Decisão da agência de suspender produtos por risco de contaminação gerou teorias da conspiração nas redes, mas indicação de diretor pelo ex-presidente desmonta a narrativa

00:00 A+ A-

Ler o resumo da notícia A matéria menciona apenas as organizações Anvisa e Ypê.

Não há informações adicionais sobre fatos, datas ou locais.

Não foram identificados envolvidos ou eventos específicos.

O conteúdo carece de detalhes para contextualização.

Após a Agência Nacional de Vigilância Sanitária (Anvisa) ter anunciado, na quinta-feira (7), medidas relacionadas a produtos da Ypê, depois de identificar risco de contaminação microbiológica em itens fabricados pela empresa, bolsonaristas têm divulgado nas redes sociais uma narrativa de que a empresa dona da marca estaria sofrendo “perseguição”.

Postagens também indicam um suposto uso da “máquina do Estado” contra a empresa por conta de integrantes da família Beira, controladora da Química Amparo, detentora da marca, terem feito doações que somaram R$ 1 milhão à campanha de reeleição de Jair Bolsonaro, em 2022.

O problema da narrativa esbarra no fato de que o diretor que comanda atualmente a quarta diretoria da Anvisa, Daniel Meirelles Fernandes Pereira, que abriga a Gerência-Geral de Inspeção e Fiscalização Sanitária (GGFIS), responsável pela Resolução-RE nº 1.834/2026 que determina as medidas relativas aos produtos Ypê, foi indicado em 2022 pelo então presidente Jair Bolsonaro.

O Regimento Interno da Anvisa (RDC nº 255, de 10 de dezembro de 2018) estabelece que a Gerência-Geral de Inspeção e Fiscalização Sanitária atua sob a supervisão direta da Quarta Diretoria, responsável por guiar as ações fiscais e representar a área técnica nas decisões colegiadas da Agência.

Ou seja, a gerência que determinou as medidas no caso dos produtos Ypê é supervisionada e tem uma relação de subordinação hierárquica e vinculação administrativa e estratégica ao diretor indicado por Bolsonaro.

Quem é o diretor da Anvisa indicado por Bolsonaro

Da",2026-05-09 17:03:35-03:00,https://revistaforum.com.br/politica/diretor-da-anvisa-responsavel-por-gerencia-que-suspendeu-produtos-da-ype-foi-indicado-por-bolsonaro/,revistaforum
