titulo,subtitulo,texto,data,url,portal
"Lula lança plano de R$ 11,1 bilhões contra o crime organizado; entenda","Lula lança programa de R$ 11,1 bilhões para combater o crime organizado, com ações contra facções, presídios, homicídios e tráfico de armas.","Programa Brasil Contra o Crime Organizado terá R$ 968,2 milhões em ações diretas e R$ 10 bilhões em financiamento para estados e municípios

00:00 A+ A-

Ler o resumo da notícia Lula lançou, em 12 de maio, no Palácio do Planalto, o programa Brasil Contra o Crime Organizado, com investimento total de R$ 11,1 bi.

O pacote inclui R$ 10 bi via FIIS para estados e municípios e R$ 968,2 mi em ações diretas, distribuídas em quatro eixos.

O eixo de asfixia financeira receberá R$ 302,2 mi para rastrear ativos, criar a Ficco Nacional e leiloar bens apreendidos das facções.

Os demais eixos visam reforçar presídios, esclarecer homicídios e combater o tráfico de armas em todo o país.

O presidente Luiz Inácio Lula da Silva lança nesta terça-feira (12), no Palácio do Planalto, o programa Brasil Contra o Crime Organizado, um pacote de segurança pública voltado a sufocar financeiramente facções, reforçar presídios, ampliar a elucidação de homicídios e combater o tráfico de armas.

O plano foi antecipado por O Globo como um investimento de quase R$ 1 bilhão em ações diretas. Segundo detalhamento obtido pela CNN Brasil, o programa soma R$ 11,1 bilhões quando incluídos R$ 10 bilhões em financiamento para estados e municípios por meio do Fundo Nacional de Investimento em Infraestrutura Social, o FIIS.

O núcleo operacional do pacote prevê R$ 968,2 milhões em investimentos diretos. O valor será dividido em quatro eixos: asfixia financeira das organizações criminosas, sistema prisional seguro, esclarecimento de homicídios e combate ao tráfico de armas.

Brasil Contra o Crime Organizado mira dinheiro das facções

O eixo de asfixia financeira terá R$ 302,2 milhões. A frente busca atingir o fluxo de dinheiro usado por facções para lavar recursos, comprar armas, cooptar agentes e manter estruturas criminosas em diferentes estados.

Entre as medidas previstas estão o fortalecimento das Forças Integradas de Combate ao Crime Organizado, as Ficcos, a criação de uma Ficco Nacional para operaçõ",2026-05-11 10:04:03-03:00,https://revistaforum.com.br/politica/lula-plano-crime-organizado/,revistaforum
Revista Fórum,,"Embraer

A fabricante brasileira vem assinando contratos de fornecimento e produção local no Oriente Médio, na Ásia e na Europa, e atingiu um novo recorde em sua carteira de pedidos; agora, mira o continente latino-americano",,https://revistaforum.com.br/editoria/tecnologia/,revistaforum
Moraes autoriza Walter Delgatti a cumprir pena em regime aberto,"O ministro Alexandre de Moraes, do Supremo Tribunal Federal (STF), autorizou nesta quinta-feira (7) o hacker Walter Delgatti a passar para o regime aberto de","Hacker foi condenado em maio de 2025 a oito meses e seis anos de prisão em regime fechado por invadir o site do CNJ a mando da ex‑deputada Carla Zambelli

00:00 A+ A-

Ler o resumo da notícia O ministro Alexandre de Moraes (STF) autorizou, em 7 de abril, que o hacker Walter Delgatti cumpra a pena em regime aberto.

Delgatti foi condenado em maio de 2025 a oito meses e seis anos de prisão em regime fechado por invadir o site do CNJ a mando da ex‑deputada Carla Zambelli e emitir mandado de prisão falso.

A progressão foi concedida porque o réu já cumpriu 20% da pena (582 dias), totalizando dois anos, nove meses e três dias, inclusive prisão preventiva.

Ele ainda tem direito a desconto de 100 dias na pena por ter sido aprovado no Enem para pessoas privadas de liberdade.

O ministro Alexandre de Moraes, do Supremo Tribunal Federal (STF), autorizou nesta quinta-feira (7) o hacker Walter Delgatti a passar para o regime aberto de cumprimento de pena.

Em maio de 2025, Delgatti foi condenado pelo Supremo a oito meses e seis anos de prisão em regime fechado por ter invadido o site do Conselho Nacional de Justiça (CNJ) a mando da ex-deputada Carla Zambelli, também condenada no processo, e ter emitido um mandado de prisão falso contra o ministro.

Com a progressão de regime, o hacker deverá cumprir diversas medidas, entre elas, o uso de tornozeleira eletrônica, recolhimento domiciliar noturno entre as 19h e as 6h, proibição de sair da comarca onde reside e de uso de redes sociais.

Moraes reconheceu que Delgatti tem direito à progressão de pena por ter cumprimento o equivalente a 20% da pena, equivalente a 582 dias.

O hacker já cumpriu dois anos, nove meses e três dias da pena, incluindo o período em que ficou preso preventivamente antes de ser condenado.

Além disso, Delgatti deve desconto de 100 dias na pena ao ter sido aprovado no Exame Nacional do Ensino Médio (Enem) para pessoas privadas de liberdade.",2026-05-08 07:43:40-03:00,https://revistaforum.com.br/politica/moraes-autoriza-walter-delgatti-a-cumprir-pena-em-regime-aberto/,revistaforum
“Votaria no PT”: A declaração de Kakay sobre Ciro Nogueira em meio à saída da defesa do senador,Advogado criminalista Kakay afirmou em entrevista que não discute política com clientes,"“VOTARIA NO PT”: A DECLARAçãO DE KAKAY SOBRE CIRO NOGUEIRA EM MEIO à SAíDA DA DEFESA DO SENADOR

“VOTARIA NO PT”: A DECLARAçãO DE KAKAY SOBRE CIRO NOGUEIRA EM MEIO à SAíDA DA DEFESA DO SENADOR

00:00 A+ A-

Ler o resumo da notícia Advogado Antônio Carlos de Almeida (Kakay) declarou ao Metrópoles, em 11/05, que votaria no PT se tivesse domicílio eleitoral no Piauí, estado do senador Ciro Nogueira (PP).

Kakay afirmou que não discute política com clientes, inclusive com o senador e com o governador Ibaneis, para evitar conflito de interesse.

Na mesma manhã, Kakay e Ciro Nogueira anunciaram a saída do advogado da defesa, por acordo mútuo.

A entrevista foi concedida enquanto Kakay ainda atuava como defensor de Nogueira, mas ele ressaltou que sua posição política não interferiria no caso.

Em entrevista concedida ao portal Metrópoles na manhã desta segunda-feira (11), o advogado Antônio Carlos de Almeida, o Kakay, disse que “votaria no PT” caso tivesse domicílio eleitoral no Piauí, estado do senador Ciro Nogueira (PP), seu ex-cliente.

Kakay conversou com o veículo ainda como advogado de Nogueira. Questionado se havia falado com o parlamentar sobre o mandato e como ele lidaria com as agendas no Congresso Nacional em meio à necessidade de se defender judicialmente, o entrevistado foi taxativo.

“Eu não converso sobre política porque, se eu votasse no Piauí, não votaria nele, votaria no PT”, disse Kakay. “É igual em Brasília, não converso de política com o Ibaneis porque certamente eu não vou votar nele. Vou votar nos candidatos da esquerda aqui. Sou advogado, converso sobre questões técnicas. Não dá para conversar sobre política com alguns clientes de quem gosto muito e que respeito, mas não converso sobre isso, não.”

Ainda durante a manhã, foi anunciada a saída de Kakay da defesa de Ciro Nogueira. “Conversei com ele [Ciro Nogueira] e resolvemos que seria melhor eu deixar de comum acordo a defesa. Só isso. Não aconteceu nada”, disse o advogado ao blog da jornalista And",2026-05-11 22:31:42-03:00,https://revistaforum.com.br/politica/votaria-no-pt-kakay-ciro-nogueira/,revistaforum
Alexandre de Moraes suspende aplicação da Lei da Dosimetria,"O ministro do Supremo Tribunal Federal (STF) Alexandre de Moraes determinou neste sábado (9) a suspensão da aplicação da Lei da Dosimetria, que beneficia","Decisão vale até que o plenário da Corte analise as ações diretas de inconstitucionalidade contra a norma, promulgada após o Congresso derrubar veto do presidente Lula

00:00 A+ A-

Ler o resumo da notícia Ministro Alexandre de Moraes, do STF, suspendeu a aplicação da Lei da Dosimetria neste sábado (9) até o plenário julgar as ADIs que contestam a norma.

A medida foi tomada em resposta ao pedido de revisão da pena de Nara Faustino de Menezes, condenada pelos atos golpistas de 8 de janeiro, e por segurança jurídica.

Moraes foi designado relator das ADIs 7966 e 7967, ajuizadas pela ABI e pelo PSOL‑Rede, que questionam a constitucionalidade da lei promulgada após o Congresso derrubar o veto presidencial.

A Lei da Dosimetria (Lei 15.402/2026) reduz penas e flexibiliza a progressão de regime para condenados por tentativa de golpe e pelos eventos de 8 de janeiro.

O ministro do Supremo Tribunal Federal (STF) Alexandre de Moraes determinou neste sábado (9) a suspensão da aplicação da Lei da Dosimetria, que beneficia condenados do 8 de Janeiro e o ex-presidente Jair Bolsonaro (PL), até que o plenário da Corte julgue o mérito das ações diretas de inconstitucionalidade que questionam a norma.

A decisão do magistrado foi publicada no despacho em resposta ao pedido de alteração da pena de Nara Faustino de Menezes, condenada pelo envolvimento nos atos golpistas, e também em relação a outras solicitações formuladas sobre a aplicação da nova lei às condenações,.

Segundo Moraes, por segurança jurídica, a norma ainda não deve ser aplicada. “A superveniência de interposição de ação direta de inconstitucionalidade e, consequentemente a pendência de julgamento em controle concentrado de constitucionalidade, configura fato processual novo e relevante, que poderá influenciar no julgamento dos pedidos realizados pela defesa”, disse o ministro.

Alexandre de Moraes é relator de ações sobre Lei da Dosimetria

O ministro Alexandre de Moraes foi sorteado, nesta sexta-feira (8), como rela",2026-05-09 15:46:51-03:00,https://revistaforum.com.br/politica/alexandre-de-moraes-dosimetria/,revistaforum
Revista Fórum,,"Constrangimento

Tati Fávaro

Em entrevista a podcast do jornal O Globo, atriz relata episódios constrangedores, diz que foi pressionada a afirmar que “estava tudo bem” e afirma que só conseguiu reagir após o caso vir à tona",,https://revistaforum.com.br/editoria/blogs/pop-noticias/,revistaforum
PF cita parentes do bolsonarista Denarium em investigação sobre diamantes,"PF liga familiares do bolsonarista Antonio Denarium a esquema milionário de diamantes, lavagem de dinheiro e garimpo ilegal em Roraima.","Investigação aponta suspeitas de contrabando de diamantes, lavagem de dinheiro e financiamento de garimpo ilegal envolvendo pessoas ligadas à família do ex-governador de Roraima

00:00 A+ A-

Ler o resumo da notícia Polícia Federal investigou suposto esquema de contrabando de diamantes, lavagem de dinheiro e financiamento de garimpo ilegal envolvendo familiares de Antonio Denarium, ex-governador de Roraima.

A apuração iniciou-se após abordagem da Polícia Rodoviária Federal em 2020 na BR‑174, onde os ocupantes do veículo deram versões contraditórias sobre a origem da viagem.

Investigados afirmaram ter partido da Fazenda J. Bastos, em Iracema (Roraima), porém registros indicaram passagem por Manaus e Porto Velho.

A fazenda foi declarada por Antonio Denarium à Justiça Eleitoral durante a campanha de 2018, ligando o imóvel ao possível esquema.

A Polícia Federal identificou um suposto esquema de contrabando de diamantes, lavagem de dinheiro e financiamento de garimpo ilegal envolvendo pessoas ligadas à família do ex-governador bolsonarista de Roraima Antonio Denarium, segundo reportagem publicada pelo Metrópoles nesta terça-feira (12).

O principal alvo da apuração é o empresário Fabrício de Souza Almeida, sobrinho de Denarium. De acordo com a investigação citada pela reportagem, ele é apontado como financiador de uma rede suspeita de movimentar milhões de reais por meio de empresas sem estrutura operacional compatível.

A investigação começou após uma abordagem da Polícia Rodoviária Federal em 2020, na BR-174. Na ocasião, Fabrício e outro homem deram versões contraditórias sobre uma viagem entre Roraima e Rondônia.

Segundo a PF, os dois afirmaram inicialmente que haviam saído de uma fazenda em Iracema, em Roraima. Os agentes, no entanto, encontraram registros que indicavam passagem por Manaus e Porto Velho.

PF cita fazenda ligada ao bolsonarista Denarium

A investigação cita a Fazenda J. Bastos, em Iracema, como endereço indicado por investigados ligados ao esquem",2026-05-12 10:30:32-03:00,https://revistaforum.com.br/politica/denarium-diamantes-pf/,revistaforum
Câmara aprova penas maiores para estupro e assédio sexual,"A Câmara dos Deputados aprovou projeto de lei que aumenta as penas pelos crimes de estupro, assédio sexual e registro não autorizado da intimidade sexual.","Projeto que segue para o Senado também trata de crimes relacionados a pedofilia no Estatuto da Criança e do Adolescente (ECA)

00:00 A+ A-

Ler o resumo da notícia Câmara dos Deputados aprovou o PL 3984/25, que aumenta as penas para estupro, assédio sexual e registro não autorizado de intimidade sexual.

Projeto, de autoria da deputada Delegada Katarina (PSD‑SE) e substituído pela relatora Delegada Ione (Avante‑MG), eleva a pena de estupro de 6‑10 para 8‑12 anos, e de 12‑30 para 14‑32 anos quando resulta em morte.

Quando há lesão grave, a pena de estupro passa de 8‑12 para 10‑14 anos; o assédio sexual tem a detenção aumentada de 1‑2 para 2‑4 anos.

O registro não autorizado da intimidade sexual tem a detenção elevada de 6 meses‑1 ano para 1‑3 anos, e o texto prevê punições mais severas para crimes de pedofilia no ECA.

A Câmara dos Deputados aprovou projeto de lei que aumenta as penas pelos crimes de estupro, assédio sexual e registro não autorizado da intimidade sexual. Também haverá punição maior para os crimes relacionados a pedofilia no Estatuto da Criança e do Adolescente (ECA). A proposta será enviada ao Senado.

De autoria da deputada Delegada Katarina (PSD-SE), o Projeto de Lei 3984/25 foi aprovado com substitutivo da relatora, deputada Delegada Ione (Avante-MG).

Segundo o texto, a pena por estupro passa de 6 a 10 anos de reclusão para 8 a 12 anos. Quando da conduta resultar lesão grave, a pena atual de 8 a 12 anos ficará de 10 a 14 anos. Se resultar em morte da vítima, a reclusão de 12 a 30 anos passa a ser de 14 a 32 anos.

O assédio sexual, cuja pena atual é de detenção de 1 a 2 anos, será punido com pena de detenção de 2 a 4 anos. Já o registro não autorizado da intimidade sexual, atualmente punível com detenção de 6 meses a 1 ano, passa para detenção de 1 a 3 anos.

Haverá ainda aumento de 1/3 a 2/3 da pena se os crimes contra a dignidade sexual forem cometidos:

por razões da condição do sexo feminino;

contra pessoa com deficiência ou maior de 60 an",2026-05-08 11:41:03-03:00,https://revistaforum.com.br/politica/camara-aprova-penas-maiores-para-estupro-e-assedio-sexual/,revistaforum
Revista Fórum,,"Todo dia nasce um otário Trumpistas deram 100 dólares por telefone que não existe Luiz Carlos Azenha

Misoginia Bolsonarista pré-candidato ao governo de Sergipe dispara: “Mulher em política, esqueça” Lucas Vasques

Momento decisivo Posse de Kássio no TSE e “nova” anistia: As apostas do bolsonarismo para virar a mesa outra vez Henrique Rodrigues

Embraer KC-390: o plano da Embraer para conquistar novo continente com o avião que virou febre na OTAN Anne Silva

China em Foco O que esperar do encontro entre Xi Jinping e Donald Trump Yuri Ferreira

Guerra EUA x Irã Aliança com a Coreia do Norte e submarinos leves: a estratégia do Irã para proteger o Estreito de Ormuz Anne Silva

Política Ypê: Deputado Fahur lava o bigode com o detergente Julinho Bittencourt",,https://revistaforum.com.br/noticias/,revistaforum
Justiça condena Valdemar Costa Neto a pagar R$ 20 mil ao PT por fake news sobre atos golpistas,Presidente do PL acusou o PT de organizar os atos golpistas de 2023; juiz entendeu que a fala extrapolou a liberdade de expressão e imputou crime sem provas,"Presidente do PL acusou o Partido dos Trabalhadores de organizar os atos golpistas de 2023; juiz entendeu que a fala extrapolou a liberdade de expressão e imputou crime sem provas

00:00 A+ A-

Ler o resumo da notícia Justiça do Distrito Federal condenou Valdemar Costa Neto, presidente nacional do PL, a pagar R$ 20 mil ao PT por danos morais.

O juiz Wagner Pessoa Vieira, da 5ª Vara Cível de Brasília, fixou custas processuais e honorários de 10 % sobre o valor da condenação.

A ação decorre de declarações de Valdemar em setembro de 2025, no festival de Itu (SP), onde acusou o PT de organizar os atos golpistas de 8 de janeiro de 2023.

A sentença foi publicada na segunda‑feira, 11 de maio de 2026.

A Justiça do Distrito Federal condenou o presidente nacional do PL, Valdemar Costa Neto, a pagar uma indenização de R$ 20 mil ao Partido dos Trabalhadores (PT) por danos morais, nesta segunda-feira (11).

O juiz Wagner Pessoa Vieira, da 5ª Vara Cível de Brasília, determinou também que o dirigente partidário arque com as custas processuais e pague honorários advocatícios fixados em 10% sobre o valor da condenação. Cabe recurso à decisão.

Valdemar foi processado pelo PT em setembro de 2025, por conta de declarações dadas durante um festival na cidade de Itu (SP). Na ocasião, o presidente nacional do PL afirmou que os atos golpistas de 8 de janeiro de 2023 teriam sido organizados pelo próprio Partido dos Trabalhadores.

“O grande problema nosso é que teve aquela bagunça no 8 de janeiro e o Supremo diz que aquilo foi golpe, olha só que absurdo. O camarada com pedaço de pau, um bando de pé de chinelo quebrando lá na frente. Eles classificam, falam que aquilo é golpe. Então a Débora do batom ia ser ministra da Fazenda? Não tinha ninguém. Quem preparou aquilo foi o PT”, disse Valdemar na ocasião.

À época, o presidente nacional do PT, Edinho Silva, ao saber da declaração, anunciou que iria processar o dirigente. “Ele está falando uma mentira, ele sabe que é mentira. Nós tivemos ",2026-05-11 23:21:35-03:00,https://revistaforum.com.br/politica/valdemar-costa-neto-pt/,revistaforum
Conheça a incrível história do homem que descobriu a vala clandestina de Perus,"Graças à obstinação de Toninho Eustáquio, que nos deixou nesta semana, foram descobertas mais de mil ossadas humanas, um dos mais absurdos crimes praticados pela ditadura militar","Graças à obstinação de Toninho Eustáquio, que nos deixou nesta semana, foram descobertas mais de mil ossadas humanas, um dos mais absurdos crimes praticados pela ditadura militar

CONHEçA A INCRíVEL HISTóRIA DO HOMEM QUE DESCOBRIU A VALA CLANDESTINA DE PERUS

CONHEçA A INCRíVEL HISTóRIA DO HOMEM QUE DESCOBRIU A VALA CLANDESTINA DE PERUS

00:00 A+ A-

Ler o resumo da notícia Antonio Pires Eustáquio, “Toninho”, ex‑administrador do Cemitério Dom Bosco, faleceu nesta quarta‑feira (06) em Perus, São Paulo.

Toninho revelou a existência da Vala Clandestina de Perus, onde foram enterrados corpos de desaparecidos políticos da ditadura militar.

O ex‑presidente da Comissão da Verdade de SP, Adriano Diogo, classificou a descoberta como a mais importante sobre os crimes da ditadura e o considerou herói nacional.

Diogo criticou a falta de abertura completa dos arquivos da ditadura, questionando quantas valas ainda permanecem desconhecidas.

Morreu nesta quarta-feira (06), Antonio Pires Eustáquio, conhecido como Toninho, ex-administrador do Cemitério Dom Bosco, em Perus, na zona norte de São Paulo. Toninho foi reconhecido nacionalmente por ter revelado a existência da chamada Vala Clandestina de Perus, onde foram enterrados corpos de desaparecidos políticos durante a ditadura militar brasileira.

A morte foi lamentada por autoridades e defensores dos direitos humanos. O ex-presidente da Comissão da Verdade do Estado de São Paulo, Adriano Diogo, definiu Toninho como “um grande herói do povo brasileiro”.

“Foi um grande herói do povo brasileiro, sem o devido reconhecimento. Esse homem merece uma estátua. Desnudou a ditadura. Foi a descoberta mais importante sobre os crimes da ditadura”, afirmou Diogo.

O ex-presidente da comissão também criticou a ausência de abertura completa dos arquivos do período militar. “Quantas valas ainda existem no Brasil que não foram descobertas? Por que o governo brasileiro é tão covarde que não permite a abertura dos arquivos da ditadura?”, questiono",2026-05-08 10:47:15-03:00,https://revistaforum.com.br/politica/incrivel-historia-homem-descobriu-vala-clandestina-perus/,revistaforum
"Ypê, a nova cloroquina: por que o gado toma banho e até bebe o detergente","Em nova crise de insanidade, até Michelle Bolsonaro repostou vice-prefeito de São Paulo incentivando a população a usar o produto interditado pela Anvisa","Em nova crise de insanidade, até Michelle Bolsonaro repostou vice-prefeito de São Paulo incentivando a população a usar o produto interditado pela Anvisa

YPê, A NOVA CLOROQUINA: POR QUE O GADO TOMA BANHO E ATé BEBE O DETERGENTE

YPê, A NOVA CLOROQUINA: POR QUE O GADO TOMA BANHO E ATé BEBE O DETERGENTE

00:00 A+ A-

Ler o resumo da notícia A Anvisa e a Vigilância Sanitária de São Paulo suspenderam 25 produtos da Ypê (detergentes, sabão em pó e desinfetante) na última quinta‑feira.

A inspeção apontou descumprimento de normas críticas, falhas na garantia de qualidade e risco de contaminação microbiológica, caracterizando quadro de risco sanitário elevado.

Vídeos nas redes sociais mostram apoiadores de Bolsonaro consumindo e defendendo os detergentes da Ypê, gerando comparações com a campanha da cloroquina.

Apesar das sanções, parte da extrema‑direita tem manifestado apoio público à empresa.

A maluquice se espalhou pelas redes mais uma vez e de maneira insana. Em uma crise de sanidade que lembra a campanha pelo uso da cloroquina durante a pandemia do coronavírus, vários vídeos inacreditáveis têm sido postados nas redes. Neles, bolsonaristas aparecem defendendo os produtos da Ypê, tomando banho e até mesmo bebendo o detergente (veja abaixo).

A fábrica, conforme noticiado por esta Fórum, teve 25 produtos, das linhas de detergentes, sabão em pó e desinfetante, suspensos pela Agência Nacional de Vigilância (Anvisa) e pela Vigilância Sanitária de São Paulo na última quinta-feira.

Risco sanitário elevado

Segundo a agência, foram identificados “descumprimentos relevantes em etapas críticas do processo produtivo”, incluindo falhas nos sistemas de garantia da qualidade, produção e controle de qualidade.

O relatório afirma ainda que os problemas encontrados comprometem as boas práticas de fabricação de saneantes e indicam risco sanitário, com possibilidade de contaminação microbiológica e presença de micro-organismos patogênicos nos produtos.

A inspeção concluiu que o c",2026-05-11 08:19:06-03:00,https://revistaforum.com.br/politica/ype-cloroquina-gado-toma-banho-bebe-detergente/,revistaforum
Nunes Marques é sorteado para julgar pedido que tenta anular condenação de Bolsonaro por golpe,Ministro Nunes Marques avaliará pedido de revisão criminal da condenação do ex-presidente por tentativa de golpe de Estado,"Ministro avaliará pedido de revisão criminal da condenação do ex-presidente por tentativa de golpe de Estado

00:00 A+ A-

Ler o resumo da notícia Ministro Nunes Marques foi sorteado nesta segunda‑feira (11) como relator da revisão criminal da condenação de Jair Bolsonaro por golpe.

O pedido foi encaminhado à Segunda Turma do STF, integrada por Nunes Marques, André Mendonça, Gilmar Mendes, Dias Toffoli e Luiz Fux.

A defesa sustenta erro judiciário, contestando a tramitação pela Primeira Turma e a voluntariedade da delação de Mauro Cid.

Também alega falta de acesso integral às provas da investigação como fundamento para anular a condenação.

O ministro Nunes Marques, do Supremo Tribunal Federal (STF), foi sorteado nesta segunda-feira (11) como relator do pedido de revisão criminal da defesa do ex-presidente Jair Bolsonaro (PL).

Conforme determina o regimento interno do Supremo, a revisão criminal foi enviada para a Segunda Turma da Corte. Além de Nunes Marques, o colegiado é composto por André Mendonça, Gilmar Mendes, Dias Toffoli e Luiz Fux.

Os advogados de Bolsonaro sustentam que a condenação do ex-presidente deve ser revista porque houve “erro judiciário”. A defesa contesta a tramitação da ação penal que, segundo o recurso, deveria ter sido julgada pelo plenário da Corte, e não pela Primeira Turma.

A defesa do ex-presidente afirma ainda que a delação do ex-ajudante de ordens de Bolsonaro, o ex-tentente-coronel Mauro Cid, não teria sido voluntária e deve seria anulada. A suposta falta de acesso integral às provas da investigação também é suscitada no recurso.

Com informações da Agência Brasil",2026-05-11 19:58:41-03:00,https://revistaforum.com.br/politica/nunes-marques-revisao-bolsonaro/,revistaforum
Revista Fórum,,"Lugares do Brasil

Anne Silva

Na região do semiárido, inserido no bioma da Caatinga e porta de entrada para a Chapada Diamantina, um município baiano é opção para a modalidade de ecoturismo “rústico” que tem chamado a atenção dos brasileiros nos últimos anos",,https://revistaforum.com.br/editoria/brasil/nordeste/,revistaforum
