titulo,subtitulo,texto,data,url,portal
"Ciro Nogueira se pronuncia após devassa da PF sobre propinas de Vorcaro, do Master","A defesa do senador Ciro Nogueira (PP-PI), feita pelo advogado Antônio Carlos de Almeida Castro, o Kakay, se pronunciou sobre a operação da Polícia Federal","Senador foi alvo de nova fase da Operação Compliance Zero, que investiga suspeitas de fraudes financeiras ligadas ao Banco Master

00:00 A+ A-

Ler o resumo da notícia Senador Ciro Nogueira (PP‑PI) foi alvo de nova fase da Operação Compliance Zero da Polícia Federal, que investiga supostas fraudes financeiras ligadas ao Banco Master e propina a Vorcaro.

Seu advogado, Antônio Carlos de Almeida Castro (Kakay), afirmou que o parlamentar não participou de atos ilícitos e que a investigação se baseia apenas em troca de mensagens.

Kakay classificou as medidas investigativas como precipitadas e pediu controle de legalidade a ser analisado pelas Cortes Superiores.

Em vídeo no Instagram, Nogueira declarou que a “Emenda Master” visa proteger correntistas, e não o próprio banco.

A defesa do senador Ciro Nogueira (PP-PI), feita pelo advogado Antônio Carlos de Almeida Castro, o Kakay, se pronunciou sobre a operação da Polícia Federal (PF) contra o parlamentar em nova fase da Operação Compliance Zero, que investiga suspeitas de fraudes financeiras ligadas ao Banco Master. A defesa afirmou, em nota à imprensa, que repudia “qualquer ilação de ilicitude” que Nogueira está comprometido em contribuir com a Justiça para “esclarecer que não teve qualquer participação em atividades ilícitas e nos fatos investigados”.

Na nota, a defesa critica a operação afirmando que ela foi baseada em “mera troca de mensagens”. “Medidas investigativas graves e invasivas tomadas com base em mera troca de mensagens, sobretudo por terceiros, podem se mostrar precipitadas e merecem a devida reflexão e controle severo de legalidade, tema que deverá ser enfrentado tecnicamente pelas Cortes Superiores muito em breve”, diz um trecho da nota.

Já em entrevista coletiva a jornalistas na frente do condomínio onde mora Ciro Nogueira em Brasília, Kakay afirmou que o mandado de busca a apreensão o causou “estranheza”. “O que a defesa estranhou é o fato de ter uma busca e apreensão, que é uma medida altamente inv",2026-05-07 12:05:18-03:00,https://revistaforum.com.br/politica/ciro-nogueira-pronunciamento-operacao-pf-propinas-vorcaro-master/,revistaforum
"Além de viagem a paraíso fiscal, Ciro Nogueira passou carnaval na Indonésia com empresário do Tigrinho","O senador Ciro Nogueira (PP-PI) está no epicentro de uma série de escândalos que envolvem suspeitas de corrupção, lavagem de dinheiro e tráfico de influência.","Mergulhado no escândalo do Master por supostamente receber propina de Vorcaro, Ciro Nogueira ainda mantém relações suspeitas com Fernandin OIG, investigado pela CPI das Bets e ligado a jogo ilegal no Brasil

00:00 A+ A-

Ler o resumo da notícia Ciro Nogueira passou o Carnaval na Indonésia.

Ele esteve acompanhado de empresário ligado ao deputado Tigrinho.

A viagem ocorreu antes de um deslocamento planejado para um paraíso fiscal.

O fato foi divulgado pela imprensa, suscitando investigação.

O senador Ciro Nogueira (PP-PI) está no epicentro de uma série de escândalos que envolvem suspeitas de corrupção, lavagem de dinheiro e tráfico de influência. Além de ser investigado por suas relações com Daniel Vorcaro, do Banco Master, de quem teria recebido propina e ganhado viagens, Nogueira também se vê no centro de um novo escândalo, envolvendo uma viagem de luxo a um paraíso fiscal.

O caso, que veio à tona nas últimas semanas, envolve o transporte irregular de malas em um voo privado para uma ilha conhecida por ser um ponto de lavagem de dinheiro. A denúncia de que as malas de Nogueira e outros passageiros, entre eles o presidente da Câmara, Hugo Motta (Republicanos-PB), não passaram pelo raio-X da fiscalização no aeroporto fizeram a Polícia Federal (PF) abrir uma investigação por possíveis crimes de contrabando, descaminho e prevaricação.

O caso é apenas mais um episódio que amplia o alcance das suspeitas que envolvem o senador. A revista Piauí, em reportagem de março, já havia revelado que Ciro Nogueira passou o carnaval em uma viagem luxuosa à Indonésia, com o empresário Fernando Oliveira Lima, mais conhecido como Fernandin OIG, apontado como o responsável por introduzir o Fortune Tiger, conhecido como Jogo do Tigrinho, que é ilegal, no país. O empresário foi um dos principais alvos da CPI das Bets, que investiga o setor de apostas ilegais, e também é proprietário de várias plataformas de apostas online.

Ciro Nogueira nas asas do Tigrinho ao paraíso fisca

Mais rec",2026-05-09 12:25:50-03:00,https://revistaforum.com.br/politica/ciro-nogueira-carnaval-tigrinho/,revistaforum
Revista Fórum,,"Debates

Renê Gardim

Eles estão vendo uma oportunidade para ampliar ainda mais as vantagens e benefícios que o “Agro Tech e Pop” tem, enquanto os pequenos que efetivamente produzem o alimento para os brasileiros lutam para manter suas propriedades produtivas",,https://revistaforum.com.br/editoria/debates/,revistaforum
"Flávio Bolsonaro escala Nikolas, Zanatta e Gayer para novo “gabinete do ódio” de 2026","Flávio Bolsonaro escalou Nikolas Ferreira, Julia Zanatta e Gustavo Gayer para tropa digital da pré-campanha ao Planalto.","Sob o pretexto de combater fake news, senador articula tropa de choque digital; Fórum já havia revelado elo com exército de clipadores de Nikolas comandado por aliados de Pablo Marçal.

00:00 A+ A-

Ler o resumo da notícia Senador Flávio Bolsonaro (PL‑RJ) criou uma tropa digital de choque com parlamentares aliados para enfrentar acusações nas redes durante sua pré‑campanha ao Planalto.

A articulação foi definida em reunião no gabinete do senador, em Brasília, com Julia Zanatta (PL‑SC), Gustavo Gayer (PL‑GO), Maurício Marcon (PL‑RS) e Nikolas Ferreira (PL‑MG) por videoconferência.

Em vídeo obtido pela Revista Fórum, Flávio pediu “milagre” para “libertar o Brasil das garras do governo” e o grupo entoou o bordão “Acorda Brasil”.

O exército de clipadores de Nikolas Ferreira está conectado a generais da campanha de Pablo Marçal, ampliando a rede de apoio digital.

Flávio Bolsonaro (PL-RJ) escalou deputados bolsonaristas com forte atuação nas redes para integrar uma frente digital de sua pré-campanha à Presidência em 2026. A reunião ocorreu no gabinete do senador, em Brasília, e teve a presença de Julia Zanatta (PL-SC), Gustavo Gayer (PL-GO) e Maurício Marcon (PL-RS). Nikolas Ferreira (PL-MG) participou por videoconferência.

A informação foi publicada pela coluna Painel. O grupo foi chamado para atuar na reação a acusações que a campanha de Flávio classificar como “fake news”.

Nikolas Ferreira é o nome central na articulação de Flávio Bolsonaro

A entrada de Nikolas Ferreira é o dado político mais relevante da movimentação. O deputado mineiro tem uma das maiores estruturas digitais do bolsonarismo e já vinha orbitando a pré-campanha de Flávio Bolsonaro antes da reunião no gabinete.

A Fórum revelou em março que Flávio Bolsonaro participou de uma videochamada com clipadores ligados ao entorno digital de Nikolas Ferreira. Gustavo Gayer também aparece na reunião virtual.

Na gravação obtida pela Fórum, Flávio fala a integrantes do grupo “Acorda Brasil”, faz uma oração e",2026-05-08 10:29:28-03:00,https://revistaforum.com.br/politica/flavio-bolsonaro-tropa-digital/,revistaforum
Política de Privacidade,"Esta Política de Privacidade descreve como a Revista Fórum (“Revista”) coleta, utiliza, armazena e protege os dados pessoais dos usuários que acessam seus","Introdução

Esta Política de Privacidade descreve como a Revista Fórum (“Revista”) coleta, utiliza, armazena e protege os dados pessoais dos usuários que acessam seus conteúdos e serviços digitais. Ao utilizar qualquer serviço disponibilizado pela Revista, o usuário declara estar ciente e de acordo com as práticas descritas neste documento.

Coleta de Dados Pessoais

A Revista pode coletar dados fornecidos diretamente pelo usuário, como nome, e-mail, dados de assinatura, informações de pagamento e dados enviados em formulários, comentários ou áreas de interação. Também podem ser coletadas informações de navegação, incluindo endereço IP, páginas acessadas, dispositivo, navegador e cookies.

Finalidades do Tratamento

Os dados pessoais coletados pela Revista são utilizados para possibilitar o acesso a conteúdos, gerenciar assinaturas, enviar comunicações, melhorar a experiência do usuário, personalizar conteúdos, garantir a segurança da plataforma e cumprir obrigações legais aplicáveis.

Compartilhamento de Dados

A Revista não vende dados pessoais. O compartilhamento poderá ocorrer somente com fornecedores e parceiros necessários para a operação dos serviços, como sistemas de pagamento, hospedagem e plataformas de envio de mensagens, sempre respeitando esta Política de Privacidade e a legislação vigente.

Comentários e Conteúdo Gerado por Usuários

A Revista oferece espaços de interação, como fóruns e seções de comentários. O usuário é responsável pelo conteúdo que publica. Mensagens ofensivas, discriminatórias, ilícitas ou que violem direitos de terceiros poderão ser removidas, conforme os Termos de Uso.

Cookies e Tecnologias de Rastreamento

A Revista utiliza cookies e tecnologias semelhantes para melhorar o desempenho do site, analisar métricas, personalizar experiências e exibir publicidade relevante. O usuário pode ajustar as preferências de cookies diretamente em seu navegador.

Segurança da Informação

A Revista adota medidas técnicas e administrativas para p",2025-11-27 09:48:21-03:00,https://revistaforum.com.br/politica-de-privacidade/,revistaforum
Placar da Fórum: Erika Hilton lidera com escala 6x1,"Erika Hilton na liderança, com 684 mil interações, em recorte dominado pela pauta do fim da escala 6x1 no Placar da Fórum","Segunda edição do monitoramento da DataFórum, de 30 de abril a 6 de maio, registra 3,63 milhões de interações; Rogério Correia e Guilherme Boulos completam o pódio

00:00 A+ A-

Ler o resumo da notícia Erika Hilton lidera o Placar da Fórum na segunda semana (30 abr a 06 mai) com a maior pontuação no ranking de desempenho digital da base governista.

A liderança foi impulsionada pela mobilização contra a escala 6x1, tema que concentrou os posts mais engajados no período do 1º de maio.

Rogério Correia ficou em segundo lugar (33,3 pts, 289 mil interações, 24 publicações) e Guilherme Boulos em terceiro (31 pts, 310 mil interações, 30 publicações).

O ranking pondera volume total de interações, eficiência por publicação e taxa média de engajamento; o relatório completo pode ser baixado.

O Placar da Fórum chega à segunda semana com Erika Hilton novamente na liderança do ranking de desempenho digital da base governista. No recorte de 30 de abril a 6 de maio, o monitoramento da DataFórum registrou 3,63 milhões de interações em publicações sobre o governo Lula, pautas do governo federal e temas defendidos pela base.

A liderança de Erika foi puxada pela mobilização pelo fim da escala 6×1, tema que dominou os posts de maior engajamento no período do 1º de Maio. A deputada somou 684.331 interações, fez 11 publicações no recorte e alcançou 84 pontos no índice composto.

A segunda semana confirma a força vista na estreia do Placar da Fórum, mas com volume menor de interações totais. Na primeira edição, o levantamento havia registrado 5,9 milhões de interações. Agora, o debate ficou mais concentrado na pauta trabalhista, na reação ao Congresso e em publicações sobre decisões legislativas. O dowload completo do relatório pode ser feito em aqui

Placar da Fórum tem Erika Hilton em 1º; Rogério Correia e Boulos completam o pódio

Erika Hilton liderou com folga. Ela teve 684.331 interações, média de 62 mil interações por post e taxa média de 5,1%. A distância para o segundo colocado",2026-05-07 11:39:05-03:00,https://revistaforum.com.br/politica/placar-da-forum-escala-6x1/,revistaforum
Flávio Bolsonaro oferece cargo ao pai em eventual governo e promete anistia ampla a golpistas,"Senador Flávio Bolsonaro afirma que o ex-presidente, que cumpre prisão domiciliar por tentativa de golpe, será seu ""Norte""","00:00 A+ A-

Ler o resumo da notícia Flávio Bolsonaro propôs ao pai, Jair Bolsonaro, ocupar cargo em eventual governo futuro.

O senador afirmou que haverá anistia ampla para os envolvidos em atos golpistas.

A declaração foi feita em declarações recentes, sem data ou local específicos.

A proposta surge no contexto de debates sobre a participação da família Bolsonaro na política.

O senador e pré-candidato à Presidência da República Flávio Bolsonaro (PL-RJ) declarou, em entrevista à CNN na noite desta sexta-feira (8), que seu pai, Jair Bolsonaro (PL), teria “o cargo que quisesse” no governo caso vença as eleições de 2026.

Questionado sobre o fato de ter dito, em uma entrevista anterior para a emissora, que seu pai, caso se tornasse elegível e fosse solto a tempo, não o substituiria como candidato e nem poderia ter um cargo, o senador negou ter feito a afirmação.

“Se não me engano, não foi isso que falei, me perguntaram quem seria o presidente de fato, seria o Flávio Bolsonaro ou Jair Bolsonaro? E obviamente eu respondi que, em sendo a vontade do povo, o presidente será Flávio Bolsonaro. E o Jair Bolsonaro vai ser sempre o meu Norte, minha bússola, minha referência, é a pessoa com quem eu me consulto, que tem experiência inigualável e um faro político que eu desconheço alguém que tem algo parecido no Brasil”, disse o presidenciável.

Em seguida, o senador cogitou contar com o ex-presidente em um eventual governo seu. “Se ele quiser exercer algum cargo no meu governo, é óbvio que ele vai exercer, sim”, disse. “Nesse meio tempo, entre as eleições e a nossa posse em janeiro do ano que vem, além de um grande pacote de ajustes fiscais, pretendo sim fazer, usar essa força que um presidente recém-eleito tem junto ao Congresso Nacional para, dentre outras coisas, aprovar uma anistia ampla, geral e irrestrita, para que o presidente Bolsonaro possa, no dia 6 de janeiro, subir a rampa do Planalto junto comigo”, prometeu.

Flávio Bolsonaro falou sobre Ciro Nogueira

Flávio Bo",2026-05-08 20:08:02-03:00,https://revistaforum.com.br/politica/flavio-bolsonaro-oferece-cargo-ao-pai/,revistaforum
Pastoral do Povo de Rua do Padre Júlio recebe prêmio da Alesp,"Ao anunciar a homenagem, a deputada Ediane Maria afirmou que a atuação do religioso representa “o verdadeiro amor de Cristo”","Ao anunciar a homenagem, a deputada Ediane Maria afirmou que a atuação do religioso representa “o verdadeiro amor de Cristo”

PASTORAL DO POVO DE RUA DO PADRE JúLIO RECEBE PRêMIO DA ALESP

PASTORAL DO POVO DE RUA DO PADRE JúLIO RECEBE PRêMIO DA ALESP

00:00 A+ A-

Ler o resumo da notícia Pastoral do Povo de Rua da Arquidiocese de São Paulo receberá o Colar de Honra ao Mérito da Alesp nesta segunda‑feira (11) às 19h.

O Padre Júlio Lancellotti, coordenador da Pastoral, será o representante na cerimônia.

A homenagem, proposta pela deputada estadual Ediane Maria (PSOL), reconhece o acolhimento, alimentação e defesa de pessoas em situação de rua.

A Pastoral atua na Mooca (Zona Leste) e desenvolve projetos como o Núcleo de Convivência São Martinho de Lima e a Casa Viva.

A Pastoral do Povo de Rua da Arquidiocese de São Paulo receberá nesta segunda-feira (11) o Colar de Honra ao Mérito da Assembleia Legislativa do Estado de São Paulo (Alesp), principal honraria concedida pela Casa.

A cerimônia está marcada para as 19h e terá como representante da entidade o Padre Júlio Lancellotti, coordenador da Pastoral e uma das principais referências nacionais na defesa dos direitos da população em situação de rua.

A homenagem foi proposta pela deputada estadual Ediane Maria, do PSOL. Segundo a parlamentar, o reconhecimento destaca o trabalho realizado pela Pastoral no acolhimento, na oferta de alimentação e na defesa de pessoas em situação de vulnerabilidade social.

Padre Júlio Lancellotti

Ligada à paróquia São Miguel Arcanjo, na Mooca, Zona Leste da capital paulista, a Pastoral do Povo de Rua atua diretamente junto à população em situação de rua da cidade de São Paulo.

Além do trabalho desenvolvido na Pastoral, padre Júlio Lancellotti participou da criação de projetos sociais voltados ao atendimento de pessoas vulneráveis, como o Núcleo de Convivência São Martinho de Lima, no Belenzinho, responsável pela distribuição de refeições, e a Casa Viva, iniciativa de acolhimento de c",2026-05-11 10:31:58-03:00,https://revistaforum.com.br/politica/pastoral-do-povo-de-rua-padre-julio-premio-alesp/,revistaforum
Bolsonaro tem crise nervosa por causa de plano de Eduardo para o Senado e a direita entra em guerra em SP,"Bolsonaro tem crise nervosa com plano de Eduardo para lançar André do Prado ao Senado, queria Mello Araújo e vê Salles incendiar racha da direita em SP.","Ex-presidente queria Mello Araújo, não André do Prado; Salles aproveitou o racha, repostou ataques a aliados do 03 e virou peça central da briga pelo Senado.

BOLSONARO TEM CRISE NERVOSA POR CAUSA DE PLANO DE EDUARDO PARA O SENADO E A DIREITA ENTRA EM GUERRA EM SP

BOLSONARO TEM CRISE NERVOSA POR CAUSA DE PLANO DE EDUARDO PARA O SENADO E A DIREITA ENTRA EM GUERRA EM SP

00:00 A+ A-

Ler o resumo da notícia Jair Bolsonaro rejeitou a chapa que Eduardo Bolsonaro propôs para o Senado em 2026, gerando tensão na direita paulista.

O plano de Eduardo previa André do Prado, presidente da Alesp e aliado de Valdemar Costa Neto, como titular e ele na primeira suplência.

Bolsonaro preferia o coronel Mello Araújo, vice‑prefeito de São Paulo, e alegou não ter sido consultado sobre a escolha de Prado.

O desentendimento foi amplificado nas redes por Ricardo Salles, pré‑candidato ao Senado pelo Novo, evidenciando a crise interna no bolsonarismo.

Jair Bolsonaro virou o estopim de uma nova guerra na extrema direita paulista ao rejeitar a chapa que Eduardo Bolsonaro tenta empurrar para o Senado em 2026. O plano coloca André do Prado, presidente da Alesp e aliado de Valdemar Costa Neto, como titular, com Eduardo na primeira suplência. Bolsonaro queria outro nome: o coronel Mello Araújo, vice-prefeito de São Paulo.

Segundo o SBT News, Bolsonaro disse nos últimos dias que não foi consultado pelo PL sobre a escolha de André do Prado e manifestou irritação com Valdemar Costa Neto e com o apoio dado por Eduardo. A coluna Radar, da Veja, publicou que o ex-presidente teve uma crise nervosa ao saber da operação do filho. Nas redes, Ricardo Salles, pré-candidato ao Senado pelo Novo, aproveitou o racha e passou a martelar a crise dentro do próprio bolsonarismo.

Bolsonaro queria Mello, mas Eduardo fechou com André

O nó político é simples e explosivo. Bolsonaro queria Mello Araújo, um nome mais identificado com a ala ideológica do PL. Eduardo Bolsonaro, que está nos Estados Unidos, decidiu ba",2026-05-08 12:54:52-03:00,https://revistaforum.com.br/politica/bolsonaro-eduardo-guerra-sp/,revistaforum
Luz para Todos: Lula anuncia R$ 130 bilhões em distribuição de energia até 2030,"O presidente da República, Luiz Inácio Lula da Silva, participou nesta sexta-feira, 8 de maio, do evento “SENTE A ENERGIA: investimentos em energia e","00:00 A+ A-

Ler o resumo da notícia Em 8 de maio, em Brasília, o presidente Lula anunciou R$ 130 bi em investimentos na distribuição de energia até 2030.

O recurso beneficiará 16 distribuidoras que atendem consumidores em 13 estados brasileiros.

O programa Luz Para Todos, criado em 2003, já levou energia a 3,6 milhões de domicílios e 17,2 milhões de pessoas.

O ministro de Minas e Energia, Alexandre Silveira, qualificou o aporte como a maior rodada de modernização das redes de distribuição da história do país.

O presidente da República, Luiz Inácio Lula da Silva, participou nesta sexta-feira, 8 de maio, do evento “SENTE A ENERGIA: investimentos em energia e melhorias no Luz Para Todos”, em Brasília. Durante a cerimônia, o presidente destacou que é “muito gratificante apresentar à sociedade brasileira a ideia de que podemos ter um país em que nunca mais haja apagão”.

Na ocasião, também foram anunciados investimentos em distribuição de energia elétrica, totalizando R$ 130 bilhões até 2030, contemplando 16 distribuidoras que atendem consumidores de 13 estados brasileiros.

“Eu lembro que, quando nós lançamos o programa, a coisa mais extraordinária que eu vi foi uma mulher dizendo que foi a primeira vez que viu o filho dormindo, porque, quando você tem um candeeiro, você não vê, é tudo um vulto”, disse Lula.

Esse programa é revolucionário. Às vezes, é triste, porque tem gente que mora vizinho à hidrelétrica e não tem energia elétrica. Não é porque custa caro, é porque, muitas vezes, as pessoas mais humildes são tratadas como se fossem invisíveis”, acrescentou.

O programa Luz Para Todos foi criado em 2003 e já alcançou 3,6 milhões de domicílios e beneficiou 17,2 milhões de pessoas, consolidando-se como uma das iniciativas de inclusão elétrica mais ambiciosas do mundo. Com energia elétrica assegurada a 99,8% da população brasileira, segundo o Instituto Brasileiro de Geografia e Estatística (IBGE), o programa avança rumo à universalização plena desse serviço essenci",2026-05-11 07:49:12-03:00,https://revistaforum.com.br/politica/luz-para-todos-lula-anuncia-r-130-bilhoes-em-distribuicao-de-energia-ate-2030/,revistaforum
"Após Ciro Nogueira virar alvo da PF, Flávio Bolsonaro tenta se descolar de escândalo","Pré-candidato ao Planalto classifica denúncias como ""graves"" e confia em André Mendonça para relatar caso que envolve Ciro Nogueira","00:00 A+ A-

Ler o resumo da notícia Ciro Nogueira passou a ser alvo da Polícia Federal.

Flávio Bolsonaro busca se desvincular do escândalo relacionado a Nogueira.

A tentativa de distanciamento ocorre após a abertura da investigação da PF.

O objetivo de Flávio é evitar associação política ao

O senador e pré-candidato à Presidência Flávio Bolsonaro (PL-RJ) se manifestou a respeito da operação da Polícia Federal que teve entre os alvos o presidente do PP e ex-ministro da gestão de Jair Bolsonaro (PL), senador Ciro Nogueira (PI).

A nota não menciona diretamente o aliado, mas o texto diz que os fatos devem ser apurados com “rigor e transparência pelas autoridades competentes, sempre com respeito ao devido processo legal”.

Flávio afirmou ainda confiar na relatoria do ministro do Supremo Tribunal Federal (STF) André Mendonça, indicado por seu pai, à corte, esperando “uma ampla apuração”.

Ciro Nogueira já foi citado por Flávio, em entrevista, como um possível vice em sua chapa. “E com relação a vice, que eu saiba que está ali, que já levantou o dedo e acho que tem todas as credenciais para ser é o Ciro. Mas essa é uma decisão que se toma muito mais na frente, depende da composição partidária, depende do perfil que a gente está buscando”, afirmou. “Agora, o perfil do Ciro é um bom perfil. É nordestino, é de um partido grande e forte. Tem ali a lealdade que ele sempre teve ao presidente Bolsonaro durante o ministério dele, foi ministro do presidente Bolsonaro.”

O que diz a PF sobre Ciro Nogueira

A Polícia Federal (PF) afirma ter indícios de que o senador Ciro Nogueira recebia pagamentos mensais que variaram entre R$ 300 mil e R$ 500 mil do dono do Banco Master, Daniel Vorcaro, preso preventivamente em Brasília desde o início de março de 2026.

O dirigente do PP também teria outras benesses, como o custeio de viagens internacionais, hospedagens e despesas em restaurantes, além de desfrutar de voos privados e de imóveis de alto padrão pertencentes ao banqueiro.

Em tr",2026-05-07 21:27:17-03:00,https://revistaforum.com.br/politica/ciro-nogueira-pf-flavio-bolsonaro/,revistaforum
