titulo,subtitulo,texto,data,url,portal
PF suspeita que dinheiro de Vorcaro tenha custeado despesas de Eduardo Bolsonaro nos EUA,"Ex-deputado diz que história 'não se sustenta', é tosca e envolve 'tentativa de assassinato de reputação'","Brasília

A Polícia Federal suspeita que recursos ligados a Daniel Vorcaro, do Banco Master, foram usados para financiar despesas do ex-deputado Eduardo Bolsonaro (PL-SP) nos Estados Unidos, onde ele vive desde fevereiro de 2025.

Esses recursos teriam sido transferidos pela Entre Investimentos e Participações, que tem ligações com Vorcaro, a um fundo controlado por aliados de Eduardo e sediado no Texas, nos EUA.

A empresa é a mesma utilizada no financiamento do filme ""Dark Horse"" (""azarão"", em inglês), que trata da vida do ex-presidente Jair Bolsonaro (PL).

Por meio de postagem em rede social, Eduardo rebateu nesta quinta-feira (14) as suspeitas, disse que a história veiculada ""é tosca"" e que tudo não passa de uma tentativa ""de assassinato de reputação, que tenta atrelar ilicitude em patrocínio para um filme"".

""A história de que recebi dinheiro do fundo de investimento não se sustenta e é tosca. Meu status migratório não permitiria, se isso tivesse acontecido o próprio governo americano me puniria. No meu processo migratório expliquei às autoridades americanas toda a origem dos meus recursos e não tive qualquer problema, porque aqui não vigora um regime de exceção"", disse.

Mais cedo, em entrevista à Globonews, o senador Flávio Bolsonaro (PL-RJ) confirmou que recursos pagos por Vorcaro para a produção do filme passou pelo Havengate Development Fund, fundo registrado no Texas e representado por Paulo Calixto, advogado de Eduardo. O parlamentar negou, porém, que esse dinheiro tenha sido destinado a bancar as despesas do irmão nos EUA.

O ex-deputado Eduardo Bolsonaro (PL-SP), em evento conservador nos EUA - Callaghan O'Hare - 27.mar.26/Reuters

A PF pretende entender se os recursos —que teriam sido enviados a pedido do dono do Master— foram, de fato, usados para financiar o filme ou se uma parte serviu para custear a vida de Eduardo no país, para onde ele se mudou alegando perseguição de Alexandre de Moraes, ministro do STF (Supremo Tribunal Federal), e de onde já",2026-05-14 13:04:00,https://www1.folha.uol.com.br/poder/2026/05/pf-suspeita-que-dinheiro-de-vorcaro-tenha-custeado-despesas-de-eduardo-bolsonaro-nos-eua.shtml,folha
"Servidor trabalha para redes sociais da mulher de Nunes, pré-candidata a deputada em SP","Após questionamento da Folha, prefeitura publicou exoneração de Breno de Souza, que vem atuando como 'videomaker' da primeira-dama da capital paulista","São Paulo

Um servidor comissionado da Prefeitura de São Paulo trabalhou em horário comercial para a pré-campanha da primeira-dama Regina Nunes (MDB), pré-candidata a deputada estadual.

Breno de Souza Santos, nomeado em julho de 2025 como assessor na Secretaria Municipal de Direitos Humanos, atua como ""videomaker"" para a mulher de Ricardo Nunes (MDB), gravando vídeos para publicação nas redes sociais. Até esta semana, ele recebia R$ 5.637 mensais da gestão municipal, para uma jornada de 40 horas semanais.

Servidor comissionado da Prefeitura de São Paulo gravando vídeos da primeira-dama Regina Nunes em evento na Câmara Municipal, no dia 8 de maio - Reprodução Instagram

A Folha acompanhou durante uma semana os stories de Breno, um tipo de publicação no Instagram que some depois de 24 horas. Ele costumava compartilhar seu cotidiano no trabalho, acompanhando Regina em agendas em diversos horários do dia.

A reportagem procurou a assessoria de comunicação da prefeitura para comentar o caso na terça-feira (12). Na quarta (13), a exoneração de Breno foi publicada no Diário Oficial do município.

Em nota, a prefeitura afirmou que o servidor ""exerceu as atividades de sua atribuição, atuando em trabalhos externos e internos de edição de vídeos, publicações em redes sociais e demais atividades do setor de comunicação da pasta"".

A prefeitura negou que o servidor tenha prestado serviços para a primeira-dama enquanto esteve lotado na secretaria. A gestão municipal encaminhou documento de um processo interno que indica que Breno pediu exoneração no último dia 7 —a exoneração, porém, só passaria a ter efeito a partir de segunda-feira (11), conforme o ofício.

Os registros obtidos pela reportagem nas redes sociais do servidor e de Regina mostram que ele trabalhou para a pré-campanha todos os dias da semana passada, quando ainda constava como funcionário da secretaria, de acordo com os documentos encaminhados pela própria prefeitura.

Também há ao menos três vídeos nas redes da p",2026-05-13 23:00:00,https://www1.folha.uol.com.br/poder/2026/05/servidor-trabalha-para-redes-sociais-da-mulher-de-nunes-pre-candidata-a-deputada-em-sp.shtml,folha
"Últimas notícias da Folha sobre Política, Economia e Cultura","Últimas notícias da Folha em tempo real; principais reportagens sobre Política do Brasil e do Mundo, Economia, Esporte, Famosos, Saúde, Cultura e mais","ÚLTIMAS NOTÍCIAS

Leia as mais recentes notícias do Brasil e do mundo publicadas na Folha sobre política, economia, cultura, saúde e bem-estar, além de reportagens do cotidiano de São Paulo e de outros estados",2026-05-15 23:26:00,https://www1.folha.uol.com.br/ultimas-noticias/,folha
Minas Gerais (MG): notícias sobre o estado,"Leia notícias, entrevistas, reportagens especiais e confira vídeos sobre Minas Gerais no Folha Tópicos","Gostaria de receber as principais notícias do Brasil e do mundo?

OUTRO LADO: defesa entrou com pedido de habeas corpus no STF e aguarda julgamento

Compartilhar Empresário condenado por matar ciclista Marina Harkot é preso em MG após 5 meses foragido

OUTRO LADO: Gestão Mateus Simões não respondeu até a publicação do texto

Pré-candidato enfrenta cenário incerto de palanque no estado, e nenhuma opção é vista como ideal

Comissão especial deve ser instalada nos próximos dias e partido quer sugerir mudanças no texto

Compartilhar Líder do PL diz que governo terá que apresentar contrapartida se quiser aprovar fim da 6x1

Secretaria de Saúde de MS diz que acompanha caso e acionou órgãos de controle

Valor envolve antecipação de receitas e foi condicionado à renovação de contratos de concessão

Compartilhar Copasa vai repassar R$ 350 milhões a cidades de MG em acordo para privatização

Ex-governador de Goiás sai em defesa de presidenciável mineiro em evento em Belo Horizonte

Ministro do STF pediu que ex-governador de Minas Gerais seja investigado após vídeo

Compartilhar Gilmar critica 'piadas com coisas sérias' e cita boneco de Zema como homossexual: 'Será que não é ofensivo?'

Grupos interessados em se tornar investidores de referência devem se cadastrar na B3 a partir desta sexta (24)

Compartilhar Governo de MG divulga detalhes da oferta de ações da Copasa, e privatização entra na reta final

Ministro afirma que escândalo do Banco Master tem endereço na Faria Lima, não em Brasília

Ex-governador de Minas Gerais, que é cotado para vice na chapa do PL, critica em entrevista políticos que buscam enriquecimento

Compartilhar Zema diz que difere de Flávio por não buscar benefícios no Estado e volta a atacar STF

Pré-candidato a presidente pelo Novo busca se consolidar como maior crítico da corte

Compartilhar Zema dobra aposta nas críticas ao STF e vê ganho político em ofensiva de Gilmar

Ministro do STF disse que reconhece erro, mas afirma que vai enfrentar 'indústria ",2026-05-15 19:37:00,https://www1.folha.uol.com.br/folha-topicos/minas-gerais-estado/,folha
Alcolumbre e Múcio se reúnem após constrangimento no TSE,Ministro da Defesa e presidente do Senado estavam reunidos durante divulgação de áudio de Flávio,"Brasília

Um dia após o clima de constrangimento instalado no TSE (Tribunal Superior Eleitoral) entre o presidente Lula (PT) e o presidente do Senado, Davi Alcolumbre (União-AP), o ministro da defesa, José Múcio, se reuniu por horas com o senador na Residência Oficial do Senado.

O presidente Lula entre os presidentes do Senado, Davi Alcolumbre, e do TSE, Kassio Nunes Marques, durante cerimônia no TSE. - Adriano Machado - 12.mai.26/REUTERS

Múcio é um dos nomes designados por Lula para articular junto ao presidente do Senado após a rejeição ao nome de Jorge Messias ao STF (Supremo Tribunal Federal).

A reunião com Múcio ocorreu na tarde desta quarta-feira (13) enquanto o áudio entre Flávio Bolsonaro (PL-RJ) e Daniel Vorcaro era publicizado.

Na conversa com o dono do banco Master, o senador bolsonarista cobrava a quantia de R$134 milhões que seria paga por Vorcaro para financiar o filme do ex-presidente Jair Bolsonaro, que tem previsão de estreia em setembro deste ano.

Enquanto integrantes da equipe de Flávio se reuniam para tratar do gerenciamento da crise instalada no comitê da pré-campanha, o ministro da defesa de Lula articulava a reaproximação de Alcolumbre com o presidente da república. O governo tenta marcar um encontro a sós entre os dois ainda nesta semana.

Oficialmente, o encontro foi para tratar sobre questões relacionadas ao ministério e teria sido previamente marcado no dia anterior. Nos bastidores, no entanto, interlocutores de Alcolumbre dizem que foi mais um passo dado na abertura ao diálogo para tentar melhorar o clima entre os chefes dos Poderes.",2026-05-14 06:00:00,https://www1.folha.uol.com.br/colunas/painel/2026/05/alcolumbre-e-mucio-se-encontram-um-dia-apos-constrangimento-em-posse-do-tse.shtml,folha
PT quer CPI do Master contra Flavio Bolsonaro,Ofensiva é discutida pela bancada do partido no Congresso após descoberta de que Daniel Vorcaro teria bancado filme sobre Jair Bolsonaro,"Brasília

Em uma ofensiva contra Flávio Bolsonaro (PL-RJ), o PT vai cobrar a instalação da CPMI do Master e bater bumbo nas redes sociais após a divulgação de áudios em que o presidenciável cobra mais de R$130 milhões de Daniel Vorcaro para financiar o filme sobre o ex-presidente Jair Bolsonaro.

As mensagens e áudios foram divulgados pelo Intercept Brasil.

O senador Flavio Bolsonaro cumprimenta o presidente do Senado, Davi Alcolumbre, durante sessão que derrubou o veto de Lula ao PL da Dosimetria. - Sergio Lima - 30.abr.26/AFP

A estratégia é associar o presidenciável às fraudes do banco Master. Para isso, o discurso nas redes será o de que a família Bolsonaro foi uma das mais beneficiadas por Daniel Vorcaro. Na internet, petistas querem insistir no discurso do ""Bolsomaster"".

A avaliação de dirigentes petistas é de que as informações são graves e Flávio terá trabalho para se explicar.

Nas conversas, o senador e Daniel Vorcaro se chamam de ""irmãos"", marcam reuniões e jantares e combinam o pagamento para financiar o filme que promete ser lançado neste ano.

O PT vai aproveitar também para cobrar a instalação da CPI do Master. Há uma avaliação interna de que a cúpula do Congresso não vai desengavetar a comissão em ano eleitoral, mas os petistas querem fazer barulho e levar a pressão para as redes sociais.

""É insustentável a decisão da presidência do Congresso Nacional de não ler o requerimento que pede a instalação da CPMI do Master. O PT vai para o debate público para exigir que ela seja instalada"", disse ao Painel o líder do PT na Câmara, deputado Pedro Uczai (PT-SC).

O discurso será o de que o presidenciável teme que mais informações sejam descobertas e, por isso, que a CPI do Master não sai do papel.",2026-05-13 16:26:00,https://www1.folha.uol.com.br/colunas/painel/2026/05/pt-vai-cobrar-cpi-do-master-e-usar-redes-para-associar-fraudes-a-flavio-bolsonaro.shtml,folha
TV Folha: Notícias e Entrevistas em Vídeos,"Acesse a TV Folha e assista a diversos vídeos online com notícias e entrevistas sobre mercado, esportes, cultura, educação, turismo e outros segmentos.","'Desconectados' aborda educação no período da pandemia

O Brasil foi um dos países com maior tempo de escolas fechadas durante a pandemia. O segundo semestre de 2021 marcou o retorno presencial na maior parte do país",2026-05-15 19:03:00,https://www1.folha.uol.com.br/tv/,folha
Venezuela: notícias sobre o país,"Venezuela é um país da América do Sul governado pela líder interina Delcy Rodríguez. Em 2026, Donald Trump capturou Nicolás Maduro, após os EUA atacarem a Venezuela. Leia as últimas notícias internacionais na Folha. ",Compartilhar China diz que será um 'grande ano' na relação com os EUA em aceno a Washington,2026-05-15 12:39:00,https://www1.folha.uol.com.br/folha-topicos/venezuela/,folha
Trabalhe na Folha,,"Leia abaixo as respostas às perguntas mais freqüentes: COMO É FEITA A SELEÇÃO PARA A REDAÇÃO?

A Folha seleciona profissionais por meio de concursos, que no geral têm três etapas: análise de currículo, prova e entrevista pessoal.

A seleciona profissionais por meio de concursos, que no geral têm três etapas: análise de currículo, prova e entrevista pessoal. OS PROGRAMAS DE TRAINEE GARANTEM VAGA NA REDAÇÃO?

Não. Os programas de treinamento da Folha destinam-se à formação jornalística. Não há compromisso de contratar os trainees ao fim do programa, embora historicamente a maior parte deles consiga trabalho na Redação após concluir o curso.

Não. Os programas de treinamento da Folha destinam-se à formação jornalística. Não há compromisso de contratar os trainees ao fim do programa, embora historicamente a maior parte deles consiga trabalho na Redação após concluir o curso. COMO SE FICA SABENDO DAS VAGAS? Os anúncios são divulgados no site da Folha e no jornal impresso quando as vagas são abertas, portanto, sem periodicidade fixa. O blog Novo em Folha, o site do Treinamento e a página do Treinamento no Facebook também divulgam a abertura de inscrições para concursos e programas de treinamento do jornal.

QUAIS SÃO OS CRITÉRIOS?

Os critérios gerais para seleção de profissionais são: boa formação técnica e cultural; capacidade de redigir com clareza, exatidão, concisão e rapidez; disciplina e criatividade; independência e senso crítico; iniciativa; afinidade com o projeto editorial da Folha . Dependendo da vaga, podem ser exigidos conhecimentos e habilidades específicas.

Os critérios gerais para seleção de profissionais são: Dependendo da vaga, podem ser exigidos conhecimentos e habilidades específicas. E SE EU QUISER TRABALHAR EM OUTRAS ÁREAS DA EMPRESA?

Se você acredita que sua qualificação é mais adequada para outros setores do Grupo Folha e não para a Redação, envie seu currículo para o e-mail: rhvagas@grupofolha.com.br.

Você poderá acompanhar as vagas abertas e ",,https://www1.folha.uol.com.br/folha/trabalhe/vagas.html,folha
"Empreendedorismo social, diversidade, ESG - Folha","Notícias sobre empreendedorismo social, diversidade, ESG e reportagens de impacto socioambiental","A filantropia não substitui o poder público; e não deve. Seu valor está em mobilizar recursos onde as políticas públicas ainda não chegaram, experimentar modelos antes de escalá-los e sustentar agendas que resistam às inevitáveis descontinuidades políticas. Em um país que conjuga potência e desigualdade, a articulação entre iniciativa privada e ação pública é parte indispensável das soluções",2026-05-15 16:59:00,https://www1.folha.uol.com.br/folha-social-mais/,folha
"ESG: Ambiental, Social e Governança Corporativa","Informe-se sobre políticas socioambientais e de governança empresariais no Brasil e no mundo. Sustentabilidade, pautas afirmativas e mais.","A sigla, em inglês, significa Environmental, Social and corporate Governance, algo como melhores práticas ambientais, sociais e de governança em português. Esses são os princípios que norteiam a agenda e as organizações que abraçam a causa. Acompanhe aqui tudo sobre ESG.



Assuntos relacionados: Economia | Investimentos",2026-02-10 18:40:00,https://www1.folha.uol.com.br/mercado/folha-esg/,folha
Moraes intima 'Débora do batom' a explicar gps sem sinal,Cabeleireira está em prisão domiciliar com tornozeleira eletrônica desde o ano passado,"Brasília

O ministro Alexandre de Moraes, do STF (Supremo Tribunal Federal), intimou a cabeleireira Débora Rodrigues a se explicar sobre períodos em que ela esteve sem sinal de GPS. Conhecida como ""Débora do Batom"", ela está em prisão domiciliar e com tornozeleira eletrônica pela condenação nos atos golpistas de 8 de janeiro de 2023.

O relator pediu informações à defesa da cabeleireira sobre o descumprimento das condições de monitoramento no fim de abril. Em 1° de maio, os advogados dela responderam não ter havido tentativa de fuga.

Ela foi condenada a 14 anos de prisão pelos crimes de tentativa de abolição violenta do Estado democrático de Direito, golpe de Estado, dano ao patrimônio tombado, dano qualificado com violência e associação criminosa armada.

As ausências de sinal foram registradas entre 20 e 26 de abril e depois entre 27 de abril e 3 de maio.

Débora Rodrigues dos Santos foi identificada pichando estátua na Praça dos Três Poderes com batom. - Gabriela Biló - 8.jan.23/Folhapress

Débora está cumprindo a pena em prisão domiciliar desde o ano passado.

""Os registros de ausência de sinal de GPS, mencionados nos autos, não indicam qualquer tentativa de evasão ou descumprimento deliberado das condições impostas. Tais ocorrências decorrem, com elevada probabilidade, de falhas técnicas inerentes ao sistema de monitoramento eletrônico, não sendo aptas a caracterizar falta disciplinar"", disse a defesa.

""A apenada permaneceu em sua residência, inexistindo qualquer elemento concreto que demonstre violação das condições estabelecidas.

Depois das primeiras explicações, foram encaminhadas às autoridades novas comunicações de ausências de sinal, entre 27 de abril e 3 de maio.

Na última terça (12), o procurador-geral da República, Paulo Gonet, se manifestou, a pedido de Moraes.

""A natureza e as características dos registros, de poucos minutos, por vários dias seguidos, mostram-se compatíveis com as justificativas apresentadas. No entanto, não have",2026-05-15 13:15:00,https://www1.folha.uol.com.br/blogs/brasilia-hoje/2026/05/moraes-intima-debora-do-batom-a-explicar-descumprimento-de-medidas-cautelares.shtml,folha
Futebol Internacional,Primeiro jornal em tempo real em língua portuguesa. Um jornal a serviço do Brasil,"Superada pela Bósnia, Itália fica fora da Copa do Mundo pela terceira vez seguida

Azzurra joga com um a menos desde o fim do primeiro tempo e perde nos pênaltis",2026-05-15 10:44:00,https://www1.folha.uol.com.br/esporte/futebolinternacional/,folha
FPE prepara 'cardápio' de compensações aos empresários,Deputados vão propor que acordado entre patrão e empregado valha sobre o legislado,"Brasília

A Frente Parlamentar do Empreendedorismo (FPE) montou um ""cardápio"" com as compensações aos empresários com o fim da escala 6x1.

O deputado Joaquim Passarinho durante discurso no plenário da Câmara dos Deputados. - Paulo Sérgio - 10.mai.22/Câmara dos Deputado

A lista contém pontos da reforma trabalhista que os deputados querem aproveitar para incluir na Constituição. Isso porque a discussão sobre a redução da jornada de trabalho está sendo feita via PEC (Proposta de Emenda à Constituição).

Um dos pontos é que o acordado valha sobre o legislado. Ou seja, o que for combinado entre patrão e empregado via convenção coletiva e pode valer mais do que o previsto em lei.

Outra defesa da frente é que casos que envolvam funcionários terceirizados sejam levados à Justiça comum e não mais à do Trabalho.

O presidente da Frente, deputado Joaquim Passarinho (PL-PA), diz que as medidas são um ""alívio"" ao empresário, apesar de não mexerem diretamente na folha de pagamento.

""Hoje, eu trabalho com a realidade do 5x2. E não dá mais para falar de desoneração, então vamos trabalhar com o que é possível"", disse ao Painel.

A FPE quer incluir as compensações ainda no relatório do deputado Léo Prates (Republicanos-BA). O objetivo é que as propostas já sejam aprovadas na comissão especial para que a PEC já vá ao plenário da Câmara em comum acordo.",2026-05-13 15:00:00,https://www1.folha.uol.com.br/colunas/painel/2026/05/frente-do-empreendedorismo-quer-retomar-pontos-da-reforma-trabalhista-para-compensar-fim-da-6x1.shtml,folha
Rio de Janeiro (RJ): notícias sobre o estado,"Na página sobre Rio de Janeiro no Folha Tópicos você encontra todas as notícias, entrevistas e vídeos relacionados ao estado","Compartilhar Quem é William Mebarak Chadid, pai de Shakira que tem 94 anos e saúde frágil

Quem é William Mebarak Chadid, pai de Shakira que tem 94 anos e saúde frágil

Ele veio ao Rio com a filha e passou mal antes do show, o que motivou atraso de mais de uma hora",2026-05-15 23:00:00,https://www1.folha.uol.com.br/folha-topicos/rio-de-janeiro-estado/,folha
Polícia Federal: notícias sobre a PF,Leia notícias sobre a atuação da Polícia Federal (PF) e acompanhe operações realizadas pela instituição policial no Folha Tópicos,"Gostaria de receber as principais notícias do Brasil e do mundo?

Compartilhar Lula levará cinco ministros e diretor da PF em visita a Trump

OUTRO LADO: defesa afirma que adolescente teve acesso indevido à arma e que homem não participou nem incentivou o ataque

Compartilhar Governo do Acre exonera padrasto de adolescente após ataque em escola de Rio Branco

OUTRO LADO: defesa diz que parlamentar nega a prática de quaisquer atos ilícitos e prestará esclarecimentos necessários

Compartilhar Moraes mantém prisão de Thiago Rangel, diz que Alerj não pode rever medida e critica 'sistema de impunidade'

Proposta de delação de Vorcaro está com a PF e a PGR

Compartilhar André Mendonça tem discussão dura com defesa de Vorcaro por divergência em delação

Aparato policial, jurídico e legislativo teve melhorias, como expansão do Gaeco, varas especializadas e mais operações

Compartilhar Ataques do PCC há 20 anos em SP revelaram fragilidades que persistem no combate ao crime organizado

Defesa diz que senador não teve participação em atividades ilícitas; primo de Vorcaro é preso

Compartilhar PF faz buscas contra Ciro Nogueira e diz que Vorcaro pagava R$ 500 mil por mês ao senador

Compartilhar Vorcaro pagou cartão de crédito de Ciro Nogueira em viagem com namorada, indica diálogo

Defesa do senador do PP disse repudiar ilações e afirma que parlamentar não participou de atividades ilícitas

Defesa diz que senador do PP 'repudia qualquer ilação de ilicitude sobre suas condutas'

Compartilhar Vorcaro pagou voos de jatinho, restaurante no Caribe e apartamento para Ciro Nogueira, diz PF

Estudantes tentam forçar reabertura das negociações pelo fim da greve, encerradas unilateralmente pela instituição

79 mandados são cumpridos em 17 cidades de cinco estados: MG, SP, RJ, ES e MA

Senador fez viagens com empresário de bets e chegou a ser gravado por Joesley Baptista

Compartilhar Ciro Nogueira integrou núcleo duro de Bolsonaro, tentou ser vice de Tarcísio e buscou apoio de Lula

Com",2026-05-15 23:00:00,https://www1.folha.uol.com.br/folha-topicos/policia-federal/,folha
Mais Populares,"Siga a Folha e fique informado sobre tudo o que acontece no Brasil e no mundo. Notícias sobre política, economia, cultura, esporte, entretenimento e mais.","Tudo a Ler

China, terra do meio *

Lá Fora

Notícias do dia

Tudo + um pouco

Você também gostaria de:

Receber informações sobre produtos e serviços da Folha de S. Paulo",,https://www1.folha.uol.com.br/maispopulares/,folha
Todas,Todas,"Tudo a Ler

China, terra do meio *

Lá Fora

Notícias do dia

Tudo + um pouco

Você também gostaria de:

Receber informações sobre produtos e serviços da Folha de S. Paulo",2026-05-15 15:00:00,https://www1.folha.uol.com.br/todas/,folha
